video_id,comment,comment_published_at,date
TGWvTWtlvZo,Does it still have grainy display?,2025-05-06T02:53:19Z,2025-05-06
TGWvTWtlvZo,Got my s24u today and it's boxy shape looks so good 👍,2025-04-26T18:29:31Z,2025-04-26
TGWvTWtlvZo,"An Updated SoC, Downgraded Design, & a Downgraded S-Pen doesn't make you BETTER, let alone the BEST!

S24 Ultra STILL THE BEST PHONE EVERRR!!!",2025-04-16T15:29:34Z,2025-04-16
TGWvTWtlvZo,meanwhile the S23 Ultra is 2000 RON or more in my country and S22 Ultra entered the reasonable price category (1000 RON),2025-04-17T01:15:37Z,2025-04-17
TGWvTWtlvZo,"Watching from my S24 Ultra, same color, 512 GB. I just wish it had One UI 7",2025-04-18T23:17:09Z,2025-04-18
TGWvTWtlvZo,Go camera and --> gallery last video and close it.. some time even yet its strugles.. but its smoother than ever i am very happy,2025-04-21T20:30:23Z,2025-04-21
TGWvTWtlvZo,S24 Ultra or S25+? Considering buying one of these two rn since they're within my budget range.,2025-05-18T16:11:56Z,2025-05-18
TGWvTWtlvZo,The s24 ultra is the last true ultra in the current line-up until I believe the S Pen will be coming back to the S26 Ultra.,2025-04-16T14:37:03Z,2025-04-16
TGWvTWtlvZo,I don't think I will update to the s25u or s26u if the 26 comes out similar to the 25. Also might consider going to other companies like one or google if they are better . My s24ultra was the first comeback to android after being iPhone only for the last 10+ years,2025-05-04T20:34:02Z,2025-05-04
TGWvTWtlvZo,Would it be worth it to buy the s24 ultra at the end of the year or beginning of next year? I’m trying to save money to buy the phone around then,2025-04-19T08:42:36Z,2025-04-19
TGWvTWtlvZo,I bought my 2 weeks ago 😊😊,2025-04-21T23:14:45Z,2025-04-21
TGWvTWtlvZo,will completely use up the up to 7 years software updates til it breaks.,2025-05-26T16:39:09Z,2025-05-26
TGWvTWtlvZo,Holding on to my S24 Ultra until the S27 Ultra comes..,2025-04-19T05:32:29Z,2025-04-19
TGWvTWtlvZo,"I have the Pixel 9XL, & iPhone 13 Pro Max, but if I were to get a Samsung, it would be the S24Ultra. Last great Samsung phone.",2025-04-16T14:35:51Z,2025-04-16
TGWvTWtlvZo,"In my opinion, the iPhone 15 Pro Max and the iPhone 16 Pro Max are some of the best overall options for a smartphone. I love my iPhone 15 Pro Max and can’t wait to upgrade to the 17 Pro Max.",2025-04-16T13:33:27Z,2025-04-16
TGWvTWtlvZo,Honestly the S24 Ultra or even the S23 Ultra are still my dream phone.. in the used market inside the US or EU they prolly cost less than half of their launch's price.. but not here in my country.. they still cost considerably high.. and i dont know what will happen even after the Trump's tariff..,2025-04-16T15:57:31Z,2025-04-16
TGWvTWtlvZo,I'm still undecided which one to get. This one or s25+ 😅,2025-04-22T05:01:49Z,2025-04-22
TGWvTWtlvZo,Off topic.  My s25U has taken a major hit on battery life since updating it. Ive had to charge it 2 times yesterday and it was only around 7:00PM its low af on battery now. Samsung needs to get their shit together this is messed up. The s24U is a damn nice phone though & worth the price if you're wanting an ultra.  I just don't like that coating on the s24U. It looks terrible after 6 months 😕 use a screen protector.,2025-04-16T14:01:51Z,2025-04-16
TGWvTWtlvZo,Hello Nick is there the galaxy a55 vs a56 comparison in plans?,2025-04-16T13:55:47Z,2025-04-16
TGWvTWtlvZo,"""Awesome content."" 🔥",2025-04-16T23:52:55Z,2025-04-16
ePdbj2bZ-Ro,"Inspired by minerals, what is your favorite color of the Galaxy S24 Series? 👀 Learn more: http://smsng.co/S24Series_Design-Film_ytp",2024-01-31T06:31:27Z,2024-01-31
ePdbj2bZ-Ro,"So I'm using a Galaxy S23 and I can only say the following:
I JUST ADORE YOU SAMSUNG!❤❤❤ You nailed it once again and the Galaxy S24 is no exception obviously. Bravo!👏👏👏",2024-03-12T13:32:04Z,2024-03-12
ePdbj2bZ-Ro,"I've always had flagship phones of Samsung, since the S5, S7 Edge, Note 9, and s24 ultra . But I had recently switched from s24 Ultra to s24+ and I couldn't be more happier 😃!Yes, there are many features on the s24 ultra such as the anti-reflective glass S pen 200mb camera and a couple smart features. But the problem I had was that the edges of the ultra kept digging into my hands and it was unbearably heavy. When I switched to the s24+ 0:42 , it was like a breath of fresh air because it felt so good in the hand and it was so lightweight and the edges of the phone made it non-slip and in my opinion this is the best phone I've ever had. That being said, if I can change one thing that would make it the best phone of all time right now would be to have it in the previous previous model's colour of s23+ (Phantom Black). 💯🖤",2024-06-12T17:13:49Z,2024-06-12
ePdbj2bZ-Ro,The animators gonna need a raise for this ❤,2024-01-30T20:03:26Z,2024-01-30
ePdbj2bZ-Ro,This has to be the most beautiful mobile phone trailer ever made,2025-01-24T21:21:28Z,2025-01-24
ePdbj2bZ-Ro,Loving my S24 Ultra so freaking smooth,2024-01-30T20:07:25Z,2024-01-30
ePdbj2bZ-Ro,Just incredible !!!! The trailer is beautiful as the phone ! Samsung is probably the best brand for the phone !,2024-01-30T20:05:33Z,2024-01-30
ePdbj2bZ-Ro,Beautiful design! I love my samsung phone ❤❤❤❤❤❤❤,2024-07-19T00:22:37Z,2024-07-19
ePdbj2bZ-Ro,Watching this on an S24 Ultra just hits different,2024-05-11T15:33:04Z,2024-05-11
ePdbj2bZ-Ro,"Great, almost 1 year of the s24 and in 11 days for the s25 series",2025-01-11T15:57:15Z,2025-01-11
ePdbj2bZ-Ro,"Best Design, Period!",2025-03-22T12:51:46Z,2025-03-22
ePdbj2bZ-Ro,Song?,2024-04-27T15:43:11Z,2024-04-27
ePdbj2bZ-Ro,Watching this video on my S24 Ultra titanium violet ❗🫡,2024-04-18T11:42:59Z,2024-04-18
ePdbj2bZ-Ro,"I'm watching this video on Galaxy S24+. Obviously, I like it in many ways, including cameras, displays, batteries, and storage space, as it moves from Galaxy Z Flip 3 to S24+. With this phone this year, college life will unfold next year.",2024-11-05T11:36:58Z,2024-11-05
ePdbj2bZ-Ro,@samsung What was the song name 😄,2024-10-14T11:08:04Z,2024-10-14
ePdbj2bZ-Ro,0:30 lightsaber incoming,2024-11-10T08:19:26Z,2024-11-10
ePdbj2bZ-Ro,"I'm telling you, this is the best samsung commercial ever",2025-01-07T01:17:20Z,2025-01-07
ePdbj2bZ-Ro,I REALLY LIKE THE CAMERA PLACEMENT OF S23-S24 TIMELESS.,2024-09-21T14:57:40Z,2024-09-21
ePdbj2bZ-Ro,"I watch from my samsung s24 ultra, in particular it was this film design that inspired me to buy exactly 24 ultra and my expectations were met, I used samsung a10 and came back, no regrets",2025-06-02T10:19:09Z,2025-06-02
ePdbj2bZ-Ro,Still don't know the song name..😢,2024-10-23T03:42:02Z,2024-10-23
ePdbj2bZ-Ro,anyone found the song for this video ?,2024-06-09T22:50:55Z,2024-06-09
ePdbj2bZ-Ro,the last good Ultra phone,2025-01-26T17:21:33Z,2025-01-26
ePdbj2bZ-Ro,Watching from my S24 Plus💯,2024-08-16T19:46:20Z,2024-08-16
ePdbj2bZ-Ro,Design wonderful 🎉🎉,2025-03-06T12:58:57Z,2025-03-06
ePdbj2bZ-Ro,The song Felt like OVER THE HORIZON ❤❤❤,2025-05-31T22:37:47Z,2025-05-31
ePdbj2bZ-Ro,THAT IS WHAT WE MAKE SAMSUNG😊😊😊😊❤❤❤❤❤❤❤❤🎉🎉🎉🎉,2025-06-08T16:46:00Z,2025-06-08
ePdbj2bZ-Ro,I have just bought the S24+ and i'm pretty happy with it 😊,2024-07-30T09:29:11Z,2024-07-30
ePdbj2bZ-Ro,Watching from z Fold 6. This video slaps well done,2024-07-30T15:10:22Z,2024-07-30
ePdbj2bZ-Ro,Watch this video from s23. Hello from Russia,2024-01-30T20:02:12Z,2024-01-30
ePdbj2bZ-Ro,"Brilliant smartphone from Samsung but still we are not getting the complete user experience because there is no multi user feature and the charging speed lasts over an hour to charge the S24 Ultra from 0 to 100!

Half the price Ultra flagship smartphones from many other brands offer these features and Samsung must add these features as well!",2024-01-31T18:43:26Z,2024-01-31
ePdbj2bZ-Ro,Got the s24 Fe titanium love it .,2025-03-02T16:29:05Z,2025-03-02
ePdbj2bZ-Ro,Sold my iPhone 15 pro and bought a Samsung s24 ultra.  Samsung s24 ultra more user friendly than iPhone. I can do more with s24 ultra than iPhone .,2024-01-30T22:53:42Z,2024-01-30
ePdbj2bZ-Ro,Better than 25 ultra,2025-01-26T22:25:13Z,2025-01-26
ePdbj2bZ-Ro,"For anyone who’s wondering what the song is, it’s Fallen by Trianglereality",2024-06-02T06:26:44Z,2024-06-02
ePdbj2bZ-Ro,Me enamore❤,2025-02-18T19:24:12Z,2025-02-18
ePdbj2bZ-Ro,"I'm Not interested with the S24 series however I'm going to order the Green S23 ULTRA this week as my very first Samsung Galaxy smartphone device, I'll wait until The S25 Ultra comes out next year.",2024-02-12T15:25:57Z,2024-02-12
ePdbj2bZ-Ro,Samsung Galaxy ultra s24 wow😮,2025-01-31T23:45:50Z,2025-01-31
ePdbj2bZ-Ro,"🌟 Eleve seu som, floresça seu estilo",2024-06-08T17:25:36Z,2024-06-08
ePdbj2bZ-Ro,@samsung plz tell us the music in this video,2025-02-19T16:05:41Z,2025-02-19
ePdbj2bZ-Ro,Gotta be their best design film yet,2024-02-01T22:42:44Z,2024-02-01
ePdbj2bZ-Ro,Watching this from s24 ultra,2025-01-24T04:44:27Z,2025-01-24
ePdbj2bZ-Ro,Wating for Galaxy S25 ultra❤,2024-11-21T12:05:22Z,2024-11-21
ePdbj2bZ-Ro,Hi from S24+,2024-09-10T06:45:58Z,2024-09-10
ePdbj2bZ-Ro,"Wow, refined like fine wine. Great job with the design and this animation.",2024-01-30T20:11:28Z,2024-01-30
ePdbj2bZ-Ro,"A esto me refiero cuando Samsung hace bien todo, anuncios y demos súper épicos como antaño. ❤",2024-10-15T21:04:15Z,2024-10-15
ePdbj2bZ-Ro,Please what is the music,2024-02-02T19:19:46Z,2024-02-02
ePdbj2bZ-Ro,Wow 😲 love it.,2024-08-16T19:22:06Z,2024-08-16
ePdbj2bZ-Ro,Watch this on my S24 Ultra. ❤ I love it! ❤,2024-01-30T20:16:46Z,2024-01-30
ePdbj2bZ-Ro,Beautiful,2025-01-22T20:01:47Z,2025-01-22
ePdbj2bZ-Ro,Hello frome Egypt 🇪🇬 ❤,2024-06-07T22:33:57Z,2024-06-07
ePdbj2bZ-Ro,I so love Samsung eco system,2024-01-30T20:02:26Z,2024-01-30
ePdbj2bZ-Ro,I like it and i have it 😊,2025-01-23T16:22:36Z,2025-01-23
ePdbj2bZ-Ro,"Finally, the most expensive phone in history has arrived at my home, and I have not opened it yet to see this beautiful advertisement, the Samsung S24 Ultra.👌",2025-03-28T23:28:15Z,2025-03-28
ePdbj2bZ-Ro,If Samsung introduce galaxy s25e a compact 5.5 inch phone it will be amazing....what you guys think?,2024-09-17T09:35:34Z,2024-09-17
ePdbj2bZ-Ro,"🤠 Sertanejo puro, som que encanta",2024-06-08T17:26:34Z,2024-06-08
ePdbj2bZ-Ro,"Samsung not turning off their comments is a boss move.

Unlike APPLE, worst tech company ever 😂 3500$ for a AR/VR headset? I’d rather buy a Quest 3 than that garbage.

Apple is a money grabbing piece of garbage company, and don’t go around defending Apple in my comments section., and I am saying that as someone who enjoyed Apple a lot, until the curtains of gimmick and bulls*itting fell.",2024-01-31T04:47:11Z,2024-01-31
ePdbj2bZ-Ro,"Nice how comments under the I-Phone 16 are diabled , cause they are feared or ppl saying that its a scam",2024-09-25T14:23:40Z,2024-09-25
ePdbj2bZ-Ro,"Watching on my S24+. Samsung, you did an amazing job on this phone. Congrats!",2024-01-31T03:04:11Z,2024-01-31
ePdbj2bZ-Ro,Samsung Samsung Samsung Samung te la rifas 😎,2024-11-13T23:37:21Z,2024-11-13
ePdbj2bZ-Ro,Comprei um s24 fe e estou amando,2024-12-06T16:56:13Z,2024-12-06
ePdbj2bZ-Ro,Wow I really love Samsung!❤,2024-01-30T20:35:43Z,2024-01-30
ePdbj2bZ-Ro,Samsung s24 mukemmel❤,2024-11-27T17:12:51Z,2024-11-27
ePdbj2bZ-Ro,samsung power💪💪💪💪💪💪💪,2024-08-11T14:00:11Z,2024-08-11
ePdbj2bZ-Ro,Infinito é o amor. ❤️,2024-06-04T00:05:05Z,2024-06-04
ePdbj2bZ-Ro,How beautiful the beauty of Samsung ❤🎉,2024-01-30T20:09:39Z,2024-01-30
ePdbj2bZ-Ro,"Bro, did you hear? Aaron Finch is with 4RA now  This is going to be epic!",2024-12-18T03:27:25Z,2024-12-18
ePdbj2bZ-Ro,"Samsung return policy is tricky where they charge 20% fee for data or app usage when opening the phone 

Sloppy returns policy",2024-11-01T00:37:48Z,2024-11-01
ePdbj2bZ-Ro,SAMSUNG CAN DO THIS🎉,2025-06-08T16:45:43Z,2025-06-08
ePdbj2bZ-Ro,Music??,2025-04-25T06:03:52Z,2025-04-25
ePdbj2bZ-Ro,¿Como se llama la canción de la intro de las series de los Samsung S24?,2024-11-17T15:36:16Z,2024-11-17
ePdbj2bZ-Ro,Do you stop or continue?,2024-07-21T17:01:26Z,2024-07-21
ePdbj2bZ-Ro,"Na ""Zona do agrião"", cada chute pode virar um golaço! ⚽️🥅",2024-07-25T01:21:39Z,2024-07-25
ePdbj2bZ-Ro,"Yellow = Golden , Gery = Sliver , Black = Obsidian , Violet (Dark Purple) = Cogalt Violet",2024-03-13T15:37:39Z,2024-03-13
ePdbj2bZ-Ro,I got my Samsung S24 Ultra it's been 2 wk already and keep exploring 😂😂😂 I love it❤,2024-06-09T09:23:17Z,2024-06-09
ePdbj2bZ-Ro,"Watching this video from Galaxy A Quantum,  hello from VietNam",2024-05-08T14:52:36Z,2024-05-08
ePdbj2bZ-Ro,Pero que guapo ❤❤❤,2024-10-12T16:09:25Z,2024-10-12
ePdbj2bZ-Ro,"Winged movement to plane B. Flapping wings, winged movement, leaving plane ""A"" for plane ""B"" .",2024-06-04T01:26:33Z,2024-06-04
ePdbj2bZ-Ro,Hello from Pakistan,2024-04-14T06:48:19Z,2024-04-14
ePdbj2bZ-Ro,"hello,my favorite samsung phone is galaxy s24 ultra,the favorite feature of this phone is the ai📱😍🌹❤️",2024-04-03T14:04:23Z,2024-04-03
ePdbj2bZ-Ro,Watching this on my dad's S24 ULTRA,2024-04-12T18:55:20Z,2024-04-12
ePdbj2bZ-Ro,"Pre ordered the onyx black S24 😎 First time pre ordering, can't wait! 🇨🇦",2024-01-30T20:04:17Z,2024-01-30
ePdbj2bZ-Ro,1:05 Sammy make it your official logo for S Series,2024-10-08T20:11:56Z,2024-10-08
ePdbj2bZ-Ro,"My parents want to switch from Samsung to Apple iphone. I tried to warn them, but i guess they need to learn a lesson.",2024-10-03T03:34:29Z,2024-10-03
ePdbj2bZ-Ro,"✨️ Calor madrileño Verano energético El calor madrileño era insoportable, pero las calles vibraban con la energía del verano y las fiestas locales.",2024-06-04T01:18:38Z,2024-06-04
ePdbj2bZ-Ro,Still rocking the S10,2024-01-31T03:51:03Z,2024-01-31
ePdbj2bZ-Ro,Watch this video from S24 ultra. Hello from India 🇮🇳,2024-05-27T16:44:08Z,2024-05-27
ePdbj2bZ-Ro,Fastest Beyond Limits. 🚀,2024-06-04T01:13:37Z,2024-06-04
ePdbj2bZ-Ro,I am loving the S24 ultra.,2024-01-31T23:17:42Z,2024-01-31
ePdbj2bZ-Ro,Song name?,2024-03-09T08:57:58Z,2024-03-09
ePdbj2bZ-Ro,"""Not yet, Wait!"" Are we there yet? ""Not yet!""",2024-06-04T00:03:39Z,2024-06-04
ePdbj2bZ-Ro,i wish we had this in a complete glossy white colour,2024-02-22T07:43:30Z,2024-02-22
ePdbj2bZ-Ro,Beautiful.....just beautiful,2024-01-30T20:17:12Z,2024-01-30
ePdbj2bZ-Ro,My phone 🔥🔥,2025-05-19T08:20:14Z,2025-05-19
ePdbj2bZ-Ro,"I remember switching over from the S series to the Note series back in the day and got the Note 5 and i was soo amazed and stun by it and every other device right after... but that amusement and happiness came back with even more Joy with the S24 ultra ( A.k.a Note phone ) as soon as i unbox it 1 week ago brought back soo many wonderful memories back the color the feel the display and the smooth touch of the screen cold frame in my hands as i power on the device truly a hands down my best experience yet 




Altho sad to leave my s23 ultra 🥹🫶",2024-01-30T20:37:26Z,2024-01-30
ePdbj2bZ-Ro,I love the music and the S24 Ultra is so beatiful and my mom got a S24+,2024-04-02T13:51:27Z,2024-04-02
ePdbj2bZ-Ro,qual a diferença de design do S24 pro S23?,2024-05-20T01:23:14Z,2024-05-20
ePdbj2bZ-Ro,What is the song ?,2024-11-19T21:06:48Z,2024-11-19
ePdbj2bZ-Ro,Мило❤❤❤,2024-06-30T13:51:04Z,2024-06-30
ePdbj2bZ-Ro,"If you are watching it in S24 Ultra , you already got the best phone in the world.❤",2025-03-28T15:30:27Z,2025-03-28
ePdbj2bZ-Ro,She's faster than lightning. ⚡,2024-06-04T01:13:04Z,2024-06-04
L-GvP1umbfM,Which software do you like better🤔 SUBSCRIBE if you like tech content!!,2024-09-27T17:13:14Z,2024-09-27
L-GvP1umbfM,Definitely s24 ultra for me,2024-09-27T17:16:46Z,2024-09-27
L-GvP1umbfM,S25 will laughing in the corner😅,2024-10-01T12:59:11Z,2024-10-01
L-GvP1umbfM,Let's not forget the whole pen built into the s24 ultra,2024-09-28T12:39:56Z,2024-09-28
L-GvP1umbfM,"2005: we will see flying cars in 2025
2025: phone wars",2025-01-06T19:52:53Z,2025-01-06
L-GvP1umbfM,Team S24 Ultra. 👇👇👇,2025-04-21T15:06:39Z,2025-04-21
L-GvP1umbfM,I just dont think there is any point in compering and you should just chose the one you prefer,2024-09-29T20:49:47Z,2024-09-29
L-GvP1umbfM,S24 ultra for a daily use as it got bunch  of feature more than iphone worthed for price.,2024-09-28T03:56:05Z,2024-09-28
L-GvP1umbfM,"The only issue with IOS is that you can't unlock the full power of the hardware due to Apple's security whereas with Android, it allows you to push the phone, unleash its potential and use it to the fullest.",2024-09-28T00:00:58Z,2024-09-28
L-GvP1umbfM,"I do not understand why people say s-pen is useless!! Nowadays, we need to sign documents a lot. Using a pen is much better than using your fingure. You want to draw something, you have the pen to do it in a professional way. You need a shutter button to click a photo from a distance, you have the option.

I understand not many people do these tasks on a daily basis, but you alys have the option without worrying about anything else!",2024-10-01T17:46:14Z,2024-10-01
L-GvP1umbfM,"S-pen, Samsung Dex, 8k video, 200mp main sensor, fingerprint sensor...

I like the smooth zooming in videos from iphone tho",2024-10-06T22:59:46Z,2024-10-06
L-GvP1umbfM,"Just wait til S25 comes and compare it💀
Edit: Ok thanks for 100 likes thats my record",2024-09-28T05:03:41Z,2024-09-28
L-GvP1umbfM,In modern time it doesn’t really matter who’s better because both of them are great in everything and you just don’t need that kind of power and camera anymore you can’t just notice the difference between one generation because there is nothing to upgrade,2024-09-27T17:25:31Z,2024-09-27
L-GvP1umbfM,"i would pick the iPhone 16 Pro Max over the S24 Ultra, but it’s only a matter of time until the S25 Ultra rolls out, that would be really hard for consumers to pick since they’re really close in terms of almost everything.",2024-09-27T17:33:08Z,2024-09-27
L-GvP1umbfM,"From a creator standpoint, the iPhone software is convenient.",2024-10-03T02:54:00Z,2024-10-03
L-GvP1umbfM,"Samsung AI - Apple nothing
Samsung 100x Zoom - Apple 25x😂
Samsung fingerprint Sensor - face id😅
Samsung s pen - Apple nothing
Samsung: Android - Apple: IOS😅😂
Samsung punchhole - Apple ""😂dynamic island😂""",2024-10-10T20:02:51Z,2024-10-10
L-GvP1umbfM,No shit de iphone is beter because its made this year and the s25 still needs to come 😅,2024-10-01T05:25:12Z,2024-10-01
L-GvP1umbfM,"S24u vs 16 Pro Max. The s24u costs $100 more/is more expensive while having the same storage. iPhone 16 Pro Max has way way better battery life, way way better performance, better app optimization, gets way more years of software support, has MagSafe wireless charging, has a way better ecosystem support, iPhone supports the best smartwatch in the market, has dynamic island, has exclusive apps, iPhones have better all-around cameras, Samsung emojis are very poor, the video quality on the iPhone is way better, iPhone 15 Pro/Max has iMessage & can communicate with friends way better, iPhones have Apple Arcade, has second gen Ceramic Shield, has so many features & iPhones have way way better resale value. iPhone 16 Pro has satellite SOS, action button, A18 Pro chip, has Raytracing technology, is way better at gaming, has an action button, has secure Face ID, is made of premium Titanium, has a 3NM processor. 16 Pro Max has a bigger display, better Pro camera system, way better video quality, thinner bezels, Studio-quality four-mic array, Wind noise reduction, Wind noise reduction
New microphone system,  better microphone capabilities & has Apple intelligence.

iPhone 16 Pro Max display does not have Grainy Display issues whereas the s24u is a defective product. 

Also, the iPhone 16 Pro/Max can play triple-A games whereas there is nothing for android. Android phones suck at gaming. Sorry if you bought an overpriced s24u grainy display garbage. Enjoy your grainy display on your $1300 phone 😬😬😬. Not to mention, the iPhone has Retro Bowl game.

2018 iPhones are running the current iOS 18 update. That means it will get Major software updates in 2025. That’s 7 years of software updates support. Can you please list me an android phone from 2018, 2019 or even 2020 that is getting Major software updates in 2024… there aren’t any 😂😂😂😂😂 Oh wait, you can’t cause overpriced android products are made to be obsolete.

2018 iPhone XR $750 phone got iOS 18. 2020 $1,400 Samsung s20 stopped getting software updates & is not getting android 14/samsung oneIU 6. 2020-2023 R.I.P Laggy S20U. And that laggy S20u A $1,400 phone is stuck on an outdated 2 year old 2022 android 13 update… 💀🤡🤣🪦

🎉🎉",2024-10-08T10:59:08Z,2024-10-08
L-GvP1umbfM,s25 ultra is going to be a menace for iphone users😂,2024-10-02T09:13:43Z,2024-10-02
L-GvP1umbfM,"You see, I'm a fan of both. I really love both, and it always seems like I go back and forth each time I have to upgrade to a new phone. So, at this point, it's just whatever I prefer by the time I have to upgrade next. That's kind of how I pick my choice between an iPhone or a Samsung. Currently, I have the S24, but for all I know, when I have to upgrade again, I could either go for the S25 or the iPhone 17 (whenever that comes out). Alternatively, I might not need another phone until the Samsung S30 or the iPhone 20 comes along. By the time I do need the upgrade, that's probably when I'll make my final decision of which one I want to have. 😂",2024-11-19T23:23:42Z,2024-11-19
L-GvP1umbfM,BRO FORGOT S25 ☠️☠️☠️,2025-02-12T13:30:21Z,2025-02-12
L-GvP1umbfM,I've seen benchmarks of the s22 ultra beating the 16 pro max,2024-09-29T18:41:55Z,2024-09-29
L-GvP1umbfM,In january compare the s25 ultra to iphone 16 pro max,2024-10-07T12:07:22Z,2024-10-07
L-GvP1umbfM,"The S24 ultra to me is more appealing visually but since the iPhone 13 I’ve grown accustomed to IOS. 

I own both the 16 pro max & the S24 ultra so I can switch at anytime but personally I’m not a fan of the animations and the emojis on android, they’re literally the only two set backs for me",2024-10-18T02:44:39Z,2024-10-18
L-GvP1umbfM,Choose what you want/prefer and its better to compare in person by going to the actual shop,2025-03-29T04:05:14Z,2025-03-29
L-GvP1umbfM,"Emmm, I think the 24 ultra was released about 8 months ago and you compared it with the very new Iphone 16 pro max?",2024-10-04T20:24:09Z,2024-10-04
L-GvP1umbfM,and more AI for S24 ultra more feature S24 ultra OG as released first S24 ultra,2024-09-28T03:55:06Z,2024-09-28
L-GvP1umbfM,Android > IOS,2024-09-27T17:22:39Z,2024-09-27
L-GvP1umbfM,"You failed to mention that the iPhone experience is better than the Android experience. Because iPhones are so optimized that they can last years. My iPhone 11, that I use as a burner phone, still runs smooth, still plays games. To this day, that phone almost came out 6 years ago. And my Android from 2023 with 120 refresh rate screen, better specs, runs worse than my iPhone 11, playing some games for some reason.",2024-10-01T21:19:51Z,2024-10-01
L-GvP1umbfM,I have had the s24 ultra for about 5 months now and i like its performance sooooooooo much it can play gta 5wusing winlator and it get 40-50 fps on max settings and if you have a phone cooler playing on low settings it can get 120 fps constantly,2024-10-16T20:26:04Z,2024-10-16
L-GvP1umbfM,"S25 be Like: Hold on im not there yet when i will arrive, we will see :D
S24: be quick Bro i am waiting for you.
Iphone 16: i will end Samsung's Carreer
S25: Stop dreaming 😂",2024-10-03T18:32:10Z,2024-10-03
L-GvP1umbfM,"Honestly if you want a new phone, just wait til the Galaxy S25 Ultra comes out.",2024-09-30T00:37:52Z,2024-09-30
L-GvP1umbfM,Wait for the s25 ultra...,2024-10-01T18:36:56Z,2024-10-01
L-GvP1umbfM,I phone 16 pro max 🗿 samsung s24 ultra 🗿 their fans 🤡🤡,2024-11-08T16:33:52Z,2024-11-08
L-GvP1umbfM,Honestly s24 ultra is better the 16 is a rip off for it's features in fact the iPhone 13 or 14 was better than the newer iphones I can't remember which one but the 16 only has a extra button and iphone crashes trying to run the same games as android so there's no debate here it's just preference if you want gaming go with android if you want Ai go with android if you want ios and their enterface go with iphone,2024-11-18T14:39:01Z,2024-11-18
L-GvP1umbfM,Wait until the s25 ultra,2024-10-03T22:23:23Z,2024-10-03
L-GvP1umbfM,Sansung cameras make iphone cameras look like paper💀💀💀💀,2024-10-03T21:13:14Z,2024-10-03
L-GvP1umbfM,Coming soon s25 ultra ☠️,2024-09-30T16:15:21Z,2024-09-30
L-GvP1umbfM,"For everyone that says:iPhone 16=s24,no the competitor of iPhone 16 is s25 that will come out in the START of 2025 (so it is like 3/4 months of difference) not s24 that is of the start of this year(so like 7/8 months).",2024-10-01T22:00:32Z,2024-10-01
L-GvP1umbfM,"I don’t care about a difference of less than a second when opening an app or booting up your phone. I care about how the phone feels to use. I prefer Apple because it just feels smoother, but that’s my opinion, and you’re free to have your own.",2024-12-16T18:46:31Z,2024-12-16
L-GvP1umbfM,"Dude it’s because the s24 is a year older than the new iPhone. So when the S25 comes out, it’s gonna top and Vice versa.",2024-10-06T01:06:30Z,2024-10-06
L-GvP1umbfM,"how r u gonna be comparing last years samsung with a new iphone, the 24s comp. is the iphone 15 and it destroys it, the iphones 16s comp. is gonna be the s25 which will again destroy the 16, stop being the guy that compares the new iphone with an old samsung im so tired of it smh😒",2024-10-01T16:02:07Z,2024-10-01
