video_id,comment,comment_published_at,date
xr8CpY3tM8U,"Be cool if you were to show us your task  launcher and prove that you don’t have the apps already loaded on the s24u vs iPhone 15PM launching from a cold start - I’ve got both phones and will do the same test this evening. Film it too - as well, I can show you identical apps (X-Plane & Aerofly FS World), very taxing amps with user control over graphic performance - where the s24 ultra can’t maintain 30fps (dropping as low as 12-14fps in populated areas and/or cockpit controls) - while the iPhone, same settings, doesn’t drop below 57-58fps, regardless of the terrain or the drawing of instrumentation and real time mapping on a glass cockpit. Even has a difficult time with steam gauge SuperCubs and 15/172s! 

I love both for different reasons, and I can show you the fact the S24 Ultra will NOT allow the use of Google Drive and/or Photos as a default repository for media or backing up your phone. The ONLY option is OneDrive! I’ve owned every iPhone since 2007, and along with them, I purchased an Android phone - initially, Notes 1, 2, 4, & 5 - I switched to Pixels, back to Sammy, and took a couple year break, until the S21/iPhone 11. This, even though the 11’s had the power and efficiency in the chip, the 21 was a better choice in my opinion. That opinion changed with 12 - 15 (I have 15PM and 24u, no 16/25) and the ridiculous redundancy of EVERY mandatory smartphone app; calendars, phones, messaging, notes, wallets, stores, calculators, voice recorders, contacts, clocks, ‘internet’, reminders, find my apps, and I’ve likely forgotten a dozen - but the ones I named ALL have the option to use the Samsung or Google version of the keyboard (one I forgot) as the default keyboard 
Unfortunately, and as ubiquitous as Google Drive/Photos (2 apps Mt View hasn’t abandoned) have been the last decade, as well as they’ve worked cross platform - whether WIndows or macOS, iOS, Android or iPadOS, Drive and Photos are arguably as good or better file managers than others’ native apps. Like Sammy’s Gallery! Who’s EVER used it other than Samsung SXX users? Or Galaxy tabs or laptops? Those are the ONLY three things capable of accessing your Samsung Gallery
EVERY other Android phone or tablet - including Samsung, has allowed Google Photos as your repository for stills and motion, Drive for audio and docs spreadsheets etc. No longer.

NOW if you want your pictures backed up you HAVE to have a subscription for MS365, which includes OneDrive, the ONLY option for photo backup (& video and everything else on your phone) able to be used other than a local SSD, same that you can do on iPhone - however, I can choose Chrome as my default browser on iPhone - Google Maps as my default mapping app, or G-Mail, Drive, Photos, everything is an option on Apple’s products.

The fact Samsung has 
A) dropped support for Photos and
B) done the same with Drive is over the top, and IMO, a purchase killer. Period

As a subscriber already of MS365 pre-s24u purchase, I’d have returned it, as you’re looking at an extra $120 a year to store your photos in the cloud, instead of the tiers of Google storage sizes.
This is my biggest complaint about the Samsung phones but followed closely by a few dozen redundant apps that Samsung copies Google’s and other’s to use open code software as a foundation for ONE UI, the crappiest OS on mobile in existence. Even though G-Board eats storage, the Samsung keyboard’s a joke.

I will say, the ONLY two things I’ve found preferable on the s24U vs the iPhone are the display (but ‘just’ as both are stellar) and the lack of almost ANY software I use 90% of the time on iOS and iPadOS - from incredible cameras for both stills and video, Timelapse and celestial - Play Store options are a joke in comparison… and audio production; from Digital Audio Workstations AKA DAWs to synths, percussion, wave editing and simple recording apps with multitrack abilities that are essential for prosecution. 
Why a positive? I don’t  have to buy them again!
Display, a slight edge, otherwise, I guess - and I’ve tried, I’m not a phone customizer guy. The themes and goofy fonts, the single colors or gradients, and the need to feel unique or different doesn’t appeal to me at all, and wile the ultrasonic finger print reader is amazing, it also sucks trying to land it correctly first try… where is the iPhone or iPad w/Face ID work instantly, battery life are near parity, my 15PM might have a slight edge, especially if gaming. And Microsoft and Adobe have MUCH better performance and capability, as well as apps - period - on iOS. While Docs and Sheets work okay, they don’t compare to the MS Suite, not even Apple’s Office suite - and messaging? What a S&%T Show! 
iMessage is so far ahead of either Goog or Sam’s messaging - and anyone older than 30’s not ‘Snapping’ - and unless you’re a fan of illegal communication, Signal and the rest don’t hold a candle to iMessage’s continuity with all Apple products one has; Macs, iPads, Apple Watches, Car Play, Home Pods, Air Pods, vertical and horizontal integration is definitely a massive plus, even though Samsung’s doing their best to jump in the sack with Windows, using connect to Windows, OneDrive as only option to backup - they’d be better off developing, from scratch, without the 30 years of x86 cruft built on cruft so you can still run that ‘legacy’ software that’s not been updated since last millennium - Samsung could easily take a couple years to write a decent third OS, without the Android Open Source code or the foundation of Windows 11’s nightmares… instead building better continuity between ALL devices - opening their market up significantly (and giving their customers back a dozen gigs of memory while eliminating the Google apps you can’t use!)",2025-04-03T01:20:34Z,2025-04-03
xr8CpY3tM8U,"do not compare iphone 15 pro max with S24 ultra, try it with S 22 ultra, 24 ultra is 2 years ahead of iphone 😊😊",2024-02-14T19:14:33Z,2024-02-14
xr8CpY3tM8U,"Which is more reliable for long year use? For 4yrs uasge which is more reliable?? Myself got s21 ultra bought at 2021 Nov nd today in Jan 2025 it got green line on screen out of nowhere (no dropped, nothing) should i buy apple 16pro max or s25 ultra for reliability? Pls help🙏",2025-01-20T06:07:20Z,2025-01-20
xr8CpY3tM8U,My iPhone will still be smooth after 2 years,2024-04-20T21:17:47Z,2024-04-20
xr8CpY3tM8U,"Android: 😁
iPhone:😁
Android vs. iPhone:🤡",2025-06-11T02:56:35Z,2025-06-11
xr8CpY3tM8U,"iPhone 11 VS Samsung Galaxy A25 5G

                           ⭐️⭐️⭐️
                       3rd Stars of Rating",2024-02-02T03:54:51Z,2024-02-02
xr8CpY3tM8U,"Speed doesnt matter, enjoying the phone always matters",2024-12-30T13:07:24Z,2024-12-30
xr8CpY3tM8U,Apple doesn’t focus on the app opening speed it just focuses on the cpu and gpu,2025-01-16T16:11:02Z,2025-01-16
xr8CpY3tM8U,For your info iPhone is made for cool animations in opening and closing not for speed test so apple opening closing spec is more satisfying in reality iPhone says that and Samsung also know,2025-01-21T13:57:28Z,2025-01-21
xr8CpY3tM8U,but which phone are you recording with this video ? Samsung or Iphone ?,2025-06-02T15:02:19Z,2025-06-02
xr8CpY3tM8U,"In 2025, you can get both for the price on 25 ultra or 16 pro max 😮",2025-03-11T22:28:50Z,2025-03-11
xr8CpY3tM8U,Finally no awful phonk music😭😭😭🙏,2025-01-14T03:02:19Z,2025-01-14
xr8CpY3tM8U,s24 ultra vs s21+ please,2024-01-31T23:29:41Z,2024-01-31
xr8CpY3tM8U,"Apple 😊😊
Samsung 😊😊
People who commented anything that compared each phone 🤮🤮",2025-04-08T02:46:26Z,2025-04-08
xr8CpY3tM8U,It’s because of the animation,2025-05-05T13:13:23Z,2025-05-05
xr8CpY3tM8U,Watching from my s24 ultra ❤,2025-03-08T15:50:21Z,2025-03-08
xr8CpY3tM8U,"So are these comparison even worthy for choosing which one is better 😂😂😂😂, please just talk about the pros and cons of each phone, these comparison don't make sense",2024-02-01T14:12:46Z,2024-02-01
xr8CpY3tM8U,Samsung S24 really cooked iPhone this year,2024-02-01T19:31:48Z,2024-02-01
xr8CpY3tM8U,It's kinda sad the s24 even hangs with  iPhone considering how light and basic iOS is. There's a lot more that's being processed with Android OS,2024-02-23T07:45:58Z,2024-02-23
xr8CpY3tM8U,"Samsung has good loading nice camera quality, but in general it just doesn’t feel smooth, and Apple has these little touches of smoothness to the phone, and just modern and simple things that makes it better. If you’re someone who loves cameras photos and everything then sure maybe the Samsung is for u, if you’re just an Apple fan and you like smooths phone , and good camera quality just can’t zoom far, get an iPhone.",2025-01-26T07:39:19Z,2025-01-26
xr8CpY3tM8U,S24 ultra is too hot to handle 🔥,2024-02-10T12:40:24Z,2024-02-10
xr8CpY3tM8U,We cannot compare google apps on a phone that has google software tbh,2025-03-28T19:57:33Z,2025-03-28
xr8CpY3tM8U,Both phones are good but everyone has their own tastes,2024-03-08T04:43:59Z,2024-03-08
xr8CpY3tM8U,"S25ultra coming with oryon core
(Higher cpu p than iphone🤩)

Fire🔥",2024-03-14T05:54:24Z,2024-03-14
xr8CpY3tM8U,Gotta love them lovely yellow low light 50mp pics on the Ultra or any Sammy phone. Then the speakers all treble are amazing. 😅,2024-02-21T00:56:36Z,2024-02-21
xr8CpY3tM8U,S24 ultra 🤟🤟🤟🤟🔥🔥🔥🦾☠️☠️☠️💀💀,2025-02-28T08:09:19Z,2025-02-28
xr8CpY3tM8U,S24 ultra did better but nobody does this on a daily basis lol,2025-05-20T17:48:00Z,2025-05-20
xr8CpY3tM8U,As years of user i am of samsung samsung is slow🤔,2024-02-10T00:48:19Z,2024-02-10
xr8CpY3tM8U,2 3 second doesn’t matter its about ur choice🙌🏻,2024-03-10T16:18:06Z,2024-03-10
xr8CpY3tM8U,Well atleast apple has an cool thing when opening youtube.,2025-01-03T05:35:14Z,2025-01-03
xr8CpY3tM8U,"Literalmente som casi iguales, el tiempo no es miy diferente pero yo por comodidad me quedo con iPhone ❤",2024-02-19T06:22:04Z,2024-02-19
xr8CpY3tM8U,ive had iphone for years and want to switch to samsung theyre so much better in general,2025-03-14T18:07:21Z,2025-03-14
xr8CpY3tM8U,"For gaming iphone15pro max>
S24ultra and perfomance iphone>andriod",2025-05-01T09:14:23Z,2025-05-01
xr8CpY3tM8U,"really, it aint that deep, they are both extremely fast",2025-03-24T22:05:59Z,2025-03-24
xr8CpY3tM8U,It comes down to P E R S O N A L preference :D,2024-02-18T11:51:22Z,2024-02-18
xr8CpY3tM8U,S 24 ultra ❤❤❤❤❤,2025-01-30T08:35:52Z,2025-01-30
xr8CpY3tM8U,Bhai mere pss iPhone 11 but mujhe s24 ultra bhut acha lagta he ❤😊,2025-04-07T08:13:09Z,2025-04-07
xr8CpY3tM8U,Power of Samsung☠️,2025-02-09T21:07:50Z,2025-02-09
xr8CpY3tM8U,Pls oppo A77s I Samsung s25 ultra pls,2025-05-31T10:33:29Z,2025-05-31
xr8CpY3tM8U,Iphone ❤❤❤,2024-06-25T22:20:50Z,2024-06-25
xr8CpY3tM8U,S24 ultra 🔥,2025-02-27T01:08:31Z,2025-02-27
xr8CpY3tM8U,Samsung s24 ultra win 🦾💪🦾💪🦾,2025-06-12T00:33:04Z,2025-06-12
xr8CpY3tM8U,"Ios and Android both are powerful 
Difference is app anumation",2024-07-08T13:01:55Z,2024-07-08
xr8CpY3tM8U,S24 ULTRA❤❤❤❤,2024-04-05T08:57:07Z,2024-04-05
xr8CpY3tM8U,I need this beautiful wallpapers,2024-03-19T12:18:04Z,2024-03-19
xr8CpY3tM8U,Samsung s24 ultra undoubtedly,2025-06-04T06:40:36Z,2025-06-04
xr8CpY3tM8U,Which country is not banned tiktok,2024-02-09T04:58:14Z,2024-02-09
xr8CpY3tM8U,Apple 👍👍👍👍,2025-06-13T07:25:59Z,2025-06-13
xr8CpY3tM8U,is there anyone using s24 ultra in esports tournaments,2024-03-21T16:37:43Z,2024-03-21
xr8CpY3tM8U,Who is saying Iphone is faster they definitely fell on their head cause its not!,2024-12-25T21:13:29Z,2024-12-25
xr8CpY3tM8U,Samsung the best ✌️💪,2024-02-24T18:01:02Z,2024-02-24
xr8CpY3tM8U,S24 ultra vs note 20 ultra please ❤,2024-02-01T22:00:25Z,2024-02-01
xr8CpY3tM8U,I have s24 ultra🙂,2025-04-26T18:05:27Z,2025-04-26
xr8CpY3tM8U,Yo compré uno hace días y no va tan fluido porque será? (Compre el S24 Ultra por si acaso),2025-05-04T20:44:27Z,2025-05-04
xr8CpY3tM8U,Uma pergunta... Esses celulares quadrados não são mais fáceis de quebrar?,2024-02-28T18:19:02Z,2024-02-28
xr8CpY3tM8U,Bro disabled animation on samsung 😂,2024-02-01T17:38:36Z,2024-02-01
xr8CpY3tM8U,"iPhone 15 Pro Max VS Samsung Galaxy S24 Ultra

                           ⭐️⭐️⭐️⭐️⭐️
                      5 STARS OF RATING",2024-02-02T03:53:34Z,2024-02-02
xr8CpY3tM8U,Galaxy s24 ultra❤🎉,2025-02-03T06:04:49Z,2025-02-03
xr8CpY3tM8U,What is wallpaper on iphone,2025-02-05T18:33:53Z,2025-02-05
xr8CpY3tM8U,What about trade in 😂 iphone always on top,2024-02-10T17:57:59Z,2024-02-10
xr8CpY3tM8U,iphone is the best. King of the phones,2024-02-10T01:55:20Z,2024-02-10
xr8CpY3tM8U,S24u❤,2025-03-02T14:24:36Z,2025-03-02
xr8CpY3tM8U,Song name,2024-08-31T13:23:29Z,2024-08-31
xr8CpY3tM8U,I Didnt Die,2025-03-16T16:30:31Z,2025-03-16
xr8CpY3tM8U,"S24( 12 GB RAM ), IPHONE (8 GB RAM)💀",2025-01-24T12:37:49Z,2025-01-24
xr8CpY3tM8U,Power of samsung,2025-05-10T17:01:42Z,2025-05-10
xr8CpY3tM8U,S24 Ultra >>> iPhone history,2024-02-01T12:30:07Z,2024-02-01
xr8CpY3tM8U,I'll prefer 23 ultra,2025-03-07T08:13:27Z,2025-03-07
xr8CpY3tM8U,Omg! I’m so sure that .03 of second is gunna make a difference!!! 😂 Silly Samsung fan kids. Always trying sooooo hard.,2024-04-23T20:58:24Z,2024-04-23
xr8CpY3tM8U,Blue YouTube?,2025-05-19T15:19:50Z,2025-05-19
xr8CpY3tM8U,yeah that 1 second really makes a difference :skull:,2025-01-25T17:14:04Z,2025-01-25
xr8CpY3tM8U,Bro GOKU wallpaper in which app,2025-03-31T09:57:38Z,2025-03-31
xr8CpY3tM8U,La maquina el papa de todos los iphon,2024-05-07T04:25:27Z,2024-05-07
xr8CpY3tM8U,S24  urita 👍😎💀💀,2025-05-12T17:07:37Z,2025-05-12
xr8CpY3tM8U,iphone 🔛🔝,2024-02-02T13:29:23Z,2024-02-02
xr8CpY3tM8U,Samsung is the best 🔥🔥,2024-03-21T03:57:45Z,2024-03-21
xr8CpY3tM8U,Wallpaper 🥹,2025-04-21T19:37:25Z,2025-04-21
xr8CpY3tM8U,Where i find this goku wallpaper,2025-04-20T18:05:48Z,2025-04-20
xr8CpY3tM8U,Samsung ❤,2024-02-23T17:35:56Z,2024-02-23
xr8CpY3tM8U,Iphone Killa,2024-02-01T13:22:09Z,2024-02-01
xr8CpY3tM8U,Google earch,2025-04-22T21:58:37Z,2025-04-22
xr8CpY3tM8U,iphone 🔥,2025-02-08T08:14:55Z,2025-02-08
xr8CpY3tM8U,iPhone 😎👇,2024-03-19T12:28:08Z,2024-03-19
1FtZIxwhqQ0,"Important note: This phone runs on latest version of Android 14 and there is a typo in the beginning of video that says 2200mAh, but it's 22,000mAh battery capacity.",2024-07-10T00:09:19Z,2024-07-10
1FtZIxwhqQ0,"every  cell phone manufacturer must have an extreme version of their flagship phones, like this. For people who don't mind carrying bulky phones, but need the battery life and ruggedness.",2024-07-18T07:25:47Z,2024-07-18
1FtZIxwhqQ0,"Had one now for about 6 months, I charge it about every 4 days, was in a cave in pitch black and the night vision worked fine within about 15 feet. So far great sturdy phone.",2024-07-13T16:30:02Z,2024-07-13
1FtZIxwhqQ0,"Very impressive how it handled being gently tossed onto the thick, soft grass.",2024-10-03T14:05:59Z,2024-10-03
1FtZIxwhqQ0,"These phones are meant for a very specific kind of ppl. Camper, hikers, miners, construction workers and possibly militery.  Ppl who spend alot of time outdoors for days or weeks and away from places to charge there device. For the few ppl I've seen with these devices it was their work phone so the main device isn't at risk. Satellite connectivity would definitely make these even better.",2024-07-08T00:37:44Z,2024-07-08
1FtZIxwhqQ0,wait until that monster dropped on your face while youre playing it at bed,2024-07-09T11:58:01Z,2024-07-09
1FtZIxwhqQ0,"I can't speak of this phone but I bought a Ulefone Power Armor 18T.  It has a 9600 ma battery and the Dimensity 7050 with 12 Gb of ram.  It is an armored phone like this one (no, that is NOT a case, that's the phone).  My phone does not have a night vision camera but I sprung and extra $100 for the built-in FLIR camera.  It is a great phone and I am really happy with it.  Having a 22000 mah battery and a fully armored case are some really great features.  If you can get over how large and heavy the phone it you will really enjoy it endurance and durability.",2024-10-23T07:06:03Z,2024-10-23
1FtZIxwhqQ0,Thats the thing that Batman carries on his utility belt...,2024-07-19T12:25:07Z,2024-07-19
1FtZIxwhqQ0,"Basically the ""Hummer"" of cell phones.",2024-07-09T15:46:08Z,2024-07-09
1FtZIxwhqQ0,"I had a DOOGEE 4 years ago , it had so many software issues that i bought an Iphone and i love it. No more issues.",2025-03-05T05:22:36Z,2025-03-05
1FtZIxwhqQ0,"Here in South Africa if you get in a taxi with that phone , you'll have to pay taxi fare for the phone also 😂",2024-07-14T11:53:46Z,2024-07-14
1FtZIxwhqQ0,Going back full circle. The upgraded Nokia.,2024-07-11T21:14:19Z,2024-07-11
1FtZIxwhqQ0,I can't believe a 22000mah battery only has a 33w charger that is insane and impractical it would need at least a 200w fast charger for that monster.,2024-12-02T13:43:55Z,2024-12-02
1FtZIxwhqQ0,An actual real paper user manual is the most astonishing feature of this phone.,2024-07-25T14:27:38Z,2024-07-25
1FtZIxwhqQ0,"I just bought one of these, can't wait till it shows up. I showed a friend of mine this video, he said 'why on earth would you want that thing ? it's outrageous !! I said 'you just answered your question' 😂",2024-12-08T14:51:33Z,2024-12-08
1FtZIxwhqQ0,"You guys kill me with the ‘phone’ reviews when you don’t comment at all about call quality, call sound, signal capture, reception, or other phone related items. I still use my phone to communicate and stream way more than game. How does this unit perform as a phone? Great run down of those other important aspects of its capabilities though. That was clearly stated, and well organized. Thank you.",2024-07-20T18:25:51Z,2024-07-20
1FtZIxwhqQ0,This is a power bank taped against the back of your phone. 😂,2024-08-03T16:27:43Z,2024-08-03
1FtZIxwhqQ0,Back in the day I believe Blackberry was the first one with a notification LED. I loved my BB. ❤,2024-09-20T01:28:28Z,2024-09-20
1FtZIxwhqQ0,"I'm a construction worker and i work in some of the most rugged conditions all year around rather it's in a storm, heavy rain, heavy snow and a lot of mud which I have dropped my phone in all and messed it up so this phone is perfect for me and the field of work I do I'm for sure going order one, I just bought the Samsung Galaxy s24 ultra and I put the tough case and screen protector on it and while I was driving the crane it fell from my pocket and cracked I was so mad because that crack interferes with my texting and browsing.",2024-08-11T11:28:23Z,2024-08-11
1FtZIxwhqQ0,"You missed telling us a number of things about this phone. First, how quickly it charges. Second, does it have wireless charging? Third, no mention of headphone jack. I didn’t see one. But it would have been good to mention there isn’t one.",2024-07-11T10:04:27Z,2024-07-11
1FtZIxwhqQ0,"As someone who does not need phones like this, I want a phone like this so bad",2024-10-19T12:14:02Z,2024-10-19
1FtZIxwhqQ0,"* shows button on side of phone *
""We have what is known as a side button.""
Me: ""Indeed.""",2024-07-11T12:07:21Z,2024-07-11
1FtZIxwhqQ0,Waita until that monster dropped on your face while youre playing it at bed,2025-05-10T21:43:21Z,2025-05-10
1FtZIxwhqQ0,Why did Samsung drop the micro SD on the new Note20 Ultra 5G. Marketing should be FIRED!,2024-07-11T12:11:20Z,2024-07-11
1FtZIxwhqQ0,"I've got a Blackview myself. BV 9800 pro 14,400 mah with all those bells and whistles. $280....I love rugged phones.",2024-07-25T16:25:54Z,2024-07-25
1FtZIxwhqQ0,I might consider this. On a typical day my 5000mAh smart phone battery runs out too quickly and I have to keep a few power banks on hand. My smart phone is my multitool. I do a lot of outdoor walking. I also tend to drop my phone every so often.,2025-03-27T07:40:22Z,2025-03-27
1FtZIxwhqQ0,"Dropped this from a C5 to ramp, still works!..love nvd",2024-07-15T12:08:50Z,2024-07-15
1FtZIxwhqQ0,So it's a MASSIVE mid-grade phone with its primary selling point being a power bank attached to the back?  Revolutionary.,2024-07-10T19:41:39Z,2024-07-10
1FtZIxwhqQ0,"Him: When did you charged your phone?
Me: 1 Month ago...
🤯🤯🤯🤯🤯",2024-12-08T17:35:36Z,2024-12-08
1FtZIxwhqQ0,"I'm very happy they have started making phones for men. 
It should be an sturdy implement. If you want one of those girly iPhones fine, but real men who do hard work have needed rugged phones for years.",2024-07-13T21:54:18Z,2024-07-13
1FtZIxwhqQ0,"a phone that chunky with that size battery should have a second USB port on the side to charge other devices, sounds like a good phone to have in the hurricane season where I live tho 🤔..",2024-07-08T17:12:48Z,2024-07-08
1FtZIxwhqQ0,Can someone call a crane please? my phone has fallen to the floor,2024-12-30T17:27:32Z,2024-12-30
1FtZIxwhqQ0,"Kyocera DuraPro phones have been my go to as a sailor for 5+ years, through 2 models. A 3rd update is out now.  The one I have is 3 years old and is going fine.  MANY immersions in water, fresh and salt, dropped 15+ft onto gravel.  Made in Korea, NOT CHINA. A company with a long history in electronics.",2024-07-16T16:15:10Z,2024-07-16
1FtZIxwhqQ0,Pocket left the chat,2024-07-06T13:58:58Z,2024-07-06
1FtZIxwhqQ0,I need this for work so I can stay in the toilet all day without a charger,2025-02-02T09:57:29Z,2025-02-02
1FtZIxwhqQ0,"It has something that all mobiles should have… a cover for the charging input, so it won’t get fluff stuck in it!",2024-07-06T13:39:39Z,2024-07-06
1FtZIxwhqQ0,Lovely. But not for everyone... check the specs and see if it's compatible with your carrier it that applies to you.,2024-07-06T11:45:14Z,2024-07-06
1FtZIxwhqQ0,The problem is that it depends on whether or not your service provider can support that platform,2024-08-03T01:38:02Z,2024-08-03
1FtZIxwhqQ0,Reviews say that it won't work with AT&T here in America which is a bummer and what stopped me dead in my tracks.,2024-08-19T05:54:03Z,2024-08-19
1FtZIxwhqQ0,you are behind the times I have had a phone like this from a different manufacturer for 2 years and it is capable of working on any network in the world,2024-11-06T17:34:25Z,2024-11-06
1FtZIxwhqQ0,I count the external SD memory card as a big pro also,2024-07-07T01:49:38Z,2024-07-07
1FtZIxwhqQ0,How's the software? I had a Sonim heavy-duty celphone the the phone worked just over a year then just out of warranty the software went South then turned a brick.,2024-11-09T17:31:38Z,2024-11-09
1FtZIxwhqQ0,"We went from thick cellular phones in the 80s to tiny Nokias, back to thick cellular phones in the 20s. We'd have bio integrated tech and virtual hud display screens if we weren't intent on doing the same thing every year.",2024-07-20T01:39:59Z,2024-07-20
1FtZIxwhqQ0,Wish these phones worked for Verizon in the USA. Love the ruggedness and the quality of the phone.,2024-08-20T01:19:26Z,2024-08-20
1FtZIxwhqQ0,"🎯 Key points for quick navigation:

00:00 *Massive battery life*
00:15 *Rugged design emphasis*
00:44 *Included accessories highlight*
01:24 *Advanced camera features*
02:19 *Customisable side button*
03:40 *Fingerprint sensor integration*
04:06 *Refresh rate adjustable*
04:47 *Display features description*
05:00 *Performance specifications examined*
06:18 *Impressive battery comparisons*
07:30 *Speaker quality test*
08:12 *Side button functionality*
08:37 *Charging indicator light*
09:19 *Rear customisable lighting*
10:14 *Night vision feature*
11:11 *Camera quality concerns*
12:06 *Water resistance assured*
12:32 *Pros and cons summary*

Made with HARPA AI",2024-10-11T02:23:22Z,2024-10-11
1FtZIxwhqQ0,Man all that chunk and they can't squeeze in a 3.5 mm jack somewhere...,2024-07-10T05:59:15Z,2024-07-10
1FtZIxwhqQ0,"Pretty much my ideal phone.  Only I would change a couple of things, a 10,000mA/h battery would be enough and the screen would need a function to illuminate the screen with the help of ambient light.  the processor and its cooling would also need to be upgraded as we have increasingly high summer temperatures.",2024-07-11T03:50:07Z,2024-07-11
1FtZIxwhqQ0,0:15 I was actually really worried about its durability until he lightly threw it a couple of feet onto the springy grass 😭😭😭 lol 😂,2024-07-20T17:07:53Z,2024-07-20
1FtZIxwhqQ0,"😂.... Well.... If you like throwing your money away ?  Go get it.... But !!! If you want information about this phone ? Take it from someone who's had it... Like...(ME).
Let's list the Negative points:
1) night camera is cool. If you don't want to see further than 3 feet.
2) the battery after only 1 month holds less charge time than any other cell I've had... 
3) after only 2 weeks working as a landscaper... No one who called me could hear a single word I spoke... So if you have dust around you ? Get used to  having ear buds all day long so people who call can hear what you're saying through the ear bud speakers...
4) they call it ""THE BRICK"". let me tell you why.... Not from it's size as they seem to want to make you believe... OHHH NOOOO !!! It's because the God damn thing weighs the same as a brick... No shit... 
5) The supposedly gorilla Glass that's unbelievably strong ? Nope !!!! I was bent over getting ready to pick something up and from my back pocket the cell fell to the ground... Maximum height was 1 foot... And yep... Broke... Well, not true... Didn't break... IT FU©KEN SHATTERED !!!!

So... Now let's see the good points:
1).....🤔..... I seriously want to add something, but... Sorry !!!! It's shit... From one end to the other...
If you want a real construction cellphone ? Get the ""Caterpillar S62 Pro. It's amazing !!!!",2024-09-15T00:53:05Z,2024-09-15
