video_id,comment,comment_published_at,date
emrLEDH52e0,"I was waiting for this from you, what took you so long :-) you're the only one who makes these tips and tricks fun!",2024-02-08T18:41:53Z,2024-02-08
emrLEDH52e0,I had a good laugh at the translation in french: Je suis bon! Hahahaha,2024-02-09T15:18:58Z,2024-02-09
emrLEDH52e0,"I've been eagerly anticipating this video, and it absolutely lived up to my expectations! It was incredibly useful and explained everything in such a clear, comprehensive way. Loved every minute of it!",2024-02-09T06:32:52Z,2024-02-09
emrLEDH52e0,Thank you for sharing these features.  I recently got my s24 ultra and it's the best phone I have ever got,2024-05-16T04:22:04Z,2024-05-16
emrLEDH52e0,I just bought my s24 ultra the other day thanks to your videos,2024-07-08T10:25:01Z,2024-07-08
emrLEDH52e0,"Great tips that I haven't already seen repeatedly in other videos! My favorite, though, is the custom S Pen sound and pointer. Thanks!",2024-02-08T22:53:34Z,2024-02-08
emrLEDH52e0,"Ah snap I'm late, blame Load Shedding 😂 happy to see you post again!! View from South Africa 🇿🇦👌",2024-02-08T17:07:21Z,2024-02-08
emrLEDH52e0,"I am currently using a S20 Note and its still a great phone, but was thinking about upgrading.  This vid has me almost convinced to make the switch.",2024-04-01T21:37:01Z,2024-04-01
emrLEDH52e0,"Yo, thanks a lot, Haylsworld! I just copped the S24 Ultra, and I heard it's packed with features. I'm glad I stumbled upon your channel and learned all the cool stuff this beast can do.",2024-05-24T15:14:54Z,2024-05-24
emrLEDH52e0,The device's capabilities greatly exceeded my expectations and provided a multitude of practical functionalities that undoubtedly augment its daily utility.,2024-05-24T15:10:04Z,2024-05-24
emrLEDH52e0,"This phone is so amazing!, thank you so much for the detail video!!",2024-02-13T03:01:13Z,2024-02-13
emrLEDH52e0,Samsung should have talked about all this. I have the s24 ultra and it's awesome but honestly they suck at presentations I've learned more from this video than I have on their unpacked event.,2024-02-08T19:28:32Z,2024-02-08
emrLEDH52e0,Just upgraded from note 20 ultra to s24 ultra 2 days ago  great video definitely learned some new tricks like live translate,2024-04-24T13:38:30Z,2024-04-24
emrLEDH52e0,Finally a non Indian voiced video,2024-12-26T14:34:14Z,2024-12-26
emrLEDH52e0,Apple ❌ Samsung ✅,2024-02-14T06:58:50Z,2024-02-14
emrLEDH52e0,Finally! The video I've been waiting for! 🎉❤,2024-02-08T17:10:38Z,2024-02-08
emrLEDH52e0,You are wonderful - thank you ❤,2024-02-12T13:05:39Z,2024-02-12
emrLEDH52e0,I really loved your video. It was step by step and much easier to understand. Thank you!,2024-12-05T17:19:24Z,2024-12-05
emrLEDH52e0,less than 30 seconds in and I am already hooked!,2024-03-23T06:02:43Z,2024-03-23
emrLEDH52e0,I have been following your video for two years and i am sure about that you never disappoint me. Love to watch your video.❤,2024-02-08T16:46:14Z,2024-02-08
emrLEDH52e0,Whenever I get a new phone I come straight here,2024-12-30T23:42:58Z,2024-12-30
emrLEDH52e0,Was waiting for your video for this 😁awesome thanks Hayls 👍👌😍❤️you the best 👌 👍 😍,2024-02-08T16:20:02Z,2024-02-08
emrLEDH52e0,Other brands should take note. Samsung's commitment to long-term support is unparalleled. Well done!,2024-08-30T15:12:54Z,2024-08-30
emrLEDH52e0,"Great video I recently just switched from an iphone, been using one since they launched in 2007. You've earned a new subscriber thanks again!",2024-08-20T21:09:13Z,2024-08-20
emrLEDH52e0,"This video on Samsung Galaxy S24 Ultra tips, tricks, and hidden features is incredibly informative! Exploring the capabilities of such a powerful device is always exciting, and this video does a fantastic job of showcasing some of its lesser-known functionalities. 😍",2024-02-09T15:06:12Z,2024-02-09
emrLEDH52e0,"Watching this from an iPhone 15 pro max 😅,I am planning to switch to Samsung 24 ultra. What do you think?",2024-07-23T14:50:46Z,2024-07-23
emrLEDH52e0,You flat out rock!!,2024-02-08T16:42:05Z,2024-02-08
emrLEDH52e0,"Thank god you talked about good lock, most people dont. Also good lock can do lot of other stuff too ofcourse.",2024-02-28T11:45:24Z,2024-02-28
emrLEDH52e0,"Nyc Video Mam
Am Using S24U 1 TB version.
Love the Phone ❤",2024-02-11T12:24:59Z,2024-02-11
emrLEDH52e0,Best review till the date about this phone ❤❤❤ loved ittt!!!!!,2024-02-08T17:00:02Z,2024-02-08
emrLEDH52e0,I love hays world 🌍,2024-02-08T16:18:35Z,2024-02-08
emrLEDH52e0,"As soon as i heard the lightsaber effect on the S-Pen i knew you are the cosen one!
Keep up the awesome work and thank you for the cool videos.
My Iphone 14 pro reacting to me watching this video: What da haaaail!? , E-motional daaaamage! ( in Steven He voice)",2024-07-05T09:32:03Z,2024-07-05
emrLEDH52e0,Been an iPhone user for 10yrs and recently to Samsung S24 ultra and I'm really enjoying this customization options. Almost blowing my mind. I'm really trying to catch up on everything.,2024-05-09T23:54:22Z,2024-05-09
emrLEDH52e0,1:59 i don't have it,2024-11-17T23:19:56Z,2024-11-17
emrLEDH52e0,I’ve been with Apple for the last 10 years and switched over to the s24 ultra.. I’m still learning it an I’m 50/50 on if I’m happy with the switch over or not,2024-07-07T20:37:57Z,2024-07-07
emrLEDH52e0,I recently got S24 Ultra and it's an amazing experience.,2024-02-08T18:10:49Z,2024-02-08
emrLEDH52e0,WOW you are brilliant.  Just got my phone and about to turn it on.  Can't wait to set it up now xxx. Thank you 😊,2024-07-06T17:40:08Z,2024-07-06
emrLEDH52e0,"That chat translation I came up with that idea about 10 years ago, aiming for gamers that are playing on servers with more than one language. 😅 😅",2024-11-20T18:41:45Z,2024-11-20
emrLEDH52e0,"Great video Haley, I love this phone,and I love learning more about it,thank you for making this video,it really helped out.",2024-02-10T05:05:46Z,2024-02-10
emrLEDH52e0,I really like ur vids and really missed em too since I didn't use YouTube in a while sorry for that😅 btw ur vid is looking as appealing as ever I'm really liking it thnx for providing the quality content my friendo hayls🤗,2024-02-08T16:48:45Z,2024-02-08
emrLEDH52e0,I have recently acquired the phone and swiftly discovered your video. I greatly appreciate it.,2024-02-11T06:21:57Z,2024-02-11
emrLEDH52e0,"I've seen a lot of tips and tricks videos for this phone, but your video is absolutely awesome!!",2024-02-15T18:13:03Z,2024-02-15
emrLEDH52e0,It's harder to learn everything about my phone than doing my Uni assignments 😂😂😂,2024-05-24T03:26:50Z,2024-05-24
emrLEDH52e0,When you are getting it soon ✌🏻😜,2024-09-04T06:40:25Z,2024-09-04
emrLEDH52e0,"Absolutely superb vid; I now know I've got a supercomputer, which also functions as a phone. I can't thank you enough for these wonderful disclosures;, unravelling a whole new Universe I didn't even know I had this funny stylo tucked away in my phone. Blimey, I'm getting happier by the minute-this superb, fab.",2025-02-05T18:32:29Z,2025-02-05
emrLEDH52e0,"I got mine this week, I didn't know what to feel at a time but this video is making me love this sleek phone",2024-05-24T13:22:39Z,2024-05-24
emrLEDH52e0,Who's watching from a s25 ultra,2025-02-01T15:43:51Z,2025-02-01
emrLEDH52e0,I want one. Can someone donate?,2024-06-24T13:22:53Z,2024-06-24
emrLEDH52e0,"Apple: who is that?
Apple: oh it's Samsung😭
Samsung: 🧏🤫🗿",2024-12-26T11:26:30Z,2024-12-26
emrLEDH52e0,"I love my s24 ultra, i chose titanium violet :) I also purchased a pack of your quotes set on your website. Love your videos!",2024-08-02T13:58:30Z,2024-08-02
emrLEDH52e0,"The alarm animation, makes waking up so much cooler? I don't think so. Nobody wakes up and is like ahhhh what a lovely animation. More like oh sugars its already time to wake up.",2024-11-20T11:33:29Z,2024-11-20
emrLEDH52e0,watching on my s24 Ultra,2025-04-23T11:23:23Z,2025-04-23
emrLEDH52e0,I have watched so many videos but this videos shows some really new Tipps I have not seen before and they are explained fast and understandable,2024-03-14T18:36:55Z,2024-03-14
emrLEDH52e0,I'm learning some stuff today. This phone is great. Super easy to do almost everything. Many options to do the same thing. Then hidden features.,2024-08-04T01:35:12Z,2024-08-04
emrLEDH52e0,"Great video, informative, enthusiastic, to the point and down to earth - so many youtube bloggers are pretentious and over-sell themselves, you're natural and it's easy to watch...  :)",2024-04-02T20:56:40Z,2024-04-02
emrLEDH52e0,"Love this phone, best I've ever had by so far... Screen is absolutely unbelievable. I watch stuff on my phone more than my TV now and this is the first phone to finally accomplish that, true story.",2024-10-03T01:04:44Z,2024-10-03
emrLEDH52e0,"Wow, i bought this phone not knowing how in depth and amazing it is. I love it!",2024-07-06T06:51:41Z,2024-07-06
emrLEDH52e0,Today I received my brand new S24 ultra. It's amazing! And your video is the first video I'm watching with my S24 ultra!,2024-11-09T20:23:00Z,2024-11-09
emrLEDH52e0,"I have been won over. Currently apple but waiting on my on my ultra arriving on Tuesday. Super excited. 

I initially got it for a business phone, mainly for photos and editing but I can see me switching completely and my iPhone will be my business phone 😊",2024-10-10T11:05:16Z,2024-10-10
emrLEDH52e0,"You are by far my favorite youtuber with tips, tricks, and hidden features!. You make your video informative and fun to watch flourishing with a vast of useful everything in accordance with the devices you talk about.",2024-09-06T06:21:02Z,2024-09-06
emrLEDH52e0,You're awesome.  I am loving my phone more thanks to you.,2024-06-25T11:24:39Z,2024-06-25
emrLEDH52e0,"07:18 Impressive, but an 18 year old Google feature. You can even use your camera in the Google Translate App to translate text (for example a book) and it translates the text in your camera view (live without tacking a picture). I use this feature on a regular basis while watching anime to translate japanse kanchi.",2024-09-05T23:36:59Z,2024-09-05
emrLEDH52e0,"Got my s24 about a week ago. I find something new in it everyday. I like Motorola, haven't had a Samsung in a while, I'm starting to remember why I like Samsung so much.",2024-11-06T05:43:00Z,2024-11-06
emrLEDH52e0,This is becoming one of my favorite channels for phones.,2024-02-11T18:28:24Z,2024-02-11
emrLEDH52e0,"I love every single video of yours, even if it’s about a device I’m not interested in. You’re doing a great job 👏",2024-12-30T17:49:15Z,2024-12-30
emrLEDH52e0,Had this phone since April and watched this video bc I know this phone does a lot more than I know it does. Thanks for you video,2024-09-30T23:14:22Z,2024-09-30
emrLEDH52e0,"I bought a Dexnor case for my phone because I did not buy the insurance for damage.
Do you think the phone by itself, without the case, is strong enough to not need a case for protection.
It feel so much better with out it.
Thanks",2024-05-27T05:21:49Z,2024-05-27
emrLEDH52e0,Thanks I've now made my mind up on getting my Samsung thanks to your video can't wait to get mine even tho I'm alittle late,2024-12-27T22:49:23Z,2024-12-27
emrLEDH52e0,Watching it on my s24 ultra bought yesterday.  Just loving it,2024-12-21T04:44:58Z,2024-12-21
emrLEDH52e0,I always search for you videos they are amazing and not boring like other videos! Keep up the good work,2024-12-01T19:08:47Z,2024-12-01
elYbZ0z2Qr0,Do you have a Galaxy s24 ultra🤔 SUBSCRIBE if you like tech content😀,2024-08-18T19:15:11Z,2024-08-18
elYbZ0z2Qr0,Someone finally mentioned signing documents!! That's a life changer. Makes work stuff more efficient,2024-09-10T16:00:22Z,2024-09-10
elYbZ0z2Qr0,Me thinking its Mr Beast from the thumbnail⚰️,2024-10-02T04:07:58Z,2024-10-02
elYbZ0z2Qr0,I kinda want to upgrade to S24U but my S22 ultra still works fine,2024-09-03T20:15:04Z,2024-09-03
elYbZ0z2Qr0,"The S Pen is seriously one of the most underrated tools. I use it for everything -taking notes, snapping group photos, signing documents, and even for those casual flex moments. One of the coolest features is how it effortlessly converts my less-than-perfect handwriting into clean, typed text. I remember back when I used take class notes with the S Pen-it was so efficient and easy to use. It's amazing how they packed so much functionality into such a small, sleek pen!",2024-10-02T04:41:39Z,2024-10-02
elYbZ0z2Qr0,"I am a s21 user, s24u is my dream phone ❤",2024-08-18T20:23:29Z,2024-08-18
elYbZ0z2Qr0,I agree with you.  That's why I will keep my S24U until the next version will continue having a Bluetooth s-pen.,2025-05-12T12:09:08Z,2025-05-12
elYbZ0z2Qr0,The most important and useful feature of s pen that nobody talks about is that you can copy literally every text on your screen at any time. Places where you cant do that on other phones. Take instagram as example. I dont know any other phone that can copy text from instagram bios or post descriptions. I have been a lover of note series. Now it is the s series.,2024-12-19T12:53:04Z,2024-12-19
elYbZ0z2Qr0,"As a student who loves photography, S24 really is a must for me😭😭",2024-09-17T11:27:23Z,2024-09-17
elYbZ0z2Qr0,"The Samsung s24 ultra is my Dream phone 

Like if the s24 ultra ur Dream phone",2024-11-21T08:19:58Z,2024-11-21
elYbZ0z2Qr0,S23 can do all this already,2024-08-25T17:01:28Z,2024-08-25
elYbZ0z2Qr0,"I've owned several notes, and now the S24 Ultra as well. I've used the S-Pen for many things, signing documents, sketching up remodel ideas, etc, but never to trigger the camera. For that, I use what I believe is the most underrated Samsung feature, voice activated camera.",2024-12-28T00:13:22Z,2024-12-28
elYbZ0z2Qr0,It can also zoom in and zoom out using the pen,2024-09-12T14:42:59Z,2024-09-12
elYbZ0z2Qr0,Agree but the recent update makes the battery short lived,2025-05-10T02:58:29Z,2025-05-10
elYbZ0z2Qr0,It helps so much with studying and editing documents,2024-09-01T23:25:19Z,2024-09-01
elYbZ0z2Qr0,"Audio jack still more useful as s24u owner 
When i want to sign a document i will not take my pen for it to much trouble 
And most case make it so hard for me to actually pull the pen so",2024-12-08T00:18:08Z,2024-12-08
elYbZ0z2Qr0,I love my s24 ultra.,2024-09-25T02:54:56Z,2024-09-25
elYbZ0z2Qr0,"This feature is not just for s24 ultra, its for 22 and 23 too",2024-11-07T13:34:37Z,2024-11-07
elYbZ0z2Qr0,S24 Plus Is on my wishlist,2024-08-22T17:11:59Z,2024-08-22
elYbZ0z2Qr0,Watching on S24 ultra!,2025-01-01T18:42:28Z,2025-01-01
elYbZ0z2Qr0,I love this phone. Wont need to upgrade for a long time,2024-09-07T19:26:37Z,2024-09-07
elYbZ0z2Qr0,This has been the case since Note 20 Ultra (2020). People have really been missing out on Samsung,2024-10-04T00:35:40Z,2024-10-04
elYbZ0z2Qr0,My manager asked me all the time to print papers and then write info inside them manually ... i used the s pen to just write everything inside the pdf and then send it back without even printing .. It's the best feature ever,2024-09-22T16:06:45Z,2024-09-22
elYbZ0z2Qr0,"To be honest, I can't afford a thousand dollar bag no matter how beautiful it is. I can say with certainty that every   kislux   bag I've owned has been solid. Beautiful leather, top-notch hardware, amazing craftsmanship, and a clean silhouette and size that I love. I've been well worth every dollar I've spent, and they've held up perfectly for years.",2024-12-05T02:55:11Z,2024-12-05
elYbZ0z2Qr0,SAMSUNG truly releases phones ahead of its time,2024-09-24T05:40:14Z,2024-09-24
elYbZ0z2Qr0,Who noticed the Nothing wallpaper 🤩,2024-10-11T20:00:05Z,2024-10-11
elYbZ0z2Qr0,"Actually yes. I have never had this phone but it amazes me how in the top comparisons of flagships, the pen is either briefly mentioned or even completely ignored, like it is a complete piece of hardware that no other phone carries an alternative of!",2024-09-28T16:22:18Z,2024-09-28
elYbZ0z2Qr0,That's why I love samsung❤❤❤,2024-12-03T14:41:54Z,2024-12-03
elYbZ0z2Qr0,I have a samsung tablet as well. The pencil really helps because I can use both pens for both devices.,2024-08-22T23:03:09Z,2024-08-22
elYbZ0z2Qr0,Samsung note for life! Since the Note 3,2024-10-02T20:37:43Z,2024-10-02
elYbZ0z2Qr0,Metal scratching sound effect 😭,2024-08-20T10:00:09Z,2024-08-20
elYbZ0z2Qr0,I use the pen and every feature in a daily basis since note s3!!,2024-10-28T13:24:25Z,2024-10-28
elYbZ0z2Qr0,I'm using s24.. it's an amazing smartphone I have ever had.,2024-09-05T10:49:04Z,2024-09-05
elYbZ0z2Qr0,Commenting from my third S24 Ultra 🤌,2024-11-19T00:20:16Z,2024-11-19
elYbZ0z2Qr0,"For me Samsung are great I like their products but my issue with this new phones ultra is that the S Pen makes them big while S before had a better thinness. I never really liked Samsung notes due to that, so if I'm buying a Samsung S series phones it will be an S or S+ either aiming to an ultra.",2024-09-17T12:44:21Z,2024-09-17
elYbZ0z2Qr0,Samsung Is Wild 💎,2024-10-23T17:51:36Z,2024-10-23
elYbZ0z2Qr0,"S23 Ultra: 👁️👄👁️
S22 Ultra: 👁️👄👁️ 
The entire Note lineup: 👁️👄👁️",2025-02-26T15:55:25Z,2025-02-26
elYbZ0z2Qr0,WHAT THE I NEED TO BYE THAT😭😭😭,2024-11-11T13:23:52Z,2024-11-11
elYbZ0z2Qr0,FYI all.  Always get insurance.  Samsung is infamous for not covering malfunctions!!!!!,2024-09-19T23:49:15Z,2024-09-19
elYbZ0z2Qr0,Nathan Espinoza's long lost twin,2024-10-20T17:36:53Z,2024-10-20
elYbZ0z2Qr0,it's great for ds emulation too,2024-09-12T14:07:56Z,2024-09-12
elYbZ0z2Qr0,I've just upgraded from my s20 to the s24. So happy with it.,2024-11-16T18:32:34Z,2024-11-16
elYbZ0z2Qr0,It’s a wand for changing settings in camera XD. Gotta say this feature is really SICK,2024-10-14T08:16:16Z,2024-10-14
elYbZ0z2Qr0,"Not just that.
I also use it like a laptop for PowerPoint presentation just dont forget to put it on airplane mode",2024-10-02T07:33:51Z,2024-10-02
elYbZ0z2Qr0,I'm watching this from an s24 Ultra and fr the signing documents is underrated,2024-12-07T08:23:46Z,2024-12-07
elYbZ0z2Qr0,"This feature can do a LOT of things, but you need to set it up. This feature is called 'Air Actions'.",2024-10-03T06:52:44Z,2024-10-03
elYbZ0z2Qr0,"Super high tech phone that can turn into a car, portable jet, and a rocketship released. 
A few months later, “is this phone underrated?”",2024-08-23T14:38:50Z,2024-08-23
elYbZ0z2Qr0,S24ultra dream phone 😢❤,2024-12-04T13:02:55Z,2024-12-04
elYbZ0z2Qr0,24 Ultra lets goo. 25 ultra doesnt have this feature. Im never giving this phone up,2025-02-04T18:40:28Z,2025-02-04
elYbZ0z2Qr0,"What's even more underrated is some people think it's simply a stylus, but it's actually a proper Wacom pen exactly as high-end art tablets and displays.",2024-10-18T15:34:31Z,2024-10-18
elYbZ0z2Qr0,How did y'all forget about the note 20 💀,2024-09-11T15:55:19Z,2024-09-11
elYbZ0z2Qr0,for me it is very useful especially when I draw in ibispaint,2024-10-04T02:08:33Z,2024-10-04
elYbZ0z2Qr0,NOT ANY MORE….. THEY REMOVED BLUETOOTH…….  😢😢😢,2025-01-27T09:14:31Z,2025-01-27
elYbZ0z2Qr0,"The reason it's not actually underrated at all, is the fact that people buy this phone because of the S-Pen, it's not like people are buying it and then going oh nice surprise I have a pen",2024-12-08T03:13:46Z,2024-12-08
elYbZ0z2Qr0,OMG I didn't know that thank you dude!!!,2024-08-23T11:04:46Z,2024-08-23
elYbZ0z2Qr0,Reasons why I ❤this phone 📱 that pen 🖊️ is a huge turn on🥰🥰🥰,2025-04-15T16:03:45Z,2025-04-15
elYbZ0z2Qr0,"But when I bought the thing, I was always nervous to keep the pen inside since I thought it would get stuck",2024-09-25T13:18:22Z,2024-09-25
elYbZ0z2Qr0,Unfortenately as a Turkish student I would use it for study lessons from pdfs xd,2024-09-30T14:49:34Z,2024-09-30
elYbZ0z2Qr0,Watching this from my S24 Ultra. Best decision that i made.🎉,2024-08-23T04:10:08Z,2024-08-23
elYbZ0z2Qr0,Watching on my Samsung Galaxy S10 Plus🙂,2024-11-25T23:20:12Z,2024-11-25
elYbZ0z2Qr0,"""Can ur Apple do that"" 🗣️🗣️🗣️🤫🤫🔥🔥🔥",2024-10-26T11:19:04Z,2024-10-26
elYbZ0z2Qr0,"The S Pen is definitely underrated. I'm a Dry Van dispatcher and sometimes I'm on the go without my laptop. 
Signing documents is a breeze with that little thing. In that specific use case, it makes it super valuable.",2024-10-02T16:49:20Z,2024-10-02
elYbZ0z2Qr0,"IPHONE: WE WILL HAVE SPLIT SCREEN ON 2028, PEN ON 2030 AND OF COURSE WE WILL INCREASE THE PRICE 🤣🤣🤣",2024-09-20T19:37:03Z,2024-09-20
elYbZ0z2Qr0,"Since my first galaxy note this is the most important thing about having a Note/ Ultra device. Note,  Note II, Note 4, Note 9 and S24 Ultra. Incredible devices for their time and the spen was always a main reason when buying them",2024-12-26T08:35:30Z,2024-12-26
elYbZ0z2Qr0,Meanwhile me using s22 ultra with all the feature ahown in the video: 😐😑🤦‍♂️,2024-10-27T07:56:09Z,2024-10-27
elYbZ0z2Qr0,"As a student in a medical college, and a waiter, the S-pen of the s24 ultra for me is very convinient when talking quick notes or reminders during the class on the go.",2024-10-22T06:05:45Z,2024-10-22
elYbZ0z2Qr0,I owned a note 9 for 8 yesrs... it's really... not big😐,2024-09-17T14:12:34Z,2024-09-17
elYbZ0z2Qr0,Bad thing about the s pen: no no Bluetooth anymore 😢,2025-03-02T22:38:58Z,2025-03-02
elYbZ0z2Qr0,What documents is bro signing ☠️,2024-08-24T08:16:47Z,2024-08-24
elYbZ0z2Qr0,"I'm a developer, I use this pen to roughly draw designs and learn algorithms.",2024-10-05T11:06:55Z,2024-10-05
elYbZ0z2Qr0,Wingardiam levi-osa **presses s-pen button** => **takes picture**,2024-08-23T05:06:37Z,2024-08-23
elYbZ0z2Qr0,Writing and signing docs is so easy😊,2025-01-15T18:27:51Z,2025-01-15
elYbZ0z2Qr0,"This guy: ""the fact that it is stored inside the phone is a game changer""
A phone that i had like 8 years ago: wtf
💀 😎😂",2024-09-29T14:59:59Z,2024-09-29
elYbZ0z2Qr0,I bought it 2 months ago and this is the best choice I have ever made🎉🎉,2025-01-08T20:32:20Z,2025-01-08
elYbZ0z2Qr0,"Bro, the S22 Ultra does the same shit, little bro. 😂😩",2024-10-06T14:40:03Z,2024-10-06
elYbZ0z2Qr0,You can also zoom in and out by pressing the pen button and doing clockwise and anticlockwise gestures.😊,2024-09-30T08:17:18Z,2024-09-30
elYbZ0z2Qr0,Just got mines today and it's going to be with me till I retire in 5 years.,2025-01-16T01:32:50Z,2025-01-16
elYbZ0z2Qr0,remember. samsung screen from s20 series and above is very easy to get green/purple lines when the smartphone starts to heat up,2024-10-30T22:27:04Z,2024-10-30
elYbZ0z2Qr0,"I've had all the ultra phones, and I'll keep using them as i also used all the note series until they were discontinued. The camera and pen make this phone stand out above the other phones in the market. Especially if you take a lot of photos and edit them or sign various documents for work if necessary.  All phones should try to be more like the ultra series.",2024-10-02T19:39:18Z,2024-10-02
elYbZ0z2Qr0,My dad has the samsung s24 ultra 😭 and im jelly cause thats one of the best phones its better than any phone!,2024-11-19T02:46:35Z,2024-11-19
elYbZ0z2Qr0,"Another great thing it does is control spotify. As a music lover the s pen is so nice to play songs sitting on my bed while my speakers are 5 feet away on my pc desk, without even getting near my phone.",2024-10-16T08:35:29Z,2024-10-16
elYbZ0z2Qr0,Best thing is that it has different functions for different applications,2024-10-03T08:05:48Z,2024-10-03
elYbZ0z2Qr0,I am using this everyday and i love this feature,2024-09-30T20:47:50Z,2024-09-30
elYbZ0z2Qr0,“can your apple do that?” 💀💀,2024-11-01T07:50:10Z,2024-11-01
elYbZ0z2Qr0,I have S23 ultra and its pretty cool 🎀,2024-11-17T18:28:50Z,2024-11-17
elYbZ0z2Qr0,It's volume to its amazing,2024-12-11T13:12:49Z,2024-12-11
elYbZ0z2Qr0,I got the s22 ultra and I totally agree,2024-10-17T17:04:21Z,2024-10-17
elYbZ0z2Qr0,"I want it so badly, gonna save up for it",2024-11-06T14:59:07Z,2024-11-06
elYbZ0z2Qr0,"Are there people that really don't use the pen ? I say this because I use it every day and it is one of the biggest reasons.I got this phone if it hadn't been for the s pen.I would have just gotten something else entirely i've always loved the s pen though, so maybe that's why",2024-12-05T23:48:43Z,2024-12-05
elYbZ0z2Qr0,The phone itself is very underrated for what it does ❤🤩,2024-11-21T09:55:59Z,2024-11-21
elYbZ0z2Qr0,"Meanwhile way back in the dinasaur ages the galaxy note 3 has a pen
More way back tho were phones used to have antenas",2024-11-26T14:21:05Z,2024-11-26
elYbZ0z2Qr0,"I have samsung s24 ultra and gosh it's very efficient in everything, its battery lasts for a very long time and it has neve bugged or lagged",2024-12-20T06:59:13Z,2024-12-20
elYbZ0z2Qr0,S23 Ultra user and I couldn't be happier with this phone. I'll buy the S25 U though for the better camera and battery,2024-10-30T01:29:01Z,2024-10-30
elYbZ0z2Qr0,Bro the pen has been a feature for YEARS now,2024-12-03T23:46:40Z,2024-12-03
elYbZ0z2Qr0,We can also use the Spen for going to the home screen extra like this😅😅,2024-11-12T02:07:40Z,2024-11-12
elYbZ0z2Qr0,watching this on S24Ultra,2024-10-03T08:40:57Z,2024-10-03
elYbZ0z2Qr0,It’s like you were born yesterday or maybe Im getting old,2024-12-03T03:06:20Z,2024-12-03
elYbZ0z2Qr0,BRO THIS GUY IS MAKING SWITCH FROM IPHONE TO SAMSUNG AND BACK TO IPHONE 😭😭😭😭,2024-11-29T05:26:38Z,2024-11-29
elYbZ0z2Qr0,Another greate use is rain. When the screens soaked the stylus still works perfectly,2024-09-30T12:30:13Z,2024-09-30
elYbZ0z2Qr0,"If it wasn’t for the price, I would gladly pay for one, but as of now I’m just getting a new computer and oculus",2024-10-06T01:08:34Z,2024-10-06
