video_id,comment,comment_published_at,date
ITJVzQXIUco,"I have my Samsung Galaxy S24 Ultra since almost 1 Year now! I like it very much! Battery health is at 97 %, no scratches",2025-03-28T07:02:29Z,2025-03-28
ITJVzQXIUco,Samsung S24 Ultra is already so good and tommorow the Samsung s25 Ultra is releasing🔥,2025-01-21T16:02:49Z,2025-01-21
ITJVzQXIUco,"Bro , Its just a beast . Rocking so hard",2025-01-21T17:35:18Z,2025-01-21
ITJVzQXIUco,Getting the s24u this week! So excited,2025-03-02T23:51:08Z,2025-03-02
ITJVzQXIUco,"I use it alongside the Note9, and the cameras are for me the only improvements over that one. In other words, when I don't need the cameras, it hardly matters which device I reach for, as both are great.",2025-05-10T20:08:58Z,2025-05-10
ITJVzQXIUco,Can't wait for the s25 ultra review 🎉,2025-01-22T00:34:41Z,2025-01-22
ITJVzQXIUco,Using it for last 1 month. Amazing device 🔥,2025-01-21T14:08:45Z,2025-01-21
ITJVzQXIUco,i had s24 ultra since first came out and this is the first time i ever gave a phone 10/10 score,2025-04-28T09:14:49Z,2025-04-28
ITJVzQXIUco,Loving my 2 weeks old s24 ultra❤,2025-04-13T01:35:45Z,2025-04-13
ITJVzQXIUco,just bought s24u ultra last week instead of s25u. i feel like with the price drop this phone is so much worth to buy than the newer version. glad i still get the new old stock,2025-05-31T20:18:47Z,2025-05-31
ITJVzQXIUco,"I have had my maxed out note 20 ultra for 3 years and never had any issues after multiple drops the camera wiggles, and now the best option is this beast maxed out....Thanks for the great review and revisit of the note 24 ultra",2025-03-31T04:49:37Z,2025-03-31
ITJVzQXIUco,How did you keep the screen so clean? I keep hearing about the oleophobic coating issue,2025-05-16T20:16:50Z,2025-05-16
ITJVzQXIUco,"What's up Nick. Hope u had a happy holiday season, especially as a new dad. I have the Z Fold5 and I'm considering getting the S25 Ultra, but wanted to get ur thoughts on the S24 Ultra",2025-01-22T01:00:00Z,2025-01-22
ITJVzQXIUco,Wow! You’re doing an amazing job.,2025-01-25T15:28:30Z,2025-01-25
ITJVzQXIUco,"I also have very bad OCD when it comes to my Samsung Galaxy S23 Ultra, Playstation 5 Slim and Playstation 5 Pro, my 43"" Samsung Crystal 4K UHD 60hz TU7000 TV, and many more of my prized possessions. I definitely feel you on those tiny scuffs being something that triggers your OCD because this is exactly how I feel when any of my prized possessions take any type of physical damage whatsoever, even if its so minor that you have to zoom in or look incredibly close to see it. It's cool to know im not alone with this kind of stuff. Those minor scuffs on the corners od your Samsung Galaxy S24 Ultra would most definitely trigger my OCD. This is why I make sure to use a Tech 21 Evo Clear Case and Zagg Invisible Shield XTR2 Eco Curve Screen Protector. I never take my phone out of the case or take off my screen protector unless it's time to replace it.",2025-05-22T08:56:03Z,2025-05-22
ITJVzQXIUco,Thanks for the video. Just one question (hope it's not already answered). Are you using a protective glass? How's the wear on the screen glass?,2025-01-21T23:12:02Z,2025-01-21
ITJVzQXIUco,"I got mine on pre-order.   A year later, I am still loving it.  The phone was worth it.",2025-01-21T15:31:16Z,2025-01-21
ITJVzQXIUco,"I have an S24U too for like half a year, and i'm pretty satisfied. I was an iPhone user for some years before this Samsung and probably only things that i didn't like was some apps oprimization, especially facebook, is pretty annoing and have a lot of bugs. But over all is a solid phone, is not the best, but is a veeery good all rounder and the cameras are good, not gbe greatest in industry, but if you get used to it and know how to use it at full potential, you can take very good shots, especially with zoom lens😁",2025-03-20T21:12:01Z,2025-03-20
ITJVzQXIUco,Love my S24 ultra ❤️,2025-02-02T18:38:36Z,2025-02-02
ITJVzQXIUco,S24u is the best phone ever,2025-01-21T23:46:48Z,2025-01-21
ITJVzQXIUco,"It’s an absolute killer phone, I do love mine and will be keeping it for quite a few years but I do have to disagree on the camera. It’s the only weak link in its armour. I don’t rate it at all. I much prefer my iPhone 16 pro max or even pixel 8a for taking pictures.",2025-01-21T20:44:28Z,2025-01-21
ITJVzQXIUco,How is the screen with the finger prints being difficult to remove. You see this as an issue after a year. Does it matter if you pre-order or wait until they fix all the bugs.,2025-01-22T00:32:27Z,2025-01-22
ITJVzQXIUco,"Thank you for a great video. We appreciate your honest opinion. I love the S pen, & the boxy look that sets it apart from IPhone. I'm a die-hard Note user. Too bad the S25 is just another IPhone clone look alike. I'm waiting to have my S 24 Ultra delivered soon. Thanks.",2025-01-25T17:47:16Z,2025-01-25
ITJVzQXIUco,"I remember back in the day, checking out the Note 4 the one with leather back and being blown away by the design and display. Used to own an S2 back then and was so tempted to upgrade but stayed away coz I couldn't afford it but the awe-struck feeling stuck.",2025-01-31T11:07:10Z,2025-01-31
ITJVzQXIUco,Was able to get it for $645 USD recently. Upgrading from a Samsung S21 FE 5G.,2025-01-23T02:06:42Z,2025-01-23
ITJVzQXIUco,Getting my new S24 tomorrow thanks to your review & for Mario bragging about how satisfied he is with his S24! 😊 Convinced it’s the best phone ever!!,2025-03-17T06:10:59Z,2025-03-17
ITJVzQXIUco,Just picked one up for 409 euro on contract. Didn't like the looks of the s25  ultra and wanted the shared off designs. Also you can control your TV with this if it's a samsung 😂😂,2025-01-21T15:08:17Z,2025-01-21
ITJVzQXIUco,"I used to be a lover of iPhone and Apple ecosystem, but tbh, I think Samsung is way better. It is fun to have. Switching to Samsung was really awesome.",2025-05-18T03:22:03Z,2025-05-18
ITJVzQXIUco,"I'm consider changing my 8 years old Xiaomi for this S24 Ultra and since i'm keeping my phones for long, do you think they will keep their promise to upgrade it for 7 years ?",2025-03-16T22:02:02Z,2025-03-16
ITJVzQXIUco,One drop in owning it almost a year is all it took to take out the screen. Switched to the OnePlus 13 because I cannot afford $1500 for 512GB of storage and haven't looked back.,2025-01-21T16:55:44Z,2025-01-21
ITJVzQXIUco,I'm still here with my note 10+ 5G,2025-01-21T15:37:20Z,2025-01-21
ITJVzQXIUco,Nice video. Thanks,2025-02-20T13:24:16Z,2025-02-20
ITJVzQXIUco,"I really enjoyed s24 series esp, the 24 base model. It has an amazing camera system compared to predicessor n to some of her competitor on the go…good battery life n more.",2025-01-21T15:14:14Z,2025-01-21
ITJVzQXIUco,"Hi Nick, are you gonna trade the s24U in for the s25U again? Or are you gonna keep it & do more versus videos, since people are keeping their phones longer now. Or are you only gonna keep iPhones?",2025-01-21T16:14:46Z,2025-01-21
ITJVzQXIUco,"Had the s21 ultra and absolutely loved it even tho it didn't have an s-pen. well, that one decided to die yesterday, and ordered this today, can''t wait to get it!",2025-02-10T17:55:04Z,2025-02-10
ITJVzQXIUco,"Hi Nick, Great review, just one question does it compress videos when you upload on social media, eg. TikTok etc. compared to iphone. Does it reduce quality? Plz",2025-02-28T01:10:28Z,2025-02-28
ITJVzQXIUco,"Heyy man! Should I wait for the s25 ultra or go with the s24 ultra? Kinda want a badass phone, cause I had the s22 ultra, but had to get a cheapy phone, cause the update messed up my ultra! I currently have the s24 fe but want something better!",2025-01-22T00:16:13Z,2025-01-22
ITJVzQXIUco,just got it today for 500!  someone upgraded to the 25 got a great deal on it so far i love it,2025-03-11T04:39:53Z,2025-03-11
ITJVzQXIUco,And tomorrow the s25 ultra will be revealed. Time is going by so fast! s25 ultra will be phone of the year 2025.,2025-01-22T00:49:37Z,2025-01-22
ITJVzQXIUco,"If they'd change SW photo over-processing (video and front faced are great) and added battery >5000mah with faster charging - it would be my primary phone. Now I use Xiaomi 13 Pro more often since I take a lot of photos in nature and can't always drag my DSLR along. Shame because on 25 they removed BT from pen and I do use that as remote for camera when Samsung is on stand, so I'll skip 25 altogether.

Bottom line, amazing all rounder, one of the best for that, but if you're a niche user, especially for photography, there are better options out there.",2025-01-31T10:09:56Z,2025-01-31
ITJVzQXIUco,Was it worth the price?? usually it doesn't matter most of us..most of us just finance phones through our carrier and upgrade and jump to next phone. I don't have $1300 to drop all at once,2025-01-22T01:55:57Z,2025-01-22
ITJVzQXIUco,"Hi, I hope you noticed this. Can you create a video comparing an updated S24 Ultra vs. an out-of-the-box one? Since I tested my S24 Ultra and a demo unit from the physical store today, the difference in camera performance was noticeable.",2025-02-26T15:18:02Z,2025-02-26
ITJVzQXIUco,"I got S25 ultras with a trade of S24 Ultra and when I used both at the same time, I have decided to keep my S24 ultra and returning the S25 Ultra today. When you hold the S24 Ultra, you feel you are having a very powerful, strong, and stylish/different phone unlink the S25 Ultra it appears like any other phone.",2025-02-11T10:42:25Z,2025-02-11
ITJVzQXIUco,"Nice video! Just upgraded my s23u to s24u titanium grey and it loooooks sexy. Way more premium looking than the s25u. For me overall, not much diff with s23u but i love the fact that this has 7 yrs software support. :)",2025-01-29T11:19:54Z,2025-01-29
ITJVzQXIUco,"For me it's only been 7days, I got mine on S25 Launch day for $750/used in new condition.",2025-01-29T04:41:23Z,2025-01-29
ITJVzQXIUco,Good video. Should I just wait for the s25 ultra or get the s24 ultra right now?,2025-01-21T18:25:18Z,2025-01-21
ITJVzQXIUco,I think I will pick this phone over the iPhone 16 pro max Mr Nick😊😊,2025-01-21T23:51:29Z,2025-01-21
ITJVzQXIUco,"S24U still awesome. I thought i wanted upgrade to smaller S24+ I did it , but some reason don't like 25+ so going back to my S24 Ultra",2025-03-15T23:31:47Z,2025-03-15
ITJVzQXIUco,"S23 Ultra 2 years later? 
Im an S23 Ultra owner and I got to say the S24 Ultra will be remembered for being a peak note phone. S24 Ultra so cool. Still love my S23 Ultra but S24 Ultra flat display seems much easier to apply screen protectors.",2025-01-24T02:21:51Z,2025-01-24
ITJVzQXIUco,I have the 512 gb version of the s24 ultra titanium black,2025-01-21T21:39:17Z,2025-01-21
ITJVzQXIUco,"hello Nick, how do you order the samsung ? i mean do you order it from there website??",2025-01-22T05:44:37Z,2025-01-22
ITJVzQXIUco,Note series convert to fold. What do you think nick,2025-01-21T16:41:08Z,2025-01-21
ITJVzQXIUco,After the software update how is the  phone doing? Has it got any downgrades yet?,2025-05-15T09:22:53Z,2025-05-15
ITJVzQXIUco,"Hi Nick,
Thank you for the great video.
can you help me out choosing between the oneplus 13 and the s24 ultra i even got a deal on the s24 ultra now just for  900 euros.
Please let me know what you think.
Thank you very much!",2025-03-04T22:46:22Z,2025-03-04
ITJVzQXIUco,"The Samsung Galaxy S24 Ultra is one of my favorite smartphones of all time. However, I actually prefer the Samsung Galaxy S23 Ultra and Samsung Galaxy S22 Ultra more for their better design, curved display, more premium looking Armor Aluminum build, and 10mp 10x optical telephoto cameras. Since all of the recent Samsung Galaxy S Ultra Series smartphones have basically the same specs, features, capabilities, and software, it mostly comes down to which design looks better to me. My top 5 favorite smartphones of all time in order based on their design and specs are the Samsung Galaxy S23 Ultra, Samsung Galaxy S22 Ultra, Samsung Galaxy S24 Ultra, Samsung Galaxy Note 20 Ultra, and Samsung Galaxy Note 10+.",2025-05-19T14:04:38Z,2025-05-19
ITJVzQXIUco,S24u and s25u are 100% worth the money. S25u will last even longer being on an entirely new infrastructure in specs.,2025-06-18T19:05:55Z,2025-06-18
ITJVzQXIUco,"I got this phone to start vlogging, the camera is amazing, also why don't you have case?",2025-02-13T17:50:34Z,2025-02-13
ITJVzQXIUco,"YouTubers will gloat over the Samsung phones, but never use them as their main phones lol",2025-01-21T19:33:41Z,2025-01-21
ITJVzQXIUco,I hopefully will order one from ebay tomorrow Im excited,2025-05-20T00:30:51Z,2025-05-20
ITJVzQXIUco,"guys, i'm thinking of getting the s24 ultra, but i've been seeing some reviews saying it still gets laggy and stutters even after updates?? any s24 ultra users here — please give me your honest opinionnnn!
(p.s. i used to have the iphone x and wasn't happy with the heating + battery life, which is why i'm considering switching to samsung)",2025-05-27T13:47:36Z,2025-05-27
ITJVzQXIUco,Should I get the s24 ultra or get the s25 base model?,2025-01-21T17:41:55Z,2025-01-21
ITJVzQXIUco,Watching on my S24 Ultra.,2025-02-28T01:49:27Z,2025-02-28
ITJVzQXIUco,I'm changing from S22U to S25U,2025-01-21T23:00:59Z,2025-01-21
ITJVzQXIUco,Tomorrow the galaxy s25 ultra will come out,2025-01-21T16:49:46Z,2025-01-21
ITJVzQXIUco,"agree with you and I think I'll keep this even if I get something new, desing i love it 😊",2025-01-21T19:48:09Z,2025-01-21
ITJVzQXIUco,"Been with Apple for years but last year got mine Feb 4,2024 and damaged my Screen 01/17/2025. My ointment (glass container) accidently dropped on my screen now it has a permanent white edge light on the top line and a cracked near the Front Facing Camera. Busy to go in a Samsung Service Center but not Sure if Samsung can replace my Screen and retain the water resistance.. I heard once opened the water resistance is Gone. 

Does someone know the Answer? Still loving my S24 Ultra.",2025-01-21T21:26:45Z,2025-01-21
ITJVzQXIUco,"After using for 9 months my s24 ultra performance is 2069 on single core and 6325 on multicore on geekbench, but it is lower that average can anyone tell the reason?",2025-01-25T07:32:31Z,2025-01-25
ITJVzQXIUco,Buying a 2nd hand 1tb S24U today! Excited for it! 🥳,2025-03-28T23:17:55Z,2025-03-28
ITJVzQXIUco,S24 Ultra 🥰🔥,2025-02-04T16:04:12Z,2025-02-04
ITJVzQXIUco,"I keep looking at the S25 Ultra and even the Plus, but I am not sure I want to upgrade. I still owe $794.45, and I still have 22 more months. Boost Mobile states I can upgrade every year, but I will be put back on a 36-month contract.",2025-03-09T00:15:33Z,2025-03-09
ITJVzQXIUco,I love my S24 Ultra!,2025-01-25T02:25:09Z,2025-01-25
ITJVzQXIUco,"Hey Nick. I’m a 13 mini user switching to S25. I’m not a fan of big phones. However, I’m a fan of the benefits of a big phone. Do u think I would get used to an S25+ or ultra? Maybe with a MagSafe pop socket? I only ask because I know you have experience going from a mini to a large phone. Thanks if you have time.",2025-01-21T15:28:57Z,2025-01-21
ITJVzQXIUco,"Love the video, but do you not remember the charging fires?
NOT ridiculous about the scuffs. I'm like that too.",2025-02-11T06:30:35Z,2025-02-11
G3o_nB9G9EA,Do you think this is a big problem🤔 SUBSCRIBE if like tech content!,2024-12-30T20:29:23Z,2024-12-30
G3o_nB9G9EA,Phone repair guru gonna have lots of business,2024-12-30T20:27:53Z,2024-12-30
G3o_nB9G9EA,Parker Burton!,2024-12-30T20:44:59Z,2024-12-30
G3o_nB9G9EA,"There are screen protector with anti-reflection coating, but mine is still fine. I never touch my S24 Ultra with really dirty fingers and have never left in outside in the sun. It’s always close to me;-)",2024-12-30T22:58:49Z,2024-12-30
G3o_nB9G9EA,There is a thing calked a “ screen protector “,2024-12-31T11:43:54Z,2024-12-31
G3o_nB9G9EA,CLEAN YOUR FRICKIN HANDS before using your devices for long periods of time. It's not that difficult. That oleophobic coating is a blessing,2025-03-19T06:44:34Z,2025-03-19
G3o_nB9G9EA,"Can confirm the screen is not damaged by sunscreen. Mine has looked like that; simply clean with mild soapy water, work it in with your fingers, rinse off and wipe with a microfiber cloth. My coating has no issues besides scratches from a couple of face-down drops from a loose pocket",2025-06-04T02:00:22Z,2025-06-04
G3o_nB9G9EA,S24 ULTRA looking a lot better than those S25 Ultra leaks,2025-01-09T11:21:19Z,2025-01-09
G3o_nB9G9EA,That big tech creator is parker burton,2024-12-30T20:45:06Z,2024-12-30
G3o_nB9G9EA,"Another thing to point out, if you clean your device with alcohol it will remove the Oleophobic coating, for my phone i normally clean it with glass cleaner or lens cleaner and it works wonders

Also for anyone who doesn't have oleophobic coating, there is some kits on Amazon or Aliexpress. Make sure that you have a UV Light to have the Oleophobic coating back, and if you want to protect both the screen and the Oleophobic layer get a Screen Protector.",2025-01-03T23:56:11Z,2025-01-03
G3o_nB9G9EA,"I also own a s24 ultra. No problem so far, it's just i spray isopropyl once in 2 weeks to prevent marks",2025-01-03T21:15:27Z,2025-01-03
G3o_nB9G9EA,"I can agree, this is a huge problem. Ran my phone naked for 6 months after cracking my screen protector. Had permanent smears from sweat and sun baking for months until I hit it with a buffing compound. Still streaks and smears now.

Its been up many Towers but not the best display protection. Sweat smears dont go away without effort.",2025-06-10T23:45:52Z,2025-06-10
G3o_nB9G9EA,"No issues on my S24U.  Decided to risk it without a screen protector, since the screen is so nice and happy to report that after basically 12 months of use, no scratches.

Definitely a step up from any other phone I've had previously, as I've often picked up scratches in a matter of days.",2025-01-09T16:55:51Z,2025-01-09
G3o_nB9G9EA,"yea i have it on mine aswell, its only noticeable when screen is off and viewing at it in direct light but still it is annoying",2025-01-03T14:37:19Z,2025-01-03
G3o_nB9G9EA,The biggest problem is the fact that is too heavy and big for your pockets it falls down on the ground very often when is in the pocket of your pants because is literally build like a flat brick,2025-01-30T19:42:02Z,2025-01-30
G3o_nB9G9EA,"I applied a screen protector not long after acquiring the phone, not a problem. Its a natural thing to do, i don't know a lot about phones but i just assume this thing is very vulnerable and a single unprotected drop spell the end for this phone. So i also put on a phone skin, then a phone casing on top of it for max protection",2025-01-28T18:27:47Z,2025-01-28
G3o_nB9G9EA,"I have a S24U since February, don't use a screen protector, and don't got this problem",2025-01-11T12:05:17Z,2025-01-11
G3o_nB9G9EA,I was on the beach recently & my phone wasn't affected must just be dodgy units lol,2025-01-01T06:55:55Z,2025-01-01
G3o_nB9G9EA,Yeah fr it happens also on my phone but thankfully i have a screenprotector,2025-01-01T18:57:57Z,2025-01-01
G3o_nB9G9EA,"i v been using poco x3 since the launch date until last octobre , almost 5 years , i had no scratch on it and it seem like new , i change protection glass every 3 months , tranparent case every 6 months , since the unboxing of s24 ultra , i installed anti fingerprint film ( i tried glass protection but i don t like reflection ) , i bought also a stock of cases , 10 maybe , different colors and shapes , i never mix my phone with my keys in my pocket and most of the time my phone is in my hands",2025-01-04T01:57:21Z,2025-01-04
G3o_nB9G9EA,This might sound dumb but was it exposed to sunlight or sunscreen(as in the cream),2025-01-01T01:25:32Z,2025-01-01
G3o_nB9G9EA,"The anti-reflective coating over the screen is somewhat similar to the anti-reflective coating over the glasses/spectacles that we use, which gets removed over the time and these coating particles get stuck to some specific parts over the glasses, and I think Samsung will start the business of applying new anti-reflective coating over the displays very soon",2025-01-30T11:42:10Z,2025-01-30
G3o_nB9G9EA,Bro that phone got almost all tech creator awards,2025-01-02T16:29:23Z,2025-01-02
G3o_nB9G9EA,I use the ESR one too it's the best no cap no bubbles good price easy to apply no goofy coners or edges,2025-01-22T21:32:25Z,2025-01-22
G3o_nB9G9EA,"I have the same issue. Had to slap a screen protector on it. Now, the screen is super reflective and under-par. How could samsung not rigorously test this anti reflective screen before rolling it out! What a joke",2025-01-01T19:46:50Z,2025-01-01
G3o_nB9G9EA,I have the same anti reflective coating on my galaxy watch  classic and its been 2 years I'm using the watch daily and the coating is as good as new. And my s24 ultra screen coating also has zero issues,2025-01-02T09:56:37Z,2025-01-02
G3o_nB9G9EA,I've got these permanent smudges . They are replacing the screen for such an expensive phone this is unacceptable,2024-12-30T23:30:40Z,2024-12-30
G3o_nB9G9EA,"Yes. Me too
Several spots on screen on visible when screen is off",2025-01-21T17:00:38Z,2025-01-21
G3o_nB9G9EA,Well...I don't have an S24 Ultra😭,2024-12-31T15:00:21Z,2024-12-31
G3o_nB9G9EA,I put a tempered glass screen protector on my s24 ultra as soon as I got it but my brother did not. His phone had a spot with oleophobic coating head wore off where he touched the phone more frequently like the thumb print area and the top where he pulled down the notification bar,2025-05-15T00:00:01Z,2025-05-15
G3o_nB9G9EA,Does the iPhone 16 have oleophobic coating? Because I just got it on the 26th and now I’m worried if anything will damage my screen.,2024-12-31T06:14:00Z,2024-12-31
G3o_nB9G9EA,I was considering not using a screen protector at all but ended up getting the Samsung antiglare screen protector and now im really glad i did,2025-01-16T05:28:13Z,2025-01-16
G3o_nB9G9EA,Nope. But i use screen protection 😂,2024-12-31T04:47:46Z,2024-12-31
G3o_nB9G9EA,I have that problem but I have the s24 FE. I have a screen protector and it did it. I took off the screen protector and it still did it. I had to go to the Roger's store and they replaced the entire screen. Even then it didn't work,2025-01-18T04:29:33Z,2025-01-18
G3o_nB9G9EA,"This would occur on any smartphone screen. The oleophobic coating is not permanent and will degrade by normal use, or by using acetone, rubbing alcohol, or any other such substances to clean your screen.",2024-12-30T22:36:06Z,2024-12-30
G3o_nB9G9EA,In malaysia so popular use hydrogel screen protector.. it has oleophobic and so smooth,2025-01-07T20:02:20Z,2025-01-07
G3o_nB9G9EA,I got the screen Protecter as i got my phone,2024-12-31T13:05:56Z,2024-12-31
G3o_nB9G9EA,Mine was bad back in November when i just got it and thought my screen was peeling off 😂😂 it's noticeable in the side bezels now but not as much on the screen itself,2025-01-15T21:22:52Z,2025-01-15
G3o_nB9G9EA,"Man if this issue was with i phone . Everyone would have been hating on it , smack talk it and laugh on it",2025-01-02T20:29:02Z,2025-01-02
G3o_nB9G9EA,"I had my s24 ultra for 3 days before the screen stopped working all together. My buddy had his s24 for 2 weeks before his screen stopped working. Thank god I kept my S22 ultra. The S22 ultra is still a beast! Hopefully, the S25 ultra won't have these issues.",2025-01-20T19:12:38Z,2025-01-20
G3o_nB9G9EA,What the actual.... people don't use phone case and screen protector???,2025-01-23T15:58:25Z,2025-01-23
G3o_nB9G9EA,"Mine had that problem months ago, but it eventually corrects itself...No problem anymore👍🏻👍🏻",2025-03-01T17:48:02Z,2025-03-01
G3o_nB9G9EA,It might be due to the anti reflective coating that some Samsung users brag about,2024-12-31T13:25:18Z,2024-12-31
G3o_nB9G9EA,"I have this problem but only on a small area and it's not so bad. As I can live it and I want to enjoy the screen to the fullest, I won't use any screen protector.",2025-01-04T11:04:49Z,2025-01-04
G3o_nB9G9EA,This isn't new and onlyophobic coding is a chemical treatment. That naturally wears off after time you can use certain cleaning sprays that will temporarily restore it. Every phone's coding rubs off,2025-01-01T23:50:13Z,2025-01-01
G3o_nB9G9EA,I have the same screen guard which is best in market and very good customer support.  Love ESR from India.,2025-01-14T16:01:34Z,2025-01-14
G3o_nB9G9EA,Where did you get your tempered glass? I bought one for €20 and it was total bull crap,2025-01-01T17:42:41Z,2025-01-01
G3o_nB9G9EA,"Yes I did face this problem so I installed screen protector, now the anti glare is gone but that is fine for me.",2025-01-03T19:01:11Z,2025-01-03
G3o_nB9G9EA,"So I recently got a new s24 ultra for Christmas the screen looks a bit fuzzy, maybe because of the pixels, but do you have any suggestions?",2024-12-31T04:57:05Z,2024-12-31
G3o_nB9G9EA,Yeah I own one  it's good .I don't have any problems on the screen but a lot of dust gets collected in the camera If you use a cover,2025-01-30T12:32:14Z,2025-01-30
G3o_nB9G9EA,"You did it, you listened to me lol",2024-12-30T22:35:58Z,2024-12-30
G3o_nB9G9EA,"Been using my S23 Ultra without a protector for over 7 months. Had no problems so far, I'm just aware of what was on my hands before touching my phone screen especially oil",2025-01-09T07:08:45Z,2025-01-09
G3o_nB9G9EA,"I had the same problem with the 23 uktra i was out in the sun for 5 min on my phone. Water would gang up inside the circle that got damaged on the screen too, it was welrd. I had to put pressure on the spot and put a screen protector over it before the mark would appear again to make it 'dissapear' to the eye.",2025-01-14T20:41:04Z,2025-01-14
G3o_nB9G9EA,Something you could take to The Greatest Technician That's Ever Lived.,2025-06-11T22:44:52Z,2025-06-11
