video_id,comment,comment_published_at,date
nyxcO2vdcCg,"I have followed your channel for years, and first time ever a phone sustained scratch at level 7 and deeper grooves at level 8 is unprecedented. Massive respect to S24U. Iphone users will be like is not really matter.",2024-02-04T14:43:23Z,2024-02-04
nyxcO2vdcCg,"01:19 - ""...for people who go out in the daylight... if you're into that kinda thing"" 😂😂

I feel you man, I feel ya",2024-01-30T15:41:52Z,2024-01-30
nyxcO2vdcCg,So sad to see the phone being worried about the S Pen and wanting it to be in a safe place while it's already disintegrated,2024-06-04T18:54:01Z,2024-06-04
nyxcO2vdcCg,"A.NEW.ERA. 

So many of us came here year after year waiting for this and always getting the ""Scratches at level 6, with deeper grooves at level 7"". But no more boys, we have finally reached the next level.",2024-01-30T15:19:57Z,2024-01-30
nyxcO2vdcCg,"The glare reduction, scratch resistance level up is actually a massive upgrade.",2024-02-01T05:58:24Z,2024-02-01
nyxcO2vdcCg,"We've made it to the next era ""Scratches at level 7, with deep grooves at a level 8""",2024-02-04T10:16:33Z,2024-02-04
nyxcO2vdcCg,"What a downgrade for the s25u, Came here to show respect to the s24u display...",2025-02-02T10:09:53Z,2025-02-02
nyxcO2vdcCg,I definitely was not expecting the results of the scratch test!,2024-01-30T15:19:30Z,2024-01-30
nyxcO2vdcCg,"I've really come a long way on this channel for this man to finally say ""Scratches at level 7, with deeper grooves at level 8""",2024-01-30T15:29:22Z,2024-01-30
nyxcO2vdcCg,"His calmness while going through a methodical torture of the device is both sere at first and scary when you think about it. 
Hope he doesnt choose a career as a spy interrogator.",2024-01-31T14:34:51Z,2024-01-31
nyxcO2vdcCg,Funny how the S25 is back to scratches at a level 6 with deeper grooves at a level 7... This was just too good for them,2025-02-01T21:50:38Z,2025-02-01
nyxcO2vdcCg,Just switched (like an hour ago) to an s24 ultra from exclusively having an iPhone. Something just felt different about Samsung this year and I had to see for myself. I am way too pleased with the tiny pen that lives inside my phone now,2024-01-30T20:20:07Z,2024-01-30
nyxcO2vdcCg,"I just got my s24 ultra yesterday. And the screen clarity on this thing is absolutely insane. I have had a note series phone since the two and the 10 plus I had for 4 years and actually love that phone. I only upgraded to the fold4 last year after they killed off the note series and I wanted to get the newest 5G capabilities and not just the ultra wide 5G that the Note 10 plus 5G came with. But I found myself using the front small screen more often than taking the time to open up the phone to use it and really only used it to watch movies or shows. And since the ultra line took back where the note left that big gaping hole in the Samsung lineup I decided to jump back and get the 24 ultra. Where with trading in my fold4, getting a pre-order discount, and another $150 off coupon on top of it, and the 512 GB matching for the same price as the 256, I got mine delivered for just a hair over $700. It also came with case and screen protector and I got the Samsung buds pro 2 for free with it as well. So all in all not a bad deal for all that for that price.",2024-01-30T18:25:33Z,2024-01-30
nyxcO2vdcCg,"For the S24 Ultra, as nice and durable the tiranium frame is, the anti reflective screen is the upgrade that stood out for me, as it won’t glare like other phone screens especially when using it under the direct sun. The level 7 with deeper grooves at level 8 is beyond what I have imagined ❤",2024-01-30T19:52:58Z,2024-01-30
nyxcO2vdcCg,"S25U just got released
we re downgraded to SCRATCHES AT LEVEL 6, DEEPER GROOVES AT LEVEL 7 :(",2025-02-01T22:16:14Z,2025-02-01
nyxcO2vdcCg,Samsung really changed the game this time around. Scratches at level 7 and deeper groves at level 8 is an amazing feat.,2024-01-31T01:44:40Z,2024-01-31
nyxcO2vdcCg,I saw a video by PBK Reviews who did the Mohs test first and he also got very unnoticeable scratches at 7 and major scratches at 8. I've been waiting for Zak's video to confirm this and it's amazing it does confirm it!,2024-01-30T16:02:28Z,2024-01-30
nyxcO2vdcCg,Fun fact: The 'capacitor' in the s-pen is actually a Lithium Titanate  (LTO) Battery made by Nichicon. This is in reference to @5:07. Interesting stuff and something I learned at CES!,2024-01-30T20:10:40Z,2024-01-30
nyxcO2vdcCg,"3:48 aged like milk, it's back to being the same with s25 XD",2025-02-02T11:31:48Z,2025-02-02
nyxcO2vdcCg,"I don't think adding titanium to smartphones was a good idea, the lack of flexibility is very bad when it comes to absorbing impact.",2024-01-30T09:20:45Z,2024-01-30
nyxcO2vdcCg,"I just got the s24 ultra 1TB after upgrading from my note 10 plus of 4 years. Even though my old note 10 plus is still working well, this was definitely a huge upgrade that is well appreciated!",2024-01-30T16:29:55Z,2024-01-30
nyxcO2vdcCg,"Omg, had to pause the video to express the shock that scratches appear on level 7 with deeper grooves at level 8! I was waiting a long time for this moment!!!",2024-01-30T22:07:40Z,2024-01-30
nyxcO2vdcCg,"He projects Dexter serial killer vibe, amazing video 🤝",2024-03-27T16:25:51Z,2024-03-27
nyxcO2vdcCg,This phone has made history with the scratch test 😂,2024-01-30T15:24:16Z,2024-01-30
nyxcO2vdcCg,"Technology has evolved because 
Jerry has said ""scratches at level 7, with deeper Groves at level 8""",2024-01-31T05:59:35Z,2024-01-31
nyxcO2vdcCg,"Here I am looking for reviews on the ultra (the phone I just purchased) not realizing that I would find something much better. The reckless abandon in this video is top notch and seeing someone deface a $1300 product like it was nothing, did something for me. Going to sub. Keep up the excellent work.",2024-02-01T17:02:24Z,2024-02-01
nyxcO2vdcCg,And they downgraded the legendary scratches at level 7 and deeper groves at level 8.,2025-02-02T01:53:46Z,2025-02-02
nyxcO2vdcCg,"What a glorious moment to be the first to witness ""scratches at level 7, with deeper grooves at level 8"" after how many years subscribed to this channel! 😅",2024-01-31T18:58:27Z,2024-01-31
nyxcO2vdcCg,"Am I the only one who got goosebumps😮when Zack said ""Things will never be the same"" ?",2024-01-30T15:43:58Z,2024-01-30
nyxcO2vdcCg,The durablity test is here finally !,2024-01-30T15:11:20Z,2024-01-30
nyxcO2vdcCg,"I think the last time I was here was at the iPhone XS Max release and I've been watching before the crossover episode with WhatsInside was aired.

I came back after I heard rumors that there's now a glass that scratches at level 7 with deeper grooves at level 8 and boy did I get one hell of a nostalgic hit.

Zack, I can't express how happy I am to see how big your channel's grown and couldn't say anything short of well-deserved. Hope we both live long enough to witness you reaching scratches at level 9 with deeper grooves at level 10.",2024-08-31T04:31:08Z,2024-08-31
nyxcO2vdcCg,Wow. Scratches at a level 7 with deeper grooves at a level 8. Incredible.,2024-01-31T00:14:50Z,2024-01-31
nyxcO2vdcCg,"0:03 Everyone pointing out 2017 Essential phone, but forget Nokia 8910 existed in 2002.",2024-01-30T19:12:19Z,2024-01-30
nyxcO2vdcCg,5:00 this is the only time i felt the pain,2024-01-30T15:27:56Z,2024-01-30
nyxcO2vdcCg,These videos hurt my soul lol ...but glad someone does these tests,2024-03-06T18:05:49Z,2024-03-06
nyxcO2vdcCg,Anti-glare and scratches starting from level 7 and deepening at level 8 is actually legendary,2024-01-30T22:20:56Z,2024-01-30
nyxcO2vdcCg,Dear Note 9 we have been together for almost five years & you been good to me. We traveled around the world multiple times. We close many deals together and because of you I was able to stay in contact with many new friends and family from around the world. Did many video calls and got closer to people emotionally because of you.  You were definitely there when I needed you the most. Time to upgrade to S24 Ultra and i see you will arrive today.  Will miss you note 9. ♥🙏♥🙏,2024-02-03T19:44:57Z,2024-02-03
nyxcO2vdcCg,I love these videos and have been watching them for years. And I will never get over the metal scrapping sounds. I have to skip it every time. 😂,2024-02-02T18:53:31Z,2024-02-02
nyxcO2vdcCg,4:42 Did he just say S23 Ultra?,2024-10-15T13:46:12Z,2024-10-15
nyxcO2vdcCg,"2:40
🗣Mom, bring the calendar!!!",2024-01-30T15:16:52Z,2024-01-30
nyxcO2vdcCg,"I've been using the Note line up for 10+ years. Note 3, Note 7, Note 9 and Note 10+. I did not want to upgrade because my Note 10+ is still rocking. But for work and school, the features, build quality and performance upgrade that the 24 Ultra offers is making me consider to upgrade. Great video ! 😎",2024-01-30T15:40:40Z,2024-01-30
nyxcO2vdcCg,I just bought the 24 ultra then saw your video. I was on the edge of my seat through your review! Now i feel happy with my purchase......just have to wait for delivery. 😢,2024-01-30T21:18:49Z,2024-01-30
nyxcO2vdcCg,"If you can scratch a S24 ultra, you are definitly rich xd",2024-11-02T22:07:45Z,2024-11-02
nyxcO2vdcCg,The Gorilla Glass engineering team was surely holding their breath for this one!,2024-01-30T15:30:49Z,2024-01-30
nyxcO2vdcCg,First time I got an Ultra phone from Samsung. And I can see it's worth it this year. I like how all phone manufacturers are going for long OS support and more durable builds. Less chances of me needing to repair my phone.,2024-01-30T16:06:31Z,2024-01-30
nyxcO2vdcCg,The only review I need is from this channel. I cannot believe we heard a different scratch resistance level!,2024-01-31T03:25:39Z,2024-01-31
nyxcO2vdcCg,Had this in my pocket for 1 day with no screen protector and got a scratched screen now,2025-06-11T03:59:23Z,2025-06-11
nyxcO2vdcCg,"""Scratches at a level 7, with deeper grooves at a level 8.""

Ladies and Gentlemen, we got him.",2024-01-30T16:07:20Z,2024-01-30
nyxcO2vdcCg,Hearing “deeper grooves at level 8” is a historical moment,2024-02-04T11:43:22Z,2024-02-04
nyxcO2vdcCg,"My God, hearing ""scratches at level 7, with deeper grooves at level 8"" gave me goosebumps! Amazing!",2024-01-31T13:55:20Z,2024-01-31
nyxcO2vdcCg,"Sad story, but here goes, Bought this phone on a third-party app. Was extremely excited that I finally could get a sweet phone and get away from this dumb iPhone. Well, I shouldn't have done that. Lost my money to a phone locked in someone's name. The carrier won't/can't help either. Smh end story. On the other hand, this phone is absolutely amazing. The quality in the pictures is outstanding. It's fast durable and fits perfectly in my hand. I will save up to get one from a retail store for sure, but it may take a second. Sorry for the sob story. Love your content. Keep up the great work!!!",2024-03-15T20:36:45Z,2024-03-15
nyxcO2vdcCg,"I love that moment with the scratches at level 7, it's been such a long time building to it",2024-02-03T22:31:06Z,2024-02-03
nyxcO2vdcCg,"I’m beyond shocked by the “scratches at level 7, deeper grooves at level 8” bit. 
It feels like when someone breaks a major time-barrier in a popular speedrun.",2024-02-04T21:30:48Z,2024-02-04
nyxcO2vdcCg,THE HISTORY HAS BEEN MADE AND I WAS NOT EXPECTING THIS. from a Samsung phone?? never i was just here for a bit of Jerry's sarcasm and ocassional asmr test that is just relaxing bit when i saw and heard scratches at a level 7 and deeper grooves at lever 8 i was SHOCKED cuz it aint even sapphire And i just can't explain. nothing will be same and i literally need anyone to share my excitement with.,2024-02-03T20:16:21Z,2024-02-03
nyxcO2vdcCg,"""Scratches only begin at level 7 with deeper grooves at level 8""... What a moment 3:44",2024-08-31T17:23:16Z,2024-08-31
nyxcO2vdcCg,7:26 he put the open flip 5 to the pile of tools like nothing bad would happen to that screen,2024-01-30T16:52:29Z,2024-01-30
nyxcO2vdcCg,I was having a little buyers remorse upgrading my note 20U to the 24U. But this video alone supports my decision. Ty Jerry.,2024-01-31T17:05:24Z,2024-01-31
nyxcO2vdcCg,R.I.P 🪦 Scraches at level 6 and Deeper grooves at level 7 thanks for all these years of perfection 😢,2024-01-31T06:49:47Z,2024-01-31
nyxcO2vdcCg,7:55 😂😂😂this is why I'll forever stay subscribed,2024-10-13T05:42:33Z,2024-10-13
nyxcO2vdcCg,"Perfect timing 🎉
Waiting for teardown 
Have to check the titanium and vapour chamber cooling setup",2024-01-30T15:15:26Z,2024-01-30
nyxcO2vdcCg,"When he just casually broke the S-Pen... that hurt me inside 😢 Poor S-Pen, you didn't deserve that!",2024-01-30T16:18:43Z,2024-01-30
nyxcO2vdcCg,"I was actually about to cry when he said “Scratches at a level 7, with deeper grooves on a level 8.”
Was not expecting that fr 😭
It’s a big day bros! He said the thing we were waiting for!!🎉",2024-01-30T23:50:28Z,2024-01-30
nyxcO2vdcCg,"IT FINALLY HAPPENED!!! ""Scratches at a level 7 with with deeper grooves at a level 8"" I NEVER THOUGHT THIS DAY WOULD COME!! 🤯🤯🤯",2024-03-20T01:32:47Z,2024-03-20
fFVjVPbdeIg,Beli di mana?,2025-06-19T11:43:34Z,2025-06-19
xr8CpY3tM8U,S24 ultra no doubt,2024-01-31T20:44:08Z,2024-01-31
xr8CpY3tM8U,"1200 wars : ⚔️ 
2025 wars :📱",2025-01-22T18:21:00Z,2025-01-22
xr8CpY3tM8U,Samsung the win 💪🏾,2024-02-01T11:00:20Z,2024-02-01
xr8CpY3tM8U,I did a speed test for my note 20 ultra and my iPhone 15 Pro max and in everyday tasks the note 20 ultra still holds up!! It's over 3 years old! It shows to me that smartphones have peaked,2024-02-01T09:05:35Z,2024-02-01
xr8CpY3tM8U,"I don't care who has the best camera or is the fastest phone in benchmarks. Every flagship smartphone takes super pictures and video's and is blazing fast. 97% of all smartphone users don't even see the differences.
I'm a SMARTPHONE user so I want the best screen, battery, usablility and productivity options, gaming- and multi-media experience, personalization options and innovation. 
I want DEX, KNOX, S-PEN, call recording, multi-tasking, multi-window, fingerprint scanner, best screen, widgets, themes, integration with windows, the biggest eco-system (Samsung SmartThings), fast cha",2024-01-31T21:45:52Z,2024-01-31
xr8CpY3tM8U,as a samsung fan i know iphone one of the best phone for gaming and the gaming experience and also stability of iphone better than all andoid but i ❤ andoid phones .for example new andoid works good but old iphone works like a new android .but i respect both andoid 🤝apple ❤❤❤,2024-02-01T21:38:33Z,2024-02-01
xr8CpY3tM8U,animations on iphone are so beautiful,2024-04-02T16:49:28Z,2024-04-02
xr8CpY3tM8U,Bro They need to add fast charging on iPhone and galaxy phones 100 watt,2024-01-31T20:56:33Z,2024-01-31
xr8CpY3tM8U,"S24 Ultra is the best, Hope i can get one, Must have a stylus tho.",2024-02-01T22:07:49Z,2024-02-01
xr8CpY3tM8U,"Ahhh yes , that 1 millisecond difference is gonna save the world 💀💀💀",2024-12-03T10:20:53Z,2024-12-03
xr8CpY3tM8U,"Everyone at the moment: ""wait for the next generation of the phone""
Are you serious?
If you read articles you would know they won't bring any innovative components and accessories until the next 3-4 years, how does research work on your opinion? for what they are called top of the range, they won't bring something even better, research requires a lot of funds and investments. Stop filling the comments with idiotic stuff. Also, stop the contests between iPhone and Samsung, Samsung brought more innovation these years. Maybe iPhone will be in the next decade. That's how competition in the marketplace works.",2024-12-28T18:08:02Z,2024-12-28
xr8CpY3tM8U,Hahah i am thinking of selling my iPhone 15 pro max and buying 24 ultra 😂,2025-04-25T06:16:29Z,2025-04-25
xr8CpY3tM8U,"16:44 it wasn’t even his idea, it was Jeremy Zag’s (while Thomas was in vacation, Jeremy wrote the show)",2025-05-20T21:46:30Z,2025-05-20
xr8CpY3tM8U,"Both are great phones. The processor performance on both is the same. If you say the Snapdragon 3rd gen is better for gaming, the A17 Pro Bionics can also handle any demanding game smoothly. The same applies to intensive video editing and rendering tasks. You need to check multiple sources to gain insight into that. 

In daily use, you won't even notice the difference. Both have their own advantages and disadvantages compared to each other. The sole disparity lies in our biased mindset.",2024-03-26T13:50:43Z,2024-03-26
xr8CpY3tM8U,Nav bar for the Samsung Galaxy device please,2024-02-01T00:41:52Z,2024-02-01
xr8CpY3tM8U,Doesn’t matter who is fast. Stability upon time matters as a gamers perspective. There is not a single gamer in the world who will choose samsung s24 ultra upon iPhone cause iphone have best stability every known to phones.,2024-07-08T08:13:41Z,2024-07-08
xr8CpY3tM8U,Its A tie because they open at the same time and youtube on the iphone 15 pro max just has a intro,2025-06-01T15:10:31Z,2025-06-01
xr8CpY3tM8U,"Be cool if you were to show us your task  launcher and prove that you don’t have the apps already loaded on the s24u vs iPhone 15PM launching from a cold start - I’ve got both phones and will do the same test this evening. Film it too - as well, I can show you identical apps (X-Plane & Aerofly FS World), very taxing amps with user control over graphic performance - where the s24 ultra can’t maintain 30fps (dropping as low as 12-14fps in populated areas and/or cockpit controls) - while the iPhone, same settings, doesn’t drop below 57-58fps, regardless of the terrain or the drawing of instrumentation and real time mapping on a glass cockpit. Even has a difficult time with steam gauge SuperCubs and 15/172s! 

I love both for different reasons, and I can show you the fact the S24 Ultra will NOT allow the use of Google Drive and/or Photos as a default repository for media or backing up your phone. The ONLY option is OneDrive! I’ve owned every iPhone since 2007, and along with them, I purchased an Android phone - initially, Notes 1, 2, 4, & 5 - I switched to Pixels, back to Sammy, and took a couple year break, until the S21/iPhone 11. This, even though the 11’s had the power and efficiency in the chip, the 21 was a better choice in my opinion. That opinion changed with 12 - 15 (I have 15PM and 24u, no 16/25) and the ridiculous redundancy of EVERY mandatory smartphone app; calendars, phones, messaging, notes, wallets, stores, calculators, voice recorders, contacts, clocks, ‘internet’, reminders, find my apps, and I’ve likely forgotten a dozen - but the ones I named ALL have the option to use the Samsung or Google version of the keyboard (one I forgot) as the default keyboard 
Unfortunately, and as ubiquitous as Google Drive/Photos (2 apps Mt View hasn’t abandoned) have been the last decade, as well as they’ve worked cross platform - whether WIndows or macOS, iOS, Android or iPadOS, Drive and Photos are arguably as good or better file managers than others’ native apps. Like Sammy’s Gallery! Who’s EVER used it other than Samsung SXX users? Or Galaxy tabs or laptops? Those are the ONLY three things capable of accessing your Samsung Gallery
EVERY other Android phone or tablet - including Samsung, has allowed Google Photos as your repository for stills and motion, Drive for audio and docs spreadsheets etc. No longer.

NOW if you want your pictures backed up you HAVE to have a subscription for MS365, which includes OneDrive, the ONLY option for photo backup (& video and everything else on your phone) able to be used other than a local SSD, same that you can do on iPhone - however, I can choose Chrome as my default browser on iPhone - Google Maps as my default mapping app, or G-Mail, Drive, Photos, everything is an option on Apple’s products.

The fact Samsung has 
A) dropped support for Photos and
B) done the same with Drive is over the top, and IMO, a purchase killer. Period

As a subscriber already of MS365 pre-s24u purchase, I’d have returned it, as you’re looking at an extra $120 a year to store your photos in the cloud, instead of the tiers of Google storage sizes.
This is my biggest complaint about the Samsung phones but followed closely by a few dozen redundant apps that Samsung copies Google’s and other’s to use open code software as a foundation for ONE UI, the crappiest OS on mobile in existence. Even though G-Board eats storage, the Samsung keyboard’s a joke.

I will say, the ONLY two things I’ve found preferable on the s24U vs the iPhone are the display (but ‘just’ as both are stellar) and the lack of almost ANY software I use 90% of the time on iOS and iPadOS - from incredible cameras for both stills and video, Timelapse and celestial - Play Store options are a joke in comparison… and audio production; from Digital Audio Workstations AKA DAWs to synths, percussion, wave editing and simple recording apps with multitrack abilities that are essential for prosecution. 
Why a positive? I don’t  have to buy them again!
Display, a slight edge, otherwise, I guess - and I’ve tried, I’m not a phone customizer guy. The themes and goofy fonts, the single colors or gradients, and the need to feel unique or different doesn’t appeal to me at all, and wile the ultrasonic finger print reader is amazing, it also sucks trying to land it correctly first try… where is the iPhone or iPad w/Face ID work instantly, battery life are near parity, my 15PM might have a slight edge, especially if gaming. And Microsoft and Adobe have MUCH better performance and capability, as well as apps - period - on iOS. While Docs and Sheets work okay, they don’t compare to the MS Suite, not even Apple’s Office suite - and messaging? What a S&%T Show! 
iMessage is so far ahead of either Goog or Sam’s messaging - and anyone older than 30’s not ‘Snapping’ - and unless you’re a fan of illegal communication, Signal and the rest don’t hold a candle to iMessage’s continuity with all Apple products one has; Macs, iPads, Apple Watches, Car Play, Home Pods, Air Pods, vertical and horizontal integration is definitely a massive plus, even though Samsung’s doing their best to jump in the sack with Windows, using connect to Windows, OneDrive as only option to backup - they’d be better off developing, from scratch, without the 30 years of x86 cruft built on cruft so you can still run that ‘legacy’ software that’s not been updated since last millennium - Samsung could easily take a couple years to write a decent third OS, without the Android Open Source code or the foundation of Windows 11’s nightmares… instead building better continuity between ALL devices - opening their market up significantly (and giving their customers back a dozen gigs of memory while eliminating the Google apps you can’t use!)",2025-04-03T01:20:34Z,2025-04-03
xr8CpY3tM8U,"do not compare iphone 15 pro max with S24 ultra, try it with S 22 ultra, 24 ultra is 2 years ahead of iphone 😊😊",2024-02-14T19:14:33Z,2024-02-14
xr8CpY3tM8U,"Which is more reliable for long year use? For 4yrs uasge which is more reliable?? Myself got s21 ultra bought at 2021 Nov nd today in Jan 2025 it got green line on screen out of nowhere (no dropped, nothing) should i buy apple 16pro max or s25 ultra for reliability? Pls help🙏",2025-01-20T06:07:20Z,2025-01-20
xr8CpY3tM8U,My iPhone will still be smooth after 2 years,2024-04-20T21:17:47Z,2024-04-20
xr8CpY3tM8U,"Android: 😁
iPhone:😁
Android vs. iPhone:🤡",2025-06-11T02:56:35Z,2025-06-11
xr8CpY3tM8U,"iPhone 11 VS Samsung Galaxy A25 5G

                           ⭐️⭐️⭐️
                       3rd Stars of Rating",2024-02-02T03:54:51Z,2024-02-02
xr8CpY3tM8U,"Speed doesnt matter, enjoying the phone always matters",2024-12-30T13:07:24Z,2024-12-30
xr8CpY3tM8U,Apple doesn’t focus on the app opening speed it just focuses on the cpu and gpu,2025-01-16T16:11:02Z,2025-01-16
xr8CpY3tM8U,For your info iPhone is made for cool animations in opening and closing not for speed test so apple opening closing spec is more satisfying in reality iPhone says that and Samsung also know,2025-01-21T13:57:28Z,2025-01-21
xr8CpY3tM8U,but which phone are you recording with this video ? Samsung or Iphone ?,2025-06-02T15:02:19Z,2025-06-02
xr8CpY3tM8U,"In 2025, you can get both for the price on 25 ultra or 16 pro max 😮",2025-03-11T22:28:50Z,2025-03-11
xr8CpY3tM8U,Finally no awful phonk music😭😭😭🙏,2025-01-14T03:02:19Z,2025-01-14
xr8CpY3tM8U,s24 ultra vs s21+ please,2024-01-31T23:29:41Z,2024-01-31
xr8CpY3tM8U,"Apple 😊😊
Samsung 😊😊
People who commented anything that compared each phone 🤮🤮",2025-04-08T02:46:26Z,2025-04-08
xr8CpY3tM8U,It’s because of the animation,2025-05-05T13:13:23Z,2025-05-05
xr8CpY3tM8U,Watching from my s24 ultra ❤,2025-03-08T15:50:21Z,2025-03-08
xr8CpY3tM8U,"So are these comparison even worthy for choosing which one is better 😂😂😂😂, please just talk about the pros and cons of each phone, these comparison don't make sense",2024-02-01T14:12:46Z,2024-02-01
xr8CpY3tM8U,Samsung S24 really cooked iPhone this year,2024-02-01T19:31:48Z,2024-02-01
xr8CpY3tM8U,It's kinda sad the s24 even hangs with  iPhone considering how light and basic iOS is. There's a lot more that's being processed with Android OS,2024-02-23T07:45:58Z,2024-02-23
xr8CpY3tM8U,"Samsung has good loading nice camera quality, but in general it just doesn’t feel smooth, and Apple has these little touches of smoothness to the phone, and just modern and simple things that makes it better. If you’re someone who loves cameras photos and everything then sure maybe the Samsung is for u, if you’re just an Apple fan and you like smooths phone , and good camera quality just can’t zoom far, get an iPhone.",2025-01-26T07:39:19Z,2025-01-26
xr8CpY3tM8U,S24 ultra is too hot to handle 🔥,2024-02-10T12:40:24Z,2024-02-10
