video_id,comment,comment_published_at,date
XaqOejIaFgM,7 years security update and 7 years OS upgrade is value for money in itself. Weldone Samsung.,2024-01-26T22:14:21Z,2024-01-26
XaqOejIaFgM,"My S20 is 4 years old and it's still getting monthly security updates, I've always respected that.",2024-01-27T18:53:11Z,2024-01-27
XaqOejIaFgM,"Not that you’re ever overly negative in your reviews but I think this is the most glowing review I’ve seen you make over the years. You seem legitimately satisfied, even a little giddy about the refinements, without going over the top. I’m excited for this device",2024-01-27T04:54:57Z,2024-01-27
XaqOejIaFgM,Whose here after the awful s25 launch,2025-01-23T06:07:47Z,2025-01-23
XaqOejIaFgM,I've got mine ordered. Going from an S8+ to the S24 Ultra. Big jump.,2024-03-16T04:38:11Z,2024-03-16
XaqOejIaFgM,Biggest improvement : SCRATCHES AT LEVEL 7 WITH DEEPER GROOVES AT LEVEL 8!!!,2024-01-31T22:11:06Z,2024-01-31
XaqOejIaFgM,"This is probably the first phone review from MKBHD I've watched, where he doesn't mention anything he doesn't like about the phone. This phone is great!!",2024-01-27T06:00:54Z,2024-01-27
XaqOejIaFgM,Here after shitty iPhone 16 launch. Been an apple user since iPhone 6 but switched 3 days ago. Highly satisfied.,2024-09-24T13:25:11Z,2024-09-24
XaqOejIaFgM,"As a pixel user, I was really fascinated Google did so much for them with the AI stuff. Would love a full video on that",2024-01-27T11:53:59Z,2024-01-27
XaqOejIaFgM,"00:40 - Intro
1:19 - Screen & Screenlock
2:40 - Battery
3:30 - Performance & S-Pen
5:08 - Camera 
8:30 - Software & AI features (in partnership with Google)
14:45 - Comparison to iPhone 15 Pro Max
16:25 -  What's missing? And Summary

We're all gonna make it, brahs.",2024-01-29T19:24:41Z,2024-01-29
XaqOejIaFgM,From the s9+ to the s24 ultra. This upgrade is sheer love!,2024-01-27T14:39:04Z,2024-01-27
XaqOejIaFgM,"Really appreciate your videos, no over the top yelling for attention with quick edits or music blaring in the background,  just straight forward, calm reviews of products. Perfect.",2024-12-09T14:42:52Z,2024-12-09
XaqOejIaFgM,Whose here after the awful iphone  16 launch,2024-09-10T01:02:12Z,2024-09-10
XaqOejIaFgM,I'm glad to see that Samsung is stepping up their game with the security updates and OS upgrades. It's important for long-term value and user experience. Well done!,2024-01-28T15:00:59Z,2024-01-28
XaqOejIaFgM,"A year goes by so fast, if I can't get 5 years out of the phone something's wrong",2025-06-07T06:00:44Z,2025-06-07
XaqOejIaFgM,Man hearing Marques give such an overwhelmingly positive review of a Samsung phone feels like a rarity. Glad i waited for this phone! Nice review as always!,2024-01-26T22:21:45Z,2024-01-26
XaqOejIaFgM,Thanks for the review mate. Just ordered the 24 Ultra. I'm using my phone more and more these days for youtube so it's good to see these camera improvements and also durability 👍,2024-01-27T02:55:44Z,2024-01-27
XaqOejIaFgM,"The Samsung S24 Ultra seems like a game-changer with its impressive features and long-term support. Excited to upgrade and experience it myself! Great review as always, Marques!",2024-01-26T23:38:35Z,2024-01-26
XaqOejIaFgM,Who's Here after the S25U launch,2025-01-25T21:57:54Z,2025-01-25
XaqOejIaFgM,We all here for MKBHD's opinion,2024-01-26T21:46:33Z,2024-01-26
XaqOejIaFgM,Holy crap. This is the first time he didn't say anything bad about Samsung's ultra lineup of phones. Good thing I went ahead and pre-ordered mine and it's getting here today or tomorrow 😊,2024-01-27T01:33:46Z,2024-01-27
XaqOejIaFgM,"I switched from iPhones to the s23 Ultra, and just upgraded to the s24 Ultra today. It's amazing. I've never been so satisfied with a phone",2024-03-26T23:44:04Z,2024-03-26
XaqOejIaFgM,Damn that’s crazy you still do phone reviews I used to watch when I was little ‼️I appreciate you,2024-09-27T02:00:36Z,2024-09-27
XaqOejIaFgM,In my 8+ years of being your subscriber maybe this is the 1st video where you were praising the product soo much and i loved it all the way.,2024-01-27T05:38:34Z,2024-01-27
XaqOejIaFgM,"For me, its the corners. I love the sharp corners of the ultra line. It's so pretty.",2024-06-02T20:01:05Z,2024-06-02
XaqOejIaFgM,I came back to this video now that I have finally converted from iphone 14 pro max to the S24 ultra. Not gonna lie this change was worth it. The phone is so stinking good. I'm loving it WAY more then ANY apple i've ever owned. I was apple since the 4.,2024-07-16T04:23:44Z,2024-07-16
XaqOejIaFgM,S24 Ultra look more PREMIUM than S25 Ultra...!,2025-02-24T12:35:23Z,2025-02-24
XaqOejIaFgM,"You basically just confirmed all the reasons I've been buying the Note and now the S Ultra series phones from Samsung. They're not cheap, but the amount of things on tap that are done either extremely well or well enough that it all adds up being worth the cost to me. Also, as an artist and someone who likes to handwrite, the SPen is incredibly useful and fun. No other phone even has this feature close to this level of refinement so I'd honestly buy the phone just for that if I had to.",2024-01-27T03:42:24Z,2024-01-27
XaqOejIaFgM,Absolute monster of a phone.  Mine just arrived mid-January.  Owned Samsung from almost the beginning of Smartphones.  I also always loved windows integration on Android phones that you plug your phone into computer and it shows as a normal extra drive.. still exploring all ai features...,2024-01-27T02:09:13Z,2024-01-27
XaqOejIaFgM,9:27 Yes! It would be great if you could give us an analysis of how Google and Samsung are competing against each other and Apple at the same time.,2024-01-29T17:22:02Z,2024-01-29
XaqOejIaFgM,"Going back here after watching his video about the best phone of 2024. 
It comes full circle as mentioned in 0:28 that this phone sets the tone for 2024.

I hope my S24U really is going to be my reliable phone for the next 6 years. And I hope yours, too.",2024-12-20T14:05:50Z,2024-12-20
XaqOejIaFgM,"I'm not even a phone person, but I keep watching your videos only because MKBHD videos are really really well-presented, with a great personality.",2024-01-27T07:15:21Z,2024-01-27
XaqOejIaFgM,Kudos to Samsung for getting rid of curved screen on their ultra model.  Samsung has cone a long way in terms of software.  I recall the touchwiz days. Literally had to flash custom rooms like Cyanogen mods. Only thing I miss from old phones are the removable batteries and expandable storage.,2024-01-27T00:19:50Z,2024-01-27
XaqOejIaFgM,I can spend 1300$ on an S24 and iPhone users would still call me broke for preferring an Android.,2024-07-08T20:33:51Z,2024-07-08
XaqOejIaFgM,Here after the S25 ultra release looking to grab this,2025-02-06T12:23:52Z,2025-02-06
XaqOejIaFgM,Always love watching MKBHD reviews and the different takes he has while tying in a narrative to each review. Would love to hear his take on the relationship between Samsung and Google rn,2024-01-26T23:12:47Z,2024-01-26
XaqOejIaFgM,I am here because i want to feel good for the 1300$ i spent,2024-09-22T14:12:20Z,2024-09-22
XaqOejIaFgM,"I've had the S8 forever and last night my phone's charging port finally gave up. I got it fixed, but because I was eligible for an upgrade, I bought an S24 Ultra today, largely due to how you meticulously broke down the phone's specs and because of your glowing review. Thanks for the thorough review!",2024-03-31T06:37:59Z,2024-03-31
XaqOejIaFgM,I did it!.... Finally got it 😢,2025-04-08T16:57:52Z,2025-04-08
XaqOejIaFgM,"These reviews are genuinely next-level. Great work as always, Marques!",2024-01-26T21:46:58Z,2024-01-26
XaqOejIaFgM,Worth the wait. I hate that other tech reviewers rushed their so called “review” just for the views while taking advantage of the buzz created by Samsung. I like that MKBHD took his time to give us real and quality “review”. There’s levels to this and I can say MKBHD is at the top.,2024-01-26T23:26:48Z,2024-01-26
XaqOejIaFgM,Marques just makes every damn phone look so good in every shot. Makes me wanna buy all of them 😂,2024-01-27T11:50:46Z,2024-01-27
XaqOejIaFgM,"After watching your new video of the S25U review, I'm considering about getting this one instead lol",2025-02-05T23:33:30Z,2025-02-05
XaqOejIaFgM,"I went from a S10 to the S22 ultra. I've had the S22 for two years and it is still the best phone I have ever experienced. I'll be upgrading to the S24 ultra this year partly because of this review. I TRUST your reviews and I know you're going to be honest, good or bad. Thank you!!",2024-01-26T23:23:52Z,2024-01-26
XaqOejIaFgM,Loved how many sets they used while keeping solid clean audio throughout. 10/10 production.,2024-01-28T20:49:32Z,2024-01-28
XaqOejIaFgM,im tired of buying a 1200$ electronic every 3 years...,2024-03-28T23:58:19Z,2024-03-28
XaqOejIaFgM,I just got mine today and love it!! Especially love the zoom!! It's unbelievable!,2025-01-15T06:56:14Z,2025-01-15
XaqOejIaFgM,The whole live translation thing is honestly the most impressive bit of technology ive seen in a long time and i love the tech world. Having my phone be able to live translate a conversation im having was something i dreamed of as a kid and saw in spy movies and shows. Crazy that it was just a feature added to galaxy phones with the most recent software update,2024-06-01T01:56:17Z,2024-06-01
XaqOejIaFgM,"I love that you change the literal aesthetic of the video when you went to aesthetics section of photography. Production is always on-point, but sometimes I just have to shake my head and smile. Well played, MKBHD, well played...",2024-02-02T14:23:29Z,2024-02-02
XaqOejIaFgM,Ive had my S23+ for a year and i had switched from my iPhone XR. Boy I never see myself switching back. These new Samsung's are absolute beasts!,2024-03-25T06:02:11Z,2024-03-25
XaqOejIaFgM,Just managed to upgrade to s24 ultra today. Glad I made the right decision 😂,2025-03-19T18:58:36Z,2025-03-19
XaqOejIaFgM,One note: the save as sticker feature in Samsung gallery has been available on older phones. I have a galaxy S22 and I've got that feature.,2024-01-27T11:39:33Z,2024-01-27
XaqOejIaFgM,"7 years with updates! Well done Samsung! 👏 Phones are so good and expensive now, that it makes sence giving the buyer a reassuring feeling.",2024-01-30T20:05:25Z,2024-01-30
XaqOejIaFgM,"I have s24 ultra and iphone 15 pro, and I noticed I like using s24 ultra more, the screen is so great for watching videos and reading ebooks, and the new AR coating is fantastic, it feels like reading a ereader.",2024-05-02T17:11:02Z,2024-05-02
XaqOejIaFgM,"Update on the S24 Ultra vs S25 Ultra

S24 Ultra
- Box Style shape (Just like the original note series)
- S24 Ultra first flat screen with eligant curved frame gives premium style (Flat screen protector frienldy)
- Brightness was tested as ive seen and notice is brighter. (Coating or what not probably causing this but the anti reflection is nearly identical)
- S-Pen bluetooth (Gimick or useful but still very nice knowing you have some inspector gadget type tech in your pocket if needed)
- One UI 7 Update for the S24U has some new video exporting blowing away the non optimized version of the S25 U as seen and tested.
- Camera rings are solid and premium (Flush no potential removal)
- 7 years of update (S24U) and was originally advertised as the AI phone already (I use all the AI features Minus the Now brief on the S25 Ultra i had it turned off)
- S-pen location on the S24 Ultra is in a perfect spot for cases (S25 Ultra seems to have it in a odd location where its curved so all the cases have a nasty open cutout in the corner)

S25 Ultra
- Feels like an Iphone which i always envyed iphone users having a flat square display but the samsung design lost its touch reminds me of the redmagic phone (not Note shape)
- Faster CPU but samsung is behind updating a more optimized version for the S25 Ultra
- Nearly only one year extra of uptades vs the S24 U 
- Extra pixels in one camera (I dont see the difference)
- Blue tooth 5.4 vs 5.3 (Dont notice much maybe the 6.0 will be a bigger upgrade.


Conclusion:
Sending my S25 Ultra back and will continue to use the S24 Ultra (I will snag a new one when they come back to the Note roots i have  under 7 years not in a hurry but ill cross my fingers on this one)",2025-06-07T02:53:00Z,2025-06-07
XaqOejIaFgM,"One thing I noticed is the battery management is absolutely amazing. Where I would run out 15% of my battery, I now run 1-2% max, it's actually insane...
Yes my S21 Ultra was getting old and I used it A LOT, so the battery would have been losing efficiency. But my god, that's 7x+ on the top end, I don't think i've ever had that experience when i've upgraded, and i've gone
S2 > S4 > S7 Edge > S9 Plus > S21 Ultra > Now this.
Not a single one of those upgrades gave me this battery efficiency.",2024-06-01T19:20:57Z,2024-06-01
XaqOejIaFgM,"Thank you for this review, even though I can argue that many people actually like smaller phones at the end of the day.
I have tested the smaller S24 on my channel running the new Exynos, Temps, and Battery drain, and I dare to say that even the base variants this year is impressive, Feel free to check out the numbers for yourself.",2024-01-27T03:47:08Z,2024-01-27
XaqOejIaFgM,Was about to pre order the iphone 16 pro max (Had a iphone 15 pro max) watched all the videos on it saw there was minor additions. Started looking into the samsung 24 ultra immediatly bought it. Sold my 15 pro max and my Mac Mini (8gbram  256 storage) at a local mac reseller store for 1300$ cash ordered my samsung online for 999.99 took the profit got a portable monitor 4k 120hz 15.6 in and a full size bluetooth keyboard for Dex. NEVER turning back !,2024-09-14T12:31:19Z,2024-09-14
XaqOejIaFgM,"this phone almost 1 year old and still the best performing phone in the market !! a lot of phones came out after it and they couldnt beat it, respect for samsung",2025-01-03T15:16:10Z,2025-01-03
XaqOejIaFgM,"This phone has all the right boxes ticked out , it's definitely going to be a hit for anyone and everyone who can afford it",2024-01-27T08:22:44Z,2024-01-27
XaqOejIaFgM,moving the car in the photo blew my mind. and that fill in the space. wow!,2024-01-27T15:45:26Z,2024-01-27
XaqOejIaFgM,"I am a Pixel 8 Pro user and when S24 dropped and I saw all the AI features,  the first thing I felt was as if this was a Pixel phone on a Samsung Hardware. I was surprised that nobody really mentioned about in the first impression videos! Happy to know that you felt it. Would love to see a video on how Google and Samsung is coming together. Throwback to the Nexus days!",2024-01-27T12:40:34Z,2024-01-27
XaqOejIaFgM,"I'm glad I got the s24 ultra, the s25 ultra losing Bluetooth, not upgrading to a 1 inch sensor for the main cam, not upgrading the 3x telephoto and just the ultrawide lol Samsung got really greedy. if this is the direction Samsung is going, this could be my last Samsung phone the s24 ultra.",2025-01-29T04:28:28Z,2025-01-29
XaqOejIaFgM,"I’ve owned iPhones for the last 8yrs, I’m currently on day 2 with my S24 Ultra and I absolutely love it. It’s fantastic.",2024-01-28T03:51:35Z,2024-01-28
XaqOejIaFgM,"I've had the S22 Ultra since a few months after it came out, and it's still going strong, but I'm actually compelled to get the 24. One of my favorite things about my S22 Ultra is the zoom on it. I actually just use the view finder like binoculars all the time because the zoom is so insane and stable.
I really thought I could hold off on an upgrade for longer than this, but the S24 Ultra is just so much better, and the flat screen just makes it perfect",2024-02-20T07:13:39Z,2024-02-20
XaqOejIaFgM,The software support and 1TB are my main reasons to get this phone for under $600 with my trade-in.,2024-01-26T21:56:40Z,2024-01-26
XaqOejIaFgM,Loving the custom keyboards in the BRoll shots,2024-01-26T23:12:07Z,2024-01-26
XaqOejIaFgM,I definitely want a video about those intricacies in colabs between smartphone companies.,2024-01-27T10:06:26Z,2024-01-27
XaqOejIaFgM,Got the base S24 two days ago (I had a S20FE before) and am having fun with all the features. The AI autocorrection is especially helpful to me as a non-native English speaker (the feature is also used for this text). And those seven years of updates are tempting.,2024-01-26T22:40:05Z,2024-01-26
XaqOejIaFgM,Just got a S24 Ultra...,2025-04-06T05:30:18Z,2025-04-06
XaqOejIaFgM,"Just waiting on mine to arrive at Feb 7. I knew this phone was going to be a monster. The new 5x, the 4k120, the 8k on the 5x, the 2600 peak brightness and anti reflective screen makes it easier to shoot outdoors. And also not to mention the shutter lag finally it's gone!! Can't wait!!",2024-01-27T04:24:40Z,2024-01-27
XaqOejIaFgM,"I got mine on Friday and was worried I'd have buyers remorse, but so far I'm so impressed with it. It's very snappy and honestly fun to use.",2024-01-28T18:18:14Z,2024-01-28
XaqOejIaFgM,"Very interesting to see that Google and Samsung are collaborating like crazy to build up an unified Android empire to compete with Apple. At this point we might as well call them the Android S24 Ultra, and Android 8 Pro 😂",2024-01-27T01:45:21Z,2024-01-27
XaqOejIaFgM,"I just got this phone, the camera quality alone its just crazy",2024-10-05T15:00:57Z,2024-10-05
XaqOejIaFgM,"Marques, I would love to see you do a separate video on Samsung and google's need for each other. I've always thought this and think it would be great for you to dive into the subject.",2024-02-23T16:56:10Z,2024-02-23
XaqOejIaFgM,It’s rare to see you this pleased doing a review.,2024-01-31T02:44:13Z,2024-01-31
XaqOejIaFgM,"I dont know about the U.S. 
But here in the UK they're offering all of the following on each purchase:
£100 discount, free upgrade to 512GB, 1yr disney+, 3 months accidental cover, £30 store credit.",2024-01-29T18:58:35Z,2024-01-29
XaqOejIaFgM,I'm here to see all that the s25 Ultra can do that was not covered.,2025-01-26T18:04:17Z,2025-01-26
XaqOejIaFgM,"It's not often I get to use the same device Marques drops a review on. Got my S24U couple of days back and the other alternative I considered was Pixel 8 pro. I loved the fact that Google and Samsung joined hands on this, especially at the AI on edge computing paradigm we are embarking on now. Phone is incredible, love that the AI features are not in your face but just there. Integrated as if they were always there. Great video as usual and ya, that video on Google+Samsung against the world is worth exploring. And I think this collaboration could go beyond phones as well, like Google TV on Samsung TVs.",2024-01-27T05:12:00Z,2024-01-27
XaqOejIaFgM,"My S24 ultra arrived this week, the AI generative fill on photos is insane! I keep trying photos and removing people/objects and it blows my mind each time, even difficult photos where I don't expect it to work, and it does it. Super impressive.",2024-01-27T00:28:49Z,2024-01-27
XaqOejIaFgM,The synergy between Google and Samsung is welcome and will make things better for every android consumer. The one thing I would like to see is feature drops on Samsungs like Google does with the Pixels and give more attention to older models. The S23 getting these AI features is a step in the right direction. Another thing everyone seems to overlook about Pixels is that their purpose is also to push other manufacturers to make their OS experience better and simpler for their users. I think this is evident with Samsung's recent One UI updates.,2024-01-27T07:36:35Z,2024-01-27
XaqOejIaFgM,I made the switch been on apple for years I got the s24 ultra over the 25 ultra I don't regret it 😊,2025-05-21T10:10:14Z,2025-05-21
XaqOejIaFgM,"I ordered the S24+ and am very excited for it. Hobestly price aside, the only things I like more about the Ultra is the 5x telephoto, and the much better Gorilla Glass (anti reflective, and very scratch resistant). Otherwise I'm very excited for the S24+, and prefer the slightly smaller size with rounded corners.",2024-01-26T21:51:45Z,2024-01-26
XaqOejIaFgM,Finally back to flat displays. I never liked the curved screens that had inconsistent viewing experiences near the edge. Also THANK YOU SAMSUNG for adding a good anti reflective coating. Most underrated feature.,2024-01-26T21:51:21Z,2024-01-26
XaqOejIaFgM,"I got it immediately; after waiting years from the note not being available, to this ""ultra"" being a significantly more expensive upgrade and skipping ANOTHER year, finally pulled the trigger and I effing love it. Black, but all the colors are sweet.",2024-02-15T00:35:31Z,2024-02-15
XaqOejIaFgM,"I bought an S9 when it was released. Im writting on that same phone today, have zero problems whatsoever but being an IT maniac, i know this phone will eventually die out. Im looking for the s24ultra or waiting 2 more months for the s25 releases. Cant wait to upgrade. Amazing video.",2024-12-30T15:37:44Z,2024-12-30
XaqOejIaFgM,Your reviews hit just right. Very well done as  always. Keep up the great work 😊,2024-01-27T05:41:27Z,2024-01-27
XaqOejIaFgM,"I just ordered the 24 ultra… trading in my 13 pro max… I’m really looking forward to the switch, so thank you for helping with my decision",2024-02-08T18:28:06Z,2024-02-08
XaqOejIaFgM,"Still have my s22 ultra, and I love it. Works great. The number of updates  this phone has had since the start is amazing.",2024-01-28T02:19:49Z,2024-01-28
XaqOejIaFgM,I'm with Samsung since the note 4 .  Maybe iPhone users don't notice it but there s something on iPhones that no other phone can duplicate . The software response to the touch  . Typing or scrolling down just feels unique .  Small thing but huge difference,2024-10-29T03:20:38Z,2024-10-29
XaqOejIaFgM,Did i hear “Jerry Rig Everything” theme music 4:33 !! 😂😂,2024-01-27T01:35:56Z,2024-01-27
XaqOejIaFgM,"whenever I purchase a new phone I come here first...for the most thorough, honest and non-biased review.  appreciate you my guy because you let me know features I never knew existed! thank you",2024-03-19T18:30:18Z,2024-03-19
XaqOejIaFgM,The Galaxy S24 Ultra seems to be the go-to for pro users. The fact that it will get SO many OS upgrades makes it a game changer for sure👌🏽,2024-01-27T01:20:04Z,2024-01-27
XaqOejIaFgM,"This phone is amazing. I just bought one, and I couldn't be more satisfied with my purchase. I highly recommend it; you won't regret buying this phone.",2024-11-27T07:21:21Z,2024-11-27
XaqOejIaFgM,"16:27 Call screening is ALREADY available on samsung devices and has been for over a year now! It can be enabled in the phone app settings. Its called ""bixby Text Call""",2024-01-26T22:30:54Z,2024-01-26
XaqOejIaFgM,"12:58 Marques circled his portrait and expected to have his youtube channel to be popped up but only his hoodie information was listed
- Emotional Damage -",2024-02-06T10:52:34Z,2024-02-06
XaqOejIaFgM,"It doesn't surprise me that every one of your videos is extremely informative to everyone, whether you're a tech guy or just the average person using a phone. You're awesome dude",2024-01-27T23:57:23Z,2024-01-27
XaqOejIaFgM,"why? because the screen is bad, the oleophobic coating wears off within 3 months, because the camera optimization is so bad that it renders anything above standard 12mp completely useless. Becuase the battery is good not great. Because you can get things better or almost equally good for half the price.",2025-01-16T13:39:19Z,2025-01-16
XaqOejIaFgM,This is what a genuine user perspective and tech review really is. Well done Mkbhd,2024-01-28T09:24:00Z,2024-01-28
XaqOejIaFgM,"I still have S10, works well and I'm using it on daily basis but something about s24 series makes me want to upgrade my smartphone experience 🧐 Thanks for great reviews!",2024-01-28T16:12:19Z,2024-01-28
K-JGaqfIOmI,"The Galaxy S24 Ultra is in many ways a perfect smartphone in 2024. One thing that I would like to see improved in the next iteration is the charging speed on both wired and wireless, which has been stagnant for many years at this point.",2024-02-16T16:21:03Z,2024-02-16
K-JGaqfIOmI,I upgraded from Note 10 to s24 not expecting this much of difference but s24 ultra is a beast phone through and through,2024-02-17T13:07:21Z,2024-02-17
K-JGaqfIOmI,I have the S23U but I don't feel the need to upgrade because in daily life you really don't notice that much the foto qualities and speed difference. Great review thanks for that! Greetings from the Netherlands!,2024-02-17T09:53:30Z,2024-02-17
K-JGaqfIOmI,"👏 for 9.9x picture quality, I totally agree it looks way more attractive to me.",2024-02-17T17:02:43Z,2024-02-17
K-JGaqfIOmI,4k 30fps video from main camera was fantastic 😍❤ great details 😊,2024-02-22T12:21:52Z,2024-02-22
K-JGaqfIOmI,"Switching from Apple back to Samsung. Apple isn’t a bad phone but I feel it is a scam because everything has to be purchased. Ringtones, Walpapers, games and more. Never had to do this with Samsung !!!",2024-11-04T15:24:36Z,2024-11-04
K-JGaqfIOmI,"Holy shit, Will. Please leave some gains for the rest of us.",2024-02-16T15:47:28Z,2024-02-16
K-JGaqfIOmI,"As a Samsung Employee, I can assure you this is best review of S24 Ultra on the Internet.",2024-02-16T16:50:54Z,2024-02-16
K-JGaqfIOmI,"Nice review! I rest assured and based on this review I bought the S24Ultra in the yellow colour with 512 GB.
Will get it this week, looking really forward to take pictures with it!
Thanks again😊",2025-05-11T05:51:27Z,2025-05-11
K-JGaqfIOmI,"Love the T shirt, good to see that you've got a sense of humour 👍🏼🤣 Pretty good review too!",2024-02-16T19:45:50Z,2024-02-16
K-JGaqfIOmI,Had the black 512gb s24 Ultra for a month always been a android user since s2. Always liked samsung even when iphone had better features  just always preferred samsung as a phone and will continue but love apple as I purchased ipod and macbook pro as main computers.,2024-02-16T18:30:54Z,2024-02-16
