video_id,comment,comment_published_at,date
Od9F_9guCrY,The samsung charged faster with the screen on and running 2 apps at the same time. iPhone would've gotten obliterated if both were on AOD.,2024-05-21T17:09:56Z,2024-05-21
Od9F_9guCrY,"Turn of the battery life thing in the settings. After the 80% of charging, it getting slower step by step.",2024-03-08T15:18:52Z,2024-03-08
Od9F_9guCrY,My mother bought an iPhone 15 pro max but the battery life was not as good as I thought. I find that the nature of Android still allows for longer usage time,2024-06-30T14:36:15Z,2024-06-30
Od9F_9guCrY,Samsung 💪,2024-02-03T16:45:49Z,2024-02-03
Od9F_9guCrY,its called optimised battery charging it slows down after 80% to prevent battery damage,2024-08-04T04:13:07Z,2024-08-04
Od9F_9guCrY,"xiaomi with a volume of 5000 in 18 minutes, and a charger included 🗿",2024-06-15T00:59:41Z,2024-06-15
Od9F_9guCrY,"I think its not fair. Iphone have a slow charging at the end like a feature, and samsung works with launched stopwatch",2024-11-20T19:30:47Z,2024-11-20
Od9F_9guCrY,You better have the right cable for the 45 watt charging on the ultra,2024-02-02T21:01:14Z,2024-02-02
Od9F_9guCrY,You can’t do a fair test with 2 different chargers. Plus the software on the iPhone changes the battery at a rate that’s best for the total lifetime of the battery. If you use a mA meter you’ll see that the iPhone will vary the charging state through out the charging cycle.,2024-09-24T04:31:21Z,2024-09-24
Od9F_9guCrY,So why would you have one screen on and not the other? How much sense does that make?,2024-02-02T15:01:32Z,2024-02-02
Od9F_9guCrY,I don’t care about change time. I charge my 15 pro max at night and I have yet to kill it in a day. The battery life is insane!!!,2024-05-25T02:03:41Z,2024-05-25
Od9F_9guCrY,SAMSUNG GALAXY S24 ULTRA ❤❤❤❤❤,2024-04-05T20:39:36Z,2024-04-05
Od9F_9guCrY,Bro was running split screen and still won 💀💀💀💀,2024-10-17T14:17:47Z,2024-10-17
Od9F_9guCrY,"yo, why do you always have samsung on multitasking for the stopwatch?? iphone screen is locked whilst s24 ultra is unlocked with two apps running simultaneously. same thing when it was a comparison between z fold 5 and one plus open, use a third phone as a stopwatch to make it less bias",2024-02-04T12:54:54Z,2024-02-04
Od9F_9guCrY,I also use samsung but gives a very slow charge after 90 percent charge in Apple because to avoid battery damage,2024-09-29T20:45:19Z,2024-09-29
Od9F_9guCrY,The Samsung Won and even multi task stop watch and Battery.The Samsung Galaxy S24 Ultra is the king of Smartphones It has Build in Ai🔥🔥And it has a Anti-Reflecting display/Screen.,2024-02-03T22:22:01Z,2024-02-03
Od9F_9guCrY,Bro was using stopwatch in S24 but still its charged faster 😮,2024-07-18T06:33:26Z,2024-07-18
Od9F_9guCrY,Samsung 👌,2024-02-03T11:24:12Z,2024-02-03
Od9F_9guCrY,Beautiful! I have an S24 Ultra! NICE VIDEO! 😊,2024-09-13T10:45:50Z,2024-09-13
Od9F_9guCrY,Now do a battery drain test,2024-05-21T05:28:56Z,2024-05-21
Od9F_9guCrY,"The samsung :1:13:22
The iphon :2:22:11
Samsung is the best ❤🤜🤛💪💪",2024-08-19T01:26:03Z,2024-08-19
Od9F_9guCrY,Which adapter we should buy for samsung galaxy 24 ultra,2024-12-29T16:48:58Z,2024-12-29
Od9F_9guCrY,"The starting horn of Gran Turismo 6, how nostalgic",2024-09-07T23:30:24Z,2024-09-07
Od9F_9guCrY,"В айфоне есть такая функция «Оптимизированная зарядка», где он заряжает до 80% быстро, свыше 80% долго, чтобы не уничтожить быстро аккумулятор. Если выключить эту функцию, то и выше 80% он будет заряжать быстрее. Еще разница в пропускной способности напряжения и тока в проводе и в блоках питания, разная мощность, наверное. У меня iphone 13 заряжается за 50минут с оригинальным блоком питания в 25вт от 10-80%, а есть еще Redmi note 11pro 5G, так он с 67вт оригинальным блоком питания за 45 минут заряжается до 1-100%. Так что даже самсунг ваш от редми моего далек по скорости зарядки, а в топовом сяоми со 120вт мощности блока питания- так вообще еще больше зверем будет в скорости зарядки",2024-03-05T10:11:04Z,2024-03-05
Od9F_9guCrY,"Good job, but the faster you charge, the more you stress the battery.",2024-08-14T12:58:04Z,2024-08-14
Od9F_9guCrY,strong battery and fast charge,2024-06-29T14:20:10Z,2024-06-29
Od9F_9guCrY,for iphone it is designed to slow down the charging speed to help sustain the battery health in a good way,2024-08-05T22:25:34Z,2024-08-05
Od9F_9guCrY,Samsung Galaxy S24 Ultra 👍🏼👍🏼👍🏼👌👌💪💪💪,2024-06-28T23:23:49Z,2024-06-28
Od9F_9guCrY,Please turn off the Optimized battery charging,2024-08-22T06:41:15Z,2024-08-22
Od9F_9guCrY,it's such a flex that samsung can do two things at the same time...,2024-04-27T04:12:14Z,2024-04-27
Od9F_9guCrY,"Samsung always was on top of Apple in features since the galaxy S3, but the Touch Wiz really held it back, now with One UI Samsung went better and better",2024-11-04T10:29:10Z,2024-11-04
Od9F_9guCrY,هذا وانت مشغل تطبيقات في سامسونج 😂😂,2024-04-13T00:38:52Z,2024-04-13
Od9F_9guCrY,"я уверен на все 100 что в айфоне была включена функция сбалансированной зарядки, которая специально замедляет зарядку после 80%, чтобы телефон был заряжен как раз к началу вашего пользования, для сохранения состояния акб",2024-09-07T10:07:54Z,2024-09-07
Od9F_9guCrY,that's why i love samsung ❤,2024-07-11T07:52:40Z,2024-07-11
Od9F_9guCrY,Bro running Clock on S24U in split screen makes the phone give extra work while charging while apple do nothing but charging anyway,2024-06-09T09:33:07Z,2024-06-09
Od9F_9guCrY,My OnePlus charging 20 minutes. He have 150 watt charging,2024-08-25T10:29:17Z,2024-08-25
Od9F_9guCrY,thats a good way to fuck up your charger port by snapping the charger in at an angle like that,2024-05-28T06:00:23Z,2024-05-28
Od9F_9guCrY,"Samsung 01:11
Iphone 02:22
❤😂😂😂😂😂
Samsung Win🎉🎉🎉🎉🎉",2024-04-03T03:23:05Z,2024-04-03
Od9F_9guCrY,Is it used or not bc that isn’t fair comparison plus what wattage is it?,2024-11-23T21:12:19Z,2024-11-23
Od9F_9guCrY,iphones Battery Backup is much better than Samsung 😌,2024-05-20T19:53:23Z,2024-05-20
Od9F_9guCrY,"Considering they almost has identical battery life, that 1hour is a huge difference 😂",2024-06-26T05:24:10Z,2024-06-26
Od9F_9guCrY,"The main thing is not how fast it charges, but how slowly it discharges) Although I am a Samsung user since 23 ultra, I envy my sister. She has an iPhone 14 pro max, and charges her phone 1 time a day. And I do it 2 times a day 🤷",2024-02-27T16:51:13Z,2024-02-27
Od9F_9guCrY,How many watts should the Samsung be put in?,2024-10-26T10:13:51Z,2024-10-26
Od9F_9guCrY,"Может попробуешь оригинальной эйполовской зарадкой на 3,5 зарядить?!",2024-04-14T22:37:31Z,2024-04-14
Od9F_9guCrY,"I don't know why people even compare it at this point, s24 ultra has proven multiple times it is more faster and lasts longer",2024-05-29T07:46:01Z,2024-05-29
Od9F_9guCrY,All ppl in comments clearly clueless of how iphone battery works. Gl poor fellas.,2024-03-10T14:20:08Z,2024-03-10
Od9F_9guCrY,"A bad comparison if the one device is not in standby because it has to show the timer all the time.The LTPO panel cannot regulate this, as can the processor.The result is all the more impressive, but fair test methods still have to be worked on.",2024-08-24T08:17:04Z,2024-08-24
Od9F_9guCrY,I feel sorry for iphone users while samsumg is soo much better,2024-08-25T06:24:17Z,2024-08-25
Od9F_9guCrY,"the iphone is only slower because the always on display is on and optimized battery charging is on, which means it charges it slower when it goes past 80% which also protects the batterys long life health.",2024-07-21T03:45:35Z,2024-07-21
Od9F_9guCrY,"Iphone charging after 80% just takes 1watt of power because it takes lot of time from 80% to 100% 
For anyone who doesn’t know why they design like this : is because they they prevent users to charge after 80% so that phone battery life last longer.",2024-03-07T04:56:18Z,2024-03-07
Od9F_9guCrY,Bhai timer to samsung s24 ultra me laga tha tabhi bhi itni fast charging 😮❤,2024-10-30T13:23:20Z,2024-10-30
Od9F_9guCrY,"Please, turn off the “Optimized charging” on iPhone and do it again….",2024-05-03T04:48:51Z,2024-05-03
Od9F_9guCrY,I still love iPhone 🔥♥️🇳🇬,2024-10-25T20:55:37Z,2024-10-25
Od9F_9guCrY,Slower charging = slower draining of the battery.,2024-03-06T12:14:36Z,2024-03-06
Od9F_9guCrY,Don’t you Samsung users think it’s a little weird how he used DIFFERENT charging bricks on both of them? He used a 65w on the Iphone but didn’t show what the wattage was on the Samsung 🤨,2024-07-19T01:40:44Z,2024-07-19
Od9F_9guCrY,Make a video on battery draining not gaining,2024-05-22T07:56:35Z,2024-05-22
Od9F_9guCrY,"It is so funny how no one in the comments knows what they are talking about. Yeah, the Samsung is multitasking during the charge but the iPhone has optimised charging setting on. The iPhone would have charged faster and after that, drained the battery slower 😂",2024-08-16T20:05:22Z,2024-08-16
Od9F_9guCrY,"Все таки айфон лутше 
Не согласен = 🤡",2024-07-04T05:57:40Z,2024-07-04
Od9F_9guCrY,"The samsung: 🟫
The bye bye bye got me💀",2024-08-04T08:14:58Z,2024-08-04
Od9F_9guCrY,why uh test with the timer on at the same phone 😂,2024-07-12T09:28:42Z,2024-07-12
Od9F_9guCrY,"Desativa o carregamento otimizado, depois de certo nivel de carga o iphone tenta segurar para não subir carga, para prolongar a vida útil da bateria",2024-11-11T15:58:39Z,2024-11-11
Od9F_9guCrY,Song?,2024-05-23T08:09:34Z,2024-05-23
Od9F_9guCrY,Sản phẩm quá tuyệt vời ❤  . Samsung galaxy s24 ultra ❤,2024-11-24T03:14:41Z,2024-11-24
Od9F_9guCrY,Samsung❤,2024-06-16T04:17:24Z,2024-06-16
Od9F_9guCrY,You accidentally got a slow adapter.,2025-05-06T05:02:26Z,2025-05-06
Od9F_9guCrY,Why does the iPhone have no Fast charging like 65watts???,2024-06-15T13:46:30Z,2024-06-15
Od9F_9guCrY,Nah even galaxy s24 ultra gave iPhone a headstart💀,2024-08-11T23:08:39Z,2024-08-11
Od9F_9guCrY,Rip but only 4 iPhone owner.....🤣😂😁☠️💀,2024-02-07T07:42:57Z,2024-02-07
Od9F_9guCrY,Ugreen nexode rg 65 watt does it safe for samsung s24 ultra and support super fast charging2.0?,2024-04-27T02:40:35Z,2024-04-27
Od9F_9guCrY,Samsung the best phone,2024-07-21T12:46:09Z,2024-07-21
Od9F_9guCrY,Samsung galaxy s24 sản phẩm tốt chất lượng cao ae❤❤❤❤❤❤,2024-11-21T05:33:40Z,2024-11-21
Od9F_9guCrY,Samsung 👍👍👍,2024-05-24T16:32:52Z,2024-05-24
Od9F_9guCrY,Samsung s24 Ultra number 1 phone,2024-08-04T01:23:16Z,2024-08-04
Od9F_9guCrY,i phone user::: अबे जल्दी कर सुबह पनवेल निकलना ह 😂😂😂,2024-06-07T16:16:41Z,2024-06-07
Od9F_9guCrY,they're like cousins 😭💞,2024-07-04T03:31:33Z,2024-07-04
Od9F_9guCrY,"Samsung ✅️
IPhone ❎️",2024-07-02T20:08:27Z,2024-07-02
Od9F_9guCrY,iPhone da pil sağlığı için %80den sonra yavaş şarj et özelliği açık😅😅,2024-08-22T19:33:59Z,2024-08-22
Od9F_9guCrY,Xiaomi 14 ultra 128w charger for 15 70%😂😂,2024-05-20T11:23:43Z,2024-05-20
Od9F_9guCrY,"Well, the Samsung has a bigger battery compared to the 15 pro max. Please let the iPhone breathe, it's a loved phone.",2024-07-07T11:45:46Z,2024-07-07
Od9F_9guCrY,60 hz iPhone>>>>>>>120 hz Samsung 😂,2024-02-28T17:22:05Z,2024-02-28
Od9F_9guCrY,i appreciate that the iPhone is slower. id rather have a phone that takes 2h to charge but a battery that won't need replacement every year rather than charging 0-100 in less than 30 minutes and kill the battery health. also because I'm still using 10W charging adapters and have 0 intention on buying new ones 😂,2024-08-07T06:44:54Z,2024-08-07
Od9F_9guCrY,Damn samsung is slow but iPhone is slowest,2024-02-02T21:17:49Z,2024-02-02
Od9F_9guCrY,"I have a Samsung Ultra 24 and I have a 66W fast charger from Realme, but the device is charging slowly. Why?",2024-09-17T14:04:55Z,2024-09-17
Od9F_9guCrY,Both phones are GREAT!🤩,2024-11-29T21:59:29Z,2024-11-29
Od9F_9guCrY,"Друг заряжал зарядкой 67 ватт и у него батарея стала плохо держать через 2 года уже.  
Кто не боится замены акб, может смело выпендриваться перед айфоном.",2024-08-07T05:25:08Z,2024-08-07
Od9F_9guCrY,So what was the price of s24 ultra again?,2024-04-09T12:12:25Z,2024-04-09
Od9F_9guCrY,"Bro iPhone optimised charging is on, that’s the reason why it’s late to be fully charged",2024-09-05T15:38:19Z,2024-09-05
Od9F_9guCrY,"Lies, my iPhone 15, on the original charger, charges in 30 minutes, the author simply does not know what “autonomous charging” is and provided that the Apple company takes care of its battery, it made the maximum energy consumption 20 watts, so the test is not fair at least good luck to everyone☺️",2024-08-07T08:19:52Z,2024-08-07
Od9F_9guCrY,multitasking was personal 😏,2024-07-12T20:13:38Z,2024-07-12
Od9F_9guCrY,"Actually, the iPhone starts charging slower after 80%, because it saves battery",2024-08-17T14:39:31Z,2024-08-17
Od9F_9guCrY,Can you put Red Mgaic 9S Pro Plus💀,2024-09-09T20:49:44Z,2024-09-09
Od9F_9guCrY,"Ok, lets see how much time work they are :) ?",2024-10-24T08:16:26Z,2024-10-24
Od9F_9guCrY,how many watts are the chargers?,2024-10-05T19:27:04Z,2024-10-05
Od9F_9guCrY,Remember the wattage of the plug means nothing if you're phone cant support it,2024-08-18T19:45:08Z,2024-08-18
Od9F_9guCrY,"You should turn off the screen to test, or also use Samsung's AOD display.",2024-09-14T22:50:19Z,2024-09-14
Od9F_9guCrY,What watt charger should use for samsung s24 ultra,2024-10-24T14:42:38Z,2024-10-24
Od9F_9guCrY,Gave my cousin an adaptive fast charger off Amazon with a USBC to iphone cord I somehow had. He was shocked at how fast it charged. And that wasn't even 45w cause iphone doesn't want you to have that. 😅,2024-06-25T12:18:04Z,2024-06-25
Od9F_9guCrY,Samsung galaxy S24 tốt chất lượng ❤❤❤❤❤❤,2024-11-20T06:56:12Z,2024-11-20
Od9F_9guCrY,The Sammy might have charged faster But the iPhone has the better longevity in battery use,2025-06-10T10:12:47Z,2025-06-10
tdqtC_AWIsU,"😍 I'm in love again 
Amazing ⭐️ color",2024-02-19T15:01:08Z,2024-02-19
tdqtC_AWIsU,The Galaxy S24+: unbox meeeeee!,2025-06-10T12:02:25Z,2025-06-10
tdqtC_AWIsU,Did you just get this?,2024-02-08T17:41:50Z,2024-02-08
tdqtC_AWIsU,orange love it 🧡,2024-03-22T16:00:46Z,2024-03-22
tdqtC_AWIsU,"My dad will give me that phone for my birthday. It's only two months away, and I can smell that cell phone. ❤❤",2025-04-29T17:53:16Z,2025-04-29
tdqtC_AWIsU,Galaxia S24 Ultra,2025-05-10T16:09:13Z,2025-05-10
tdqtC_AWIsU,I never seen orange s24 ultra 😳,2025-01-25T08:36:49Z,2025-01-25
tdqtC_AWIsU,How rare and how can u get this colour?,2024-12-03T07:18:22Z,2024-12-03
tdqtC_AWIsU,🍊,2025-03-23T13:01:17Z,2025-03-23
tdqtC_AWIsU,S25 ultra u mean,2025-04-30T07:35:42Z,2025-04-30
tdqtC_AWIsU,Samsung 24 ifyj,2025-04-14T16:27:52Z,2025-04-14
tdqtC_AWIsU,Ihate Samsung,2025-04-29T14:28:47Z,2025-04-29
cet-wN8FWuM,I love s24 u design,2025-05-27T15:32:45Z,2025-05-27
cet-wN8FWuM,S24 ultra better than s25 ultra 😊,2025-04-09T11:29:02Z,2025-04-09
cet-wN8FWuM,Me go for s24 ultra.its look better than s25 ultra and they removed Bluetooth and battery oin spen and increase price 😂,2025-05-28T07:55:20Z,2025-05-28
cet-wN8FWuM,Bro s pen in s24,2025-06-04T06:03:13Z,2025-06-04
cet-wN8FWuM,S25 u is ip68,2025-06-18T08:28:01Z,2025-06-18
cet-wN8FWuM,Iphone 16 pro max all the way 👌 ❤,2025-06-03T09:59:34Z,2025-06-03
cet-wN8FWuM,S25 ultra has the same 505 PPI en not 498ppi,2025-06-04T06:27:50Z,2025-06-04
cet-wN8FWuM,😮,2025-05-20T19:56:00Z,2025-05-20
cet-wN8FWuM,I have one new s25 ultra today,2025-06-03T03:51:00Z,2025-06-03
2xulT68UKOc,S24 Ultra still the 👑,2025-05-26T02:53:31Z,2025-05-26
2xulT68UKOc,My biggest dream is to have a phone like this 😢😢😢😢,2025-05-28T07:49:17Z,2025-05-28
2xulT68UKOc,I watch this reel on s24 ultra 😎,2025-06-19T16:43:03Z,2025-06-19
2xulT68UKOc,Watching from my s24 ultra 😂😂😂,2025-06-03T13:24:22Z,2025-06-03
2xulT68UKOc,Samsung alaws king👑👑,2025-05-20T15:26:57Z,2025-05-20
2xulT68UKOc,Watching on s24 ❤😊,2025-06-04T20:38:54Z,2025-06-04
2xulT68UKOc,Parrahhh stabilloo😊,2025-06-19T07:26:31Z,2025-06-19
2xulT68UKOc,samsung alaws king,2025-05-20T15:39:20Z,2025-05-20
2xulT68UKOc,Cool 👌 👌,2025-06-05T19:47:51Z,2025-06-05
2xulT68UKOc,omg❤❤❤👍👍💪💪💪,2025-05-25T23:11:55Z,2025-05-25
2xulT68UKOc,Wow super 😮,2025-05-29T18:55:40Z,2025-05-29
2xulT68UKOc,Stabil nya parah bos ku  ❤✅✅,2025-06-05T08:18:23Z,2025-06-05
2xulT68UKOc,😅😅❤❤samsung 🗿,2025-05-20T17:28:03Z,2025-05-20
2xulT68UKOc,Watching s23 ultra,2025-06-17T21:39:04Z,2025-06-17
2xulT68UKOc,حلمي 😢❤,2025-06-07T14:29:58Z,2025-06-07
2xulT68UKOc,Suththa poi na entha phone than use panran epdilam kidaiyathu,2025-06-12T19:29:27Z,2025-06-12
2xulT68UKOc,🔥🔥🔥🔥,2025-06-02T06:18:42Z,2025-06-02
2xulT68UKOc,"❌️انت كذاب انا الان من وقت كتابة تعليقي ،
سويت نفس الحركه الان وطلع كله كذب في كذب",2025-06-03T06:48:59Z,2025-06-03
2xulT68UKOc,Bezels are huge,2025-06-13T13:12:10Z,2025-06-13
2xulT68UKOc,Maquina,2025-06-12T00:04:41Z,2025-06-12
2xulT68UKOc,Nice video sir,2025-05-20T15:16:33Z,2025-05-20
2xulT68UKOc,I phone do this 😂😂😂,2025-05-21T07:24:52Z,2025-05-21
2xulT68UKOc,HAHAHAHAHAHAHAHAH TECNO SPARK GO 1,2025-06-01T07:27:48Z,2025-06-01
2xulT68UKOc,sob mica kotha 😂😂😂😂,2025-05-21T01:52:19Z,2025-05-21
2xulT68UKOc,Fake video,2025-06-15T19:04:32Z,2025-06-15
2xulT68UKOc,Okioioioi,2025-05-20T23:22:07Z,2025-05-20
2xulT68UKOc,You are a liar,2025-06-03T06:51:27Z,2025-06-03
0JFGiWNuJek,The black is the best one. All the other colors are good but I personally like the black the best.,2024-08-02T11:48:26Z,2024-08-02
0JFGiWNuJek,Watching from s24 ultra❤,2024-06-20T18:05:17Z,2024-06-20
0JFGiWNuJek,Watching on S24 Ultra and what a device! 😋,2025-06-07T11:49:48Z,2025-06-07
0JFGiWNuJek,Watching from S24 ULTRA,2025-04-03T15:21:49Z,2025-04-03
0JFGiWNuJek,I finally can say this!!!!! Watching It with my S24 Ultra!!!🎉🎉,2025-03-14T18:53:16Z,2025-03-14
0JFGiWNuJek,watching with my eyes,2025-04-16T15:56:26Z,2025-04-16
0JFGiWNuJek,S24 ULTRA ✅️ S25 ULTRA ❌️,2025-01-25T18:13:48Z,2025-01-25
0JFGiWNuJek,"Watching with s24 ultra
❤",2024-12-09T09:51:30Z,2024-12-09
0JFGiWNuJek,That is one sexy looking phone !  I love it!!!,2024-02-10T04:03:07Z,2024-02-10
0JFGiWNuJek,Watching with s25 ultra ❤️‍🔥,2025-03-08T06:42:40Z,2025-03-08
0JFGiWNuJek,The S24 Ultra was Samsung's last flagship worthy of the name. A marvelous phone that you can get discounted.,2025-03-31T04:29:13Z,2025-03-31
0JFGiWNuJek,i want the s25 ultra but something tells me go with the s24 ultra because i like the square box and the new s25 fells like a iphone with the curve lines,2025-03-20T09:15:16Z,2025-03-20
0JFGiWNuJek,Siempre cuando compro un nuevo celular elijo el color negro viéndolo desdé mi Samsung S24 ultra 🎉🎉🎉,2024-11-25T18:54:20Z,2024-11-25
0JFGiWNuJek,One of the overall best and best looking smartphones of all time. The only two smartphones that I would choose over the Samsung Galaxy S24 Ultra strictly for their design and cameras are the Samsung Galaxy S23 Ultra and Samsung Galaxy S22 Ultra.,2025-04-25T21:55:59Z,2025-04-25
0JFGiWNuJek,Watching from s24 ultra too❤❤❤,2025-04-20T10:59:58Z,2025-04-20
0JFGiWNuJek,"I've seen the gray and black on people and the black is very beautiful, I just sold my S23U at a good price and I'm going to buy the S24U Black ❤",2024-07-24T04:38:46Z,2024-07-24
0JFGiWNuJek,I will have one of those,2025-03-14T16:19:50Z,2025-03-14
0JFGiWNuJek,My favourite 🥰 mobile,2025-05-11T12:25:39Z,2025-05-11
0JFGiWNuJek,Watching on s 24 ultra,2025-06-16T08:05:15Z,2025-06-16
0JFGiWNuJek,That's the phone thst i have 💪🏼,2025-03-29T20:29:37Z,2025-03-29
0JFGiWNuJek,Watching from Galaxy S24 Ultra Gray,2025-03-06T16:37:40Z,2025-03-06
0JFGiWNuJek,Watching from my s24 ultra titanium black,2025-02-13T07:31:13Z,2025-02-13
0JFGiWNuJek,Watching from s24 ultra black. ❤,2025-01-13T19:34:30Z,2025-01-13
0JFGiWNuJek,What will be the latest after 25 ? I like s24 ultra,2025-03-22T14:58:48Z,2025-03-22
0JFGiWNuJek,I own it now 😊,2025-03-29T04:29:11Z,2025-03-29
0JFGiWNuJek,I have this phone i jad a iphone habe it now for a day wow the s24 ultra is so good,2024-12-28T11:03:19Z,2024-12-28
0JFGiWNuJek,Bende Galaxy S24 Ultra gri titanyum kullanıyorum 😊,2025-04-09T09:17:42Z,2025-04-09
0JFGiWNuJek,Which one better grey or black titanium 😮,2024-02-03T12:47:42Z,2024-02-03
0JFGiWNuJek,Mine arriving tomorrow. Now i'm worried if i should've waited for s25.,2024-12-20T07:08:48Z,2024-12-20
0JFGiWNuJek,Watching on my S24 Ultra titanium grey,2025-03-03T10:34:58Z,2025-03-03
0JFGiWNuJek,I wish it was black🙂,2025-02-01T20:57:28Z,2025-02-01
0JFGiWNuJek,does this color comes in single sim ??,2024-01-27T12:51:27Z,2024-01-27
0JFGiWNuJek,Please anyone suggest which is best colour voilet or black,2025-06-07T17:04:46Z,2025-06-07
0JFGiWNuJek,I also have the same one❤,2024-12-09T09:50:21Z,2024-12-09
0JFGiWNuJek,"Excuse me, I know it's been a long time but I bought an S24 Ultra Titanium Black. Do you remember what that sticker at 0:05 said? Or what is it for? Mine doesn't have it, and I hope it's new. It has everything else, sealed and everything, it's just missing that little sticker",2025-03-26T04:27:47Z,2025-03-26
0JFGiWNuJek,"Which samsung s24u is good , global or Indian?",2025-03-17T15:26:03Z,2025-03-17
0JFGiWNuJek,Nice phone bro,2024-11-16T12:46:15Z,2024-11-16
0JFGiWNuJek,"Dude, use the pull tab!! Using the knife annoyed the OCD in me lol",2025-01-06T06:21:42Z,2025-01-06
0JFGiWNuJek,I am getting a samsung S24 ultra in black,2024-06-23T20:56:53Z,2024-06-23
0JFGiWNuJek,Watching this in my samsung galaxy s25 ultra,2024-06-22T00:33:22Z,2024-06-22
0JFGiWNuJek,Premium ❤,2025-01-01T08:50:06Z,2025-01-01
0JFGiWNuJek,I like the phone and i am sure it will feel very satisfying when holding it. The premium in the world. 💀,2024-05-29T16:27:14Z,2024-05-29
0JFGiWNuJek,Price,2025-05-01T18:38:14Z,2025-05-01
0JFGiWNuJek,Did anyone got this phone from Amazon? Is it safe to buy from Amazon?,2025-05-05T04:52:34Z,2025-05-05
0JFGiWNuJek,❤🎉😢😂,2025-05-07T03:34:47Z,2025-05-07
0JFGiWNuJek,Watching in my s24 ultra sexy premium yellow gold ❤😊,2025-02-22T23:26:10Z,2025-02-22
0JFGiWNuJek,Pay nearly 900 $ and this the package what a joke Samsung,2025-04-20T18:01:03Z,2025-04-20
0JFGiWNuJek,☝️my dream,2025-03-26T10:48:48Z,2025-03-26
0JFGiWNuJek,Сардельки 😅,2025-04-25T22:21:25Z,2025-04-25
0JFGiWNuJek,Hi brother iam 26 iam from india i love samsung 24 my dream to buy it but i cant afford that much pls could u send this is to me thank you,2024-09-03T10:54:50Z,2024-09-03
0JFGiWNuJek,😂🎉,2024-12-04T05:14:56Z,2024-12-04
0JFGiWNuJek,Send my house,2024-12-04T05:14:44Z,2024-12-04
0JFGiWNuJek,benim abimde samsung s24 fe var,2025-04-19T04:40:56Z,2025-04-19
0JFGiWNuJek,Aku jadi pengen deh gue sih punya ayah ku di colong ama orang cok aku juga punya dibuang juga sama lagi mau itu sama case hp lipat fold z5 lagian case nya ada styel sama ada bentukan mirip kaya kaca,2025-03-03T00:55:02Z,2025-03-03
0JFGiWNuJek,Grüsse mit dem S10,2025-05-24T18:47:08Z,2025-05-24
0JFGiWNuJek,نيزك,2025-06-07T12:50:28Z,2025-06-07
0JFGiWNuJek,I finally can say this!!!!! Watching It with my S24 Ultra!!!🎉🎉,2025-06-03T13:59:12Z,2025-06-03
0JFGiWNuJek,Price,2025-06-12T05:50:47Z,2025-06-12
iaXQYD7zRrc,SAMSUNG Galaxy TO ACHA,2025-03-15T02:38:50Z,2025-03-15
iaXQYD7zRrc,😊😊s24ultra,2025-03-23T16:14:16Z,2025-03-23
iaXQYD7zRrc,Mashaallah 🎉Uzbekistan,2025-01-01T02:53:12Z,2025-01-01
iaXQYD7zRrc,😊😅😂,2025-06-07T04:21:03Z,2025-06-07
iaXQYD7zRrc,Naitajitaji  sim  kam  hiii  naipatahe?,2025-06-07T08:04:39Z,2025-06-07
iaXQYD7zRrc,Comment ils faut acheter,2025-06-10T20:20:49Z,2025-06-10
iaXQYD7zRrc,Nombre de la canción 🎵 porfavor,2025-05-02T03:32:23Z,2025-05-02
iaXQYD7zRrc,Raj,2025-05-19T09:29:18Z,2025-05-19
iaXQYD7zRrc,Cool,2024-12-31T23:35:23Z,2024-12-31
iaXQYD7zRrc,Which color is this?,2025-04-28T00:05:39Z,2025-04-28
iaXQYD7zRrc,"Bro, your watch really looks good, can you pls share the brand and model name",2025-05-04T17:09:15Z,2025-05-04
iaXQYD7zRrc,❤,2025-05-19T09:30:38Z,2025-05-19
iaXQYD7zRrc,😂😂😂❤❤❤❤❤❤❤❤❤🎉🎉🎉,2025-05-21T11:03:56Z,2025-05-21
iaXQYD7zRrc,Yeh konsa colr hai,2025-05-30T17:36:43Z,2025-05-30
iaXQYD7zRrc,Black or gray Which is the better colors,2025-04-01T08:45:11Z,2025-04-01
iaXQYD7zRrc,❤❤,2024-12-31T12:25:38Z,2024-12-31
iaXQYD7zRrc,Erfluur riu😮,2025-05-21T11:01:29Z,2025-05-21
iaXQYD7zRrc,S24ultra 😢😢,2025-03-29T05:42:06Z,2025-03-29
iaXQYD7zRrc,Zabardast bhai Masha allah ❤❤❤❤❤❤❤,2025-04-19T10:11:43Z,2025-04-19
