subreddit,title,content
GalaxyA15,Samsung Wallet ,"Is it just me or the app is lagging on my phone, even when i swipe it from home screen, it loads very slow"
GalaxyA15,Internet doesn't work anymore with the last update,"Today I have installed an official update and after reboot internet doesn't work anymore in 4G/5G. Only via wifi. Is there a way to remove this update? For now I solved by selecting 3G/2G in the network settings. I think I will wait for another update, because 5G worked before this update. reset Network settings and reboot December patch?"
GalaxyA15,Anyone else having A15 5G GPS tracking problems?,"When I'm on the highway it suddenly thinks at least a couple times during my trip that I've turned off the route and it recalculates. I already have improved location accuracy turned on. GPS on anything other than an iPhone I've used had accuracy problems. Specifically budget mediatek processors isn't known for its cellular, gps performance. I've used the A15 and it's about the same as every android phone I've used. Yeah me. Sometimes gps signal lost"
GalaxyA15,A15 not charging past 88 percent,Purchased second A15 and this one will not charge past 88%. Called samsung as they wanted to use smart tutor to make sure battery protections were off. This phone will have to be returned to Walmart. Terrible too. First ever failed hardware from Samsung
GalaxyA15,vs A14,"Any differences that are noticeable, outside of the display? Iâ€™m waiting on my A15 I just bought from Straight Talk for free with $45 card purchase. After 60 days Iâ€™ll be moving it to SafeLink. The a15 is definitely alot more snappy, you can play music and the phone will still be usable, better camera (0.5). Ts is my opinion having upgraded a week ago lwk on average it's jst as fast but it's alot better under load"
GalaxyA15,A15 5G sometimes   runs   really   slowly ,"Edit: I turned off the Ram plus feature (all it is, is swap memory) and limited Background processes to 4 (located in dev options) 

phone is like 4 months old. 99% sure its the 4gb ram and 128 gb storage model, running the latest update.

98% we good, but 2% of the time the phone lags super hard and i dont know why that is. i dont play mobile games and i mostly use the phone for social media apps or spotify. 

sometimes i see a notificiation pop up that says ""SYSTEM UI HAS STOPPED RESPONDING"" and gives me the option to wait or close the app.

one time i got curious and tapped the 'close' button and my phone screen went black and the phone became unresponsive, i had to hold the power button untill the phone rebooted.

why is this?  Iâ€™m going to guess here. I only use my a15 as a backup phone so most of the time it sits idle.

Itâ€™s probably the 4gb of memory just not enough these days. Iâ€™ve always gotten my phone with 128/6 i have Galaxy A20 32/3 it runs smoothly on Android 10 One UI 2,1 so Iâ€™m assuming itâ€™s a Android/system issue mostly bcuz ik frm UI 2,1 until 6,1,1 itâ€™s a lot of Samsung branded apps to not lag with 4 but before even 2 or 3 was more than okay I use my A15 as a secondary bc my s20fe just has shit battery but the reason it does that is because your ram is asked to do 2 much and it gets overloaded and it just shuts everything down for a few seconds so it can try again it could also be the same problem but with the chip instead 

My old A12 back when I used it as a primary had the same problem My a14 did this but my a15 dosent Turn off ram plus"
GalaxyA15,Question about AetherSX2/NetherSX2,"So i had this device for about three weeks now, and i can't run AetherSX2 because of how Android 14 blocks write access to the Data folder and AetherSX2 needs to load and write it's bios files from the Data folder. Anyone here managed to get around this problem?

*Update: Well i've managed to solve it."
GalaxyA15,Duel SIMs?,"The A15 has 2 SIM slots, but can I use 2 SIMs or only 1 SIM and an SD? I have the US version. Model # is SM-A156UI/DS. Purchased it in Oct 2024. Check the documentation. It says it supports up to 2 Sim cards or 1 Sim and an optional microSD card."
GalaxyA15,Necesito ayuda urgente,"Tengo un samsung a15 y necesito quitarle la cuenta google porque familiares le compraron un celular a mi abuela y no se acuerdan del correo ni de la contraseÃ±a 

 Reset the phone? By the way if you could use English I could help you more. borra el cel complatamente"
GalaxyA15,SamsungA15phone,"I forgot my password for my secure folder on my Samsung phone and it doesn't have the option to reset,  anyone had the same issue  and solved it. You should get the option to press forgot password then it should explain the steps afterwards It's an option when you first make it, but you may be able to reset through your samsung account"
GalaxyA15,TracFone A15 5G (S156v)--When unlocked will it work on T-Mobile?,"Title has most of it. If it will work, does it have full T-Mobile band support for both 4G LTE and 5G (at least up through mid- or C-band; not concerned with mmWave). Thanks, and if you know where this can be verified or just deduced, please leave a link to a website. Hard to find info on TracFone/Straight Talk models' band support."
GalaxyA15,A15 Samsung galaxy a15 5g camera failed ,
GalaxyA15,A15 Samsung camera is disabled ,"My att samsung galaxy a15 5g 
Camera says failed. I have tried all the troubleshooting. In the settings under camera it says disabled but I am able to screenshot. In the notifications it says camera processing but it will not allow me to enable or uninstall. My camera app opens but has a black screen  Have you tried turning it off and back on. The camera was always very laggy when I had things in the background like a fitness app (fitbit or tile) or even anything really. The phone plays Roblox better than my pixel 7a but really struggles using the camera."
GalaxyA15,What happened,"It just started doing this yesterday. I havent dropped it or anything like this. How do i fix it? Of course you didn't break it, breaks doesn't appear in screenshotsðŸ¤¦â€â™‚ï¸"
GalaxyA15,Post-security Patch Buffering,Anyone else having stream buffering after installing the October 1 security patch? I get it on a stationâ€™s app and Tune-In.
GalaxyA15,Samsung Messages can send but not receive any SMS,"Sorry, Iâ€˜m quite new to posting on Reddit, I didnâ€˜t know how to add text to a question.

Anyway, a friend of mine has this problem where she cannot receive text messages at all, but when she sends me one, I receive it just fine.

Since I have no clue about Android phones, Iâ€˜m struggling to find an answer for this problem.
I hope someone can help, thanks in advance!"
GalaxyA15,phone keeps multiple instances of an facebook open. ,"I have been using Android for 5 years now, I have never had a phone that kept multiple instances of the same app open.

I will go to close some apps because my phone is running slow, and see that I have 15 instances of Facebook open.

as far as i can see its just facebook that does this. 

How can I stop this? it's eating up my Ram and making the phone run like garbage."
GalaxyA15,Screenshots,"I'm having a hell of a time with screenshots. Holding the volume down+power doesn't work. Swiping my palm takes several tries, and ever since I got a screen protector palm swipe doesn't work at all. I don't know what to do. I figured it out. It IS volume down+power, but you just press and release, not hold. https://preview.redd.it/wiohptsd3jtd1.png?width=1080&format=pjpg&auto=webp&s=c05559339a07f8186feaf83034dd7fd15775dd08 Settings display touch sensitivity. Turn on to increase it with a Screensaver. 
*
In the settings you can display the screenshot button here. you don't have a take screenshot button in quick access?   
if not hit the pencil icon and see if its hidden or not 

https://preview.redd.it/jrdoa9xqd7be1.png?width=1080&format=png&auto=webp&s=da5d227ce93ef8351aef8d2762b12c08e081a5fd I have this same problem only on WhatsApp"
GalaxyA15,Wake up screen when receiving a WhatsApp message?,"Is there a way for the screen to turn on when receiving the message? Or some app? Help please! Since the phone is at rest, it does nothing on the screen and I don't realize that the messages have arrived.  Glimpse"
GalaxyA15,Tabs closing,"Has anyone figured out how to keep tabs from closing in the background? I thing with 4 gigs of ram you could keep two open. My s9+ and even s4 didn't have this problem. I already tried the individual app settings, the battery settings, nothing works. I hate this phone same problem. except i normally can keep 3 or 4 apps open at a time. 

turn off battery saver? I have the same problem ;_;"
GalaxyA15,Notification sounds,"Can't find a way to change notification sounds on a per app basis. I get the same sound for a text as I do when Google pics wants me to look at something. I could do it on my old galaxy but not this one.

Got the answer from chat support

Notification settings /advanced settings /manage notification settings for each app/

Go to apps / pick the app you need to change / notifications / change the sound from the default."
GalaxyA15,A15 5g 4/128gb or A15 8/256gb,"i'm thinking to buy samsung A15 but i couldn't decide which one to get. Should i buy the 5g one with 4gb ram or should i get the 8gb ram without the 5g

Thank you.

 I would say go for A15 4G (8/256) as the 5G version isnâ€™t that much faster and much of the world still donâ€™t use common 5G so 4G for now it is still Hi there, well I have the 6gb ram/128 gb version (4g) and it works well for me. Ill say if you have the budget for the 256 gb/8gb 4g model, go for it. I had gotten the a15 5g with 4g ram and it's pretty slow. When diving from app to app, it lags. Open spotify, lags. Select playlist and then change mind and search artist, device lags. I blame it on the phone itself being several models behind. Not sure if thats the cause thoooo as a A15 4/128 user, id get the A15 8/256gb Depends on your network.   If t-mobile 5G is often better so I'd get that version.  AT&T or Verizon, I'd just get 4G until they can get their networks up to speed.  And even that could change based on where you live."
GalaxyA15,Chrome pops up in small window automatically ,"My mom recently got an A15 and and random times, chrome pops up in a small window and some random site loads... I did a scan with Malwarebytes and it said no maleware found. Anyone have this issue or know how to stop it?"
GalaxyA15,Playing an intensive game for a while causes cell service to stop working.,"I have the 4 gig of ram model (US) and when I play intensive roblox games for awhile it causes my phone to be stuck on emergency calls only until I restart it. hope this problem isn't just me. How do you get Roblox to even run on it? I got one of these phones for my daughter, because I saw videos of the phone running roblox. But it keeps bugging out on her phone."
GalaxyA15,Does a15 have screen recording built in,"I know its a ridiculous question but my friedn who just bought the phone cant find the feature so i gotta ask you to make sure This isnâ€™t a â€œridiculousâ€ question. No, the A15 (4G and 5G) do NOT have screen recording built in. For screen recording, you need a 3rd party app. [removed] If it's not in the control panel, you don't have that feature."
GalaxyA15,U dont have circle to search right?,"Asking for a friend who just bought the device Nope, all A series devices donâ€™t have circle to search or any AI features. Only S21 and above have it. Try a GitHub project called MiCTS. It will work if you are lucky! (I have an a15 too and I use it every day)
FYI: it will be laggy and runs on 60hz Whatever you do
PROJECT: https://github.com/parallelcc/MiCTS/blob/main/README_en.md
RELEASES: https://github.com/parallelcc/MiCTS/releases"
GalaxyA15,do you recommend me buying the thing?,"Hey! Title, should I buy it? I come from an android phone that is 3-6times slower, by the words of versus.com. yes It's a decent phone, especially for the price. Also, depends on what you're doing. This is perfect for general use. If you plan on photos and videos be aware it doesn't have image stabilization. Videos are going to look shaky if you have a shaky hand (especially with zoomed). It doesn't get super hot if playing a heavy game. Did you get it? Quite happy with the unlocked version from staples who price matched wallymart. I replaced my S8 which had a dying battery. Would get 8g ram if that option was available if doing it again. That version showed up 2w after I bought this one."
GalaxyA15,Blurry MMS,"Does anybody else have trouble with sending and receiving MMS messages?
They all come through pixilated with really bad sound quality."
GalaxyA15,"just bought a A15, its great","my opinion, after using this phone for a few days...its pretty decent. very smooth. 

walmart sells the onn brand screen protectors and a decent case, for less than $20 CAD Agreed, phone is awesome. Ive spent the last 4 days getting acclimated.  I`m looming for any tips or tricks of the trade, this is my foist android phone I'm thinking about either this one or a moto power or a google pixel for my next phone. Moto doesn't get glowing reviews and the Pixels are pricey so this might be the one. The only thing I don't really like is the Samsung ecosystem/apps overlap with general android. I have the A51 5G currently which has been a good phone but has reached the end of its support/upgrade life. I just bought it yesterday and it's 1000% better than my old iPhone 13 mini"
GalaxyA15,How do I get rid of this symbol?,"Hold auto rotate button on quick panel and turn this off

https://preview.redd.it/u89b8jx8gpod1.jpeg?width=1080&format=pjpg&auto=webp&s=cd6bf18e6cd8e3500609ec3718f4df99324ef41c"
GalaxyA15,A156U1 (A15 5G unlocked models) now get One UI 6.1!,How
GalaxyA15,Anybody know when the A156U1 (U1/DS) will get One UI 6.1?,When will the A156U1/DS get One UI 6.1? Yâ€™all ainâ€™t getting it for a while since the U1/DS variants get it the very last Oh ðŸ¥² What's the One UI 6.1 for?
GalaxyA15,"Surprise, Surprise! Galaxy A15 5G gets One UI 6.1 update!",The 4G version I have just got the update to! When fir the U1 model
